,English,English_cleaned,Spanish,French,German
530,i ran for mayor,i ran for mayor,me postulé para alcalde,je me suis présenté à la mairie,Ich kandidierte für das Bürgermeisteramt
531,i rang the bell,i rang the bell,toqué el timbre,j'ai sonné la cloche,Ich klingelte
532,i read his book,i read his book,leí su libro,j'ai lu son livre,Ich habe sein Buch gelesen
533,i read the book,i read the book,leí el libro,je lis le livre,Ich habe das Buch gelesen
534,i refuse to pay,i refuse to pay,me niego a pagar,je refuse de payer,Ich verweigere die Zahlung
535,i relied on tom,i relied on tom,confié en tom,je me suis fié à tom,Ich habe mich auf Tom verlassen
536,i relied on him,i relied on him,confié en él,je me suis appuyé sur lui,ich habe mich auf ihn verlassen
537,i remember that,i remember that,yo recuerdo eso,Je me souviens que,Ich erinnere mich daran
538,i remember them,i remember them,los recuerdo,je me souviens d'eux,ich erinnere mich an sie
539,i remember this,i remember this,yo recuerdo esto,je me rappelle de ça,ich erinnere mich daran
540,i remembered it,i remembered it,lo recordé,je m'en suis souvenu,ich erinnerte mich daran
541,i run every day,i run every day,yo corro todos los dias,Je cours chaque jour,Ich renne jeden Tag
542,i said i'm fine,i said i am fine,dije que estoy bien,j'ai dit que je vais bien,"Ich sagte, mir geht es gut"
543,i said sit down,i said sit down,dije siéntate,j'ai dit asseyez-vous,"Ich sagte, setz dich"
544,i saw tom naked,i saw tom naked,vi a tom desnudo,j'ai vu tom nu,Ich habe Tom nackt gesehen
545,i saw her again,i saw her again,la vi de nuevo,je l'ai revue,Ich habe sie wieder gesehen
546,i saw him do it,i saw him do it,lo vi hacerlo,je l'ai vu faire,Ich habe ihn dabei gesehen
547,i saw him naked,i saw him naked,lo vi desnudo,je l'ai vu nu,Ich habe ihn nackt gesehen
548,i saw him there,i saw him there,lo vi allí,je l'ai vu là,Ich habe ihn dort gesehen
549,i saw it coming,i saw it coming,lo vi venir,je l'ai vu venir,Ich habe es kommen sehen
550,i saw something,i saw something,vi algo,j'ai vu quelque chose,ich habe etwas gesehen
551,i saw the fight,i saw the fight,vi la pelea,j'ai vu le combat,Ich habe den Kampf gesehen
552,i saw the movie,i saw the movie,vi la película,J'ai vu le film,Ich sah den Film
553,i saw you there,i saw you there,te vi alli,je t'ai vu là,ich habe dich dort gesehen
554,i scored a goal,i scored a goal,Marqué un gol,j'ai marqué un but,Ich habe ein Tor geschossen
555,i see a pattern,i see a pattern,veo un patrón,je vois un motif,Ich sehe ein Muster
556,i see his house,i see his house,veo su casa,je vois sa maison,Ich sehe sein Haus
557,i see something,i see something,veo algo,je vois quelque chose,ich sehe etwas
558,i seldom go out,i seldom go out,rara vez salgo,je sors rarement,ich gehe selten aus
559,i slept all day,i slept all day,dormí todo el día,J'ai dormi toute la journée,ich schlief den ganzen Tag
560,i smell trouble,i smell trouble,huelo problemas,Je sens des problèmes,Ich rieche Ärger
561,i smelled bacon,i smelled bacon,olí tocino,j'ai senti le bacon,Ich roch Speck
562,i still do that,i still do that,todavía hago eso,je fais toujours ça,das mache ich immer noch
563,i study english,i study english,yo estudio ingles,j'étudie l'anglais,Ich lerne Englisch
564,i take vitamins,i take vitamins,tomo vitaminas,je prends des vitamines,Ich nehme Vitamine
565,i talked to her,i talked to her,Hablé con ella,je lui ai parlé,Ich habe mit ihr geredet
566,i think i agree,i think i agree,creo que estoy de acuerdo,je pense que je suis d'accord,"Ich denke, ich stimme zu"
567,i think it's ok,i think it is ok,creo que está bien,je pense que c'est bon,Ich denke es ist ok
568,"i think so, too",i think so  too,yo tambien lo creo,Je le pense aussi,Das denke ich auch
569,i totally agree,i totally agree,Estoy totalmente de acuerdo,Je suis entièrement d'accord,Ich bin vollkommen einverstanden
570,i turned it off,i turned it off,lo apagué,je l'ai éteint,ich habe es ausgeschaltet
571,i understand it,i understand it,Yo lo entiendo,Je comprends bien,ich verstehe es
572,i use this desk,i use this desk,yo uso este escritorio,j'utilise ce bureau,Ich benutze diesen Schreibtisch
573,i walked my dog,i walked my dog,paseé a mi perro,J'ai promené mon chien,Ich habe meinen Hund ausgeführt
574,i want a doctor,i want a doctor,quiero un medico,je veux un docteur,Ich möchte einen Arzt
575,i want a family,i want a family,quiero una familia,je veux une famille,Ich möchte eine Familie
576,i want a lawyer,i want a lawyer,quiero un abogado,je veux un avocat,Ich will einen Anwalt
577,i want a parrot,i want a parrot,quiero un loro,je veux un perroquet,Ich möchte einen Papagei
578,i want a refund,i want a refund,quiero un reembolso,je veux un remboursement,Ich will eine Rückerstattung
579,i want an apple,i want an apple,quiero una manzana,Je veux une pomme,ich will einen Apfel
580,i want children,i want children,Quiero hijos,je veux des enfants,ich will Kinder
581,i want my money,i want my money,Quiero mi dinero,Je veux mon argent,Ich möchte mein Geld
582,i want my stuff,i want my stuff,quiero mis cosas,je veux mes affaires,Ich will meine Sachen
583,"i want one, too",i want one  too,Yo quiero uno también,J'en veux un aussi,ich will auch eins
584,i want that bag,i want that bag,quiero esa bolsa,je veux ce sac,Ich will diese Tasche
585,i want that cat,i want that cat,quiero ese gato,je veux ce chat,Ich will diese Katze
586,i want that job,i want that job,quiero ese trabajo,je veux ce travail,Ich will diesen Job
587,i want the best,i want the best,quiero lo mejor,je veux le meilleur,Ich will das Beste
588,i want this bag,i want this bag,quiero esta bolsa,je veux ce sac,Ich will diese Tasche
589,i want this cat,i want this cat,quiero este gato,je veux ce chat,Ich will diese Katze
590,i want this dog,i want this dog,quiero este perro,je veux ce chien,Ich will diesen Hund
591,i want this one,i want this one,quiero este,je veux celui-ci,Ich will dieses
592,i want to dance,i want to dance,Quiero bailar,Je veux danser,ich will tanzen
593,i want to do it,i want to do it,Quiero hacerlo,je veux le faire,Ich möchte es tun
594,i want to dream,i want to dream,quiero soñar,je veux rêver,ich möchte träumen
595,i want to drive,i want to drive,quiero conducir,Je veux conduire,ich möchte fahren
596,i want to fight,i want to fight,quiero pelear,je veux me battre,Ich will kämpfen
597,i want to sleep,i want to sleep,quiero dormir,je veux dormir,Ich möchte schlafen
598,i want to speak,i want to speak,quiero hablar,Je veux parler,Ich möchte sprechen
599,i want to watch,i want to watch,quiero ver,je veux regarder,Ich möchte schauen
600,i want you back,i want you back,Te quiero de vuelta,Je veux que tu reviennes,ich möchte dich zurück haben
601,i want you gone,i want you gone,quiero que te vayas,je veux que tu partes,"Ich will, dass du weg bist"
602,i wanted to cry,i wanted to cry,yo quería llorar,Je veux pleurer,ich wollte weinen
603,i wanted to die,i wanted to die,quería morir,je voulais mourir,ich wollte sterben
604,i wanted to pay,i wanted to pay,quería pagar,je voulais payer,ich wollte bezahlen
605,i wanted to win,i wanted to win,quería ganar,je voulais gagner,ich wollte gewinnen
606,i was a teacher,i was a teacher,yo era profesor,j'étais enseignant,Ich war ein Lehrer
607,i was a witness,i was a witness,fui testigo,j'ai été témoin,Ich war Zeuge
608,i was acquitted,i was acquitted,fui absuelto,j'ai été acquitté,ich wurde freigesprochen
609,i was assaulted,i was assaulted,me asaltaron,j'ai été agressé,ich wurde angegriffen
610,i was at school,i was at school,Yo estaba en la escuela,J'étais à l'école,Ich war in der Schule
611,i was born here,i was born here,yo nací aquí,je suis né ici,ich wurde hier geboren
612,i was concerned,i was concerned,Estaba preocupado,j'étais concerné,Ich war besorgt
613,i was confident,i was confident,estaba seguro,j'étais confiant,Ich war zuversichtlich
614,i was convicted,i was convicted,fui condenado,j'ai été condamné,ich wurde verurteilt
615,i was disgusted,i was disgusted,estaba disgustado,j'étais dégoûté,Ich war angewidert
616,i was dismissed,i was dismissed,me despidieron,j'ai été licencié,ich wurde entlassen
617,i was exhausted,i was exhausted,Yo estaba agotado,j'étais épuisé,ich war erschöpft
618,i was horrified,i was horrified,estaba horrorizado,j'étais horrifié,Ich war entsetzt
619,i was impressed,i was impressed,estaba impresionado,Je ai été impressionné,ich war beeindruckt
620,i was in a coma,i was in a coma,estaba en coma,j'étais dans le coma,Ich lag im Koma
621,i was in charge,i was in charge,Yo estaba a cargo,J'étais en charge,Ich war zuständig
622,i was intrigued,i was intrigued,Yo estaba intrigado,j'étais intrigué,Ich war fasziniert
623,i was kidnapped,i was kidnapped,me secuestraron,j'ai été kidnappé,ich wurde entführt
624,i was not drunk,i was not drunk,no estaba borracho,je n'étais pas ivre,Ich war nicht betrunken
625,i was on patrol,i was on patrol,estaba de patrulla,j'étais en patrouille,Ich war auf Patrouille
626,i was petrified,i was petrified,estaba petrificado,j'étais pétrifié,ich war versteinert
627,i was satisfied,i was satisfied,Yo estaba satisfecho,j'étais satisfait,ich war zufrieden
628,i was sent home,i was sent home,me enviaron a casa,j'ai été renvoyé chez moi,Ich wurde nach Hause geschickt
629,i was skeptical,i was skeptical,estaba escéptico,j'étais sceptique,ich war skeptisch
630,i was surprised,i was surprised,Me sorprendió,J'ai été surpris,ich war überrascht
631,i was terrified,i was terrified,estaba aterrado,j'étais terrifié,ich war schockiert
632,i was too small,i was too small,yo era demasiado pequeño,j'étais trop petit,ich war zu klein
633,i wasn't asleep,i was not asleep,no estaba dormido,je ne dormais pas,Ich habe nicht geschlafen
634,i wasn't joking,i was not joking,no estaba bromeando,je ne plaisantais pas,Ich habe nicht gescherzt
635,i went for help,i went for help,fui por ayuda,je suis allé chercher de l'aide,Ich ging um Hilfe
636,i will continue,i will continue,Continuaré,Je vais continuer,Ich werde fortsetzen
637,i will go at 10,i will go at 10,iré a las 10,j'irai à 10,Ich gehe um 10
638,i will help you,i will help you,te ayudaré,je t'aiderai,ich werde dir helfen
639,i will kill you,i will kill you,te mataré,Je vais vous tuer,ich werde dich töten
640,i will miss you,i will miss you,te extrañaré,Vous allez me manquer,Ich werde dich vermissen
641,i will stop you,i will stop you,te detendré,je vais t'arrêter,Ich werde dich aufhalten
642,i will warn him,i will warn him,le advertiré,je vais le prévenir,Ich werde ihn warnen
643,i will watch it,i will watch it,Lo veré,je vais le regarder,Ich werde es anschauen
644,i wish you luck,i wish you luck,te deseo suerte,je te souhaite bonne chance,Ich wünsche Ihnen Glück
645,i won the fight,i won the fight,gané la pelea,j'ai gagné le combat,Ich habe den Kampf gewonnen
646,i won't be late,i will not be late,no llegaré tarde,je ne serai pas en retard,Ich werde nicht zu spät kommen
647,i won't be long,i will not be long,No seré largo,je ne serai pas long,Ich werde nicht lange
648,i won't buy one,i will not buy one,no voy a comprar uno,je n'en achèterai pas,Ich werde keine kaufen
649,i won't do that,i will not do that,no haré eso,je ne ferai pas ca,Ich werde das nicht tun
650,i won't give up,i will not give up,no voy a renunciar,Je ne vais pas abandonner,Ich werde nicht aufgeben
651,i won't risk it,i will not risk it,no me arriesgaré,je ne m'y risquerai pas,Ich werde es nicht riskieren
652,i won't shut up,i will not shut up,no me callaré,je ne vais pas me taire,Ich werde nicht die Klappe halten
653,i work at a zoo,i work at a zoo,trabajo en un zoológico,je travaille dans un zoo,Ich arbeite in einem Zoo
654,i work too much,i work too much,yo trabajo demasiado,je travaille trop,ich arbeite zu viel
655,i work two jobs,i work two jobs,tengo dos trabajos,je travaille deux emplois,Ich arbeite zwei Jobs
656,i work with him,i work with him,trabajo con el,je travaille avec lui,ich arbeite mit ihm
657,i wouldn't care,i wouldn t care,no me importaría,je m'en fiche,es wäre mir egal
658,i yelled at tom,i yelled at tom,le grité a tom,j'ai crié à tom,Ich schrie Tom an
659,i'd be grateful,i would be grateful,Agradecería,Je vous serais reconnaissant,Ich wäre dankbar
660,i'd do it again,i would do it again,lo haría de nuevo,Je le ferais à nouveau,Ich würde es wieder tun
661,i'd like a beer,i would like a beer,me gustaría una cerveza,je voudrais une bière,Ich hätte gern ein Bier
662,i'd like a fork,i would like a fork,quisiera un tenedor,je voudrais une fourchette,Ich hätte gerne eine Gabel
663,i'd like to eat,i would like to eat,me gustaría comer,Je voudrais manger,Ich würde gerne essen
664,i'd rather read,i would rather read,prefiero leer,je préfère lire,Ich würde lieber lesen
665,i'd rather stay,i would rather stay,prefiero quedarme,je préfère rester,Ich bleibe lieber
666,i'd rather walk,i would rather walk,prefiero caminar,je préfère marcher,Ich gehe lieber zu Fuß
667,i'll allow this,i will allow this,permitiré esto,je vais permettre cela,ich werde dies zulassen
668,i'll arrange it,i will arrange it,lo arreglaré,je vais arranger ça,Ich werde es arrangieren
669,i'll ask around,i will ask around,preguntaré por ahí,je vais demander autour de moi,Ich werde mich umhören
670,i'll assist you,i will assist you,te ayudaré,je vais t'aider,Ich werde dir helfen
671,i'll be at home,i will be at home,estaré en casa,je serai à la maison,Ich werde zu Hause sein
672,i'll be careful,i will be careful,sere cuidadoso,je serai prudent,Ich werde vorsichtig sein
673,i'll be glad to,i will be glad to,estaré encantado de,je serai ravi de,ich werde glücklich sein zu
674,i'll be in town,i will be in town,estaré en la ciudad,je serai en ville,Ich werde in der Stadt sein
675,i'll be on time,i will be on time,estare a tiempo,je serai à l'heure,ich komme pünktlich
676,i'll be present,i will be present,Yo estaré presente,Je serai présent,ich werde anwesend sein
677,i'll be working,i will be working,estaré trabajando,je serais en train de travailler,Ich werde arbeiten
678,i'll bring wine,i will bring wine,traeré vino,j'apporterai du vin,Ich bringe Wein
679,i'll buy a ford,i will buy a ford,voy a comprar un ford,je vais acheter une ford,Ich werde mir einen Ford kaufen
680,i'll come by 10,i will come by 10,llego a las 10,je viendrai à 10,Ich komme um 10
681,i'll destroy it,i will destroy it,lo destruiré,je vais le détruire,Ich werde es zerstören
682,i'll do my best,i will do my best,Haré mi mejor esfuerzo,je ferai de mon mieux,Ich werde mein Bestes geben
683,i'll find a way,i will find a way,encontrare una manera,je vais trouver un moyen,ich werde einen Weg finden
684,i'll fix it now,i will fix it now,lo arreglaré ahora,je vais le réparer maintenant,Ich werde es jetzt reparieren
685,i'll follow you,i will follow you,te seguiré,je te suivrai,ich werde dir folgen
686,i'll go ask tom,i will go ask tom,iré a preguntarle a tom,je vais demander à tom,Ich werde Tom fragen
687,i'll just leave,i will just leave,simplemente me iré,je vais juste partir,Ich werde einfach gehen
688,i'll never stop,i will never stop,Yo nunca parare,je n'arrêterai jamais,ich werde nie aufhören
689,i'll never tell,i will never tell,nunca lo diré,Je ne dirai jamais,Ich werde es nie sagen
690,i'll order food,i will order food,pediré comida,je vais commander de la nourriture,Ich werde Essen bestellen
691,i'll pay double,i will pay double,voy a pagar el doble,je paierai le double,Ich werde das Doppelte bezahlen
692,i'll pay for it,i will pay for it,yo pagaré por ello,je vais le payer,Ich werde dafür bezahlen
693,i'll play along,i will play along,seguiré el juego,je jouerai le long,Ich werde mitspielen
694,i'll rent a car,i will rent a car,voy a alquilar un coche,je louerai une voiture,Ich werde ein Auto mieten
695,i'll sing today,i will sing today,voy a cantar hoy,je chanterai aujourd'hui,Ich werde heute singen
696,i'll sleep here,i will sleep here,dormiré aquí,je dormirai ici,Ich werde hier schlafen
697,i'll stay close,i will stay close,me quedaré cerca,je resterai proche,Ich werde in der Nähe bleiben
698,i'll take those,i will take those,tomaré esos,je vais prendre ceux,die nehme ich
699,i'll try harder,i will try harder,me esforzaré más,je vais essayer plus fort,ich werde mich mehr bemühen
700,i'll work alone,i will work alone,trabajaré solo,je travaillerai seul,Ich werde alleine arbeiten
701,i'm a tv addict,i am a tv addict,soy un adicto a la televisión,je suis accro à la télé,ich bin fernsehsüchtig
702,i'm a bit drunk,i am a bit drunk,estoy un poco borracho,je suis un peu ivre,Ich bin ein bisschen betrunken
703,i'm a bit tipsy,i am a bit tipsy,estoy un poco borracho,je suis un peu pompette,ich bin etwas beschwipst
704,i'm a bit tired,i am a bit tired,estoy un poco cansado,je suis un peu fatigué,Ich bin ein bisschen müde
705,i'm a cameraman,i am a cameraman,soy un camarógrafo,je suis caméraman,Ich bin Kameramann
706,i'm a detective,i am a detective,soy un detective,je suis un détective,Ich bin ein Detektiv
707,i'm a foreigner,i am a foreigner,soy un extranjero,Je suis étranger,ich bin ein Ausländer
708,i'm a geologist,i am a geologist,soy geólogo,je suis géologue,Ich bin Geologe
709,i'm a good cook,i am a good cook,soy un buen cocinero,je suis un bon cuisinier,Ich bin ein guter Koch
710,i'm a happy man,i am a happy man,soy un hombre feliz,je suis un homme heureux,Ich bin ein glücklicher Mann
711,i'm a housewife,i am a housewife,Soy ama de casa,Je suis une femme au foyer,Ich bin eine Hausfrau
712,i'm a lifeguard,i am a lifeguard,soy salvavidas,je suis sauveteur,Ich bin Rettungsschwimmer
713,i'm a lucky man,i am a lucky man,Soy un hombre afortunado,je suis un homme chanceux,Ich bin ein glücklicher Mann
714,i'm a masochist,i am a masochist,soy masoquista,je suis masochiste,Ich bin ein Masochist
715,i'm a night owl,i am a night owl,Soy un ave nocturna,Je suis un oiseau de nuit,Ich bin eine Nachteule
716,i'm a smart guy,i am a smart guy,soy un chico inteligente,je suis un gars intelligent,Ich bin ein kluger Kerl
717,i'm a smart man,i am a smart man,soy un hombre inteligente,je suis un homme intelligent,Ich bin ein kluger Mann
718,i'm a volunteer,i am a volunteer,soy un voluntario,je suis bénévole,Ich bin ein Freiwilliger
719,i'm able to run,i am able to run,soy capaz de correr,je suis capable de courir,Ich kann laufen
720,i'm able to ski,i am able to ski,soy capaz de esquiar,je sais skier,Ich kann Ski fahren
721,i'm about ready,i am about ready,estoy casi listo,je suis presque prêt,Ich bin bereit
722,i'm about to go,i am about to go,estoy a punto de ir,je suis sur le point d'y aller,Ich bin dabei zu gehen
723,i'm adventurous,i am adventurous,soy aventurero,je suis aventureux,Ich bin abenteuerlustig
724,i'm an attorney,i am an attorney,soy un abogado,je suis avocat,Ich bin Anwalt
725,i'm an engineer,i am an engineer,Soy un ingeniero,Je suis ingénieur,Ich bin Ingenieur
726,i'm at my place,i am at my place,estoy en mi lugar,je suis chez moi,Ich bin bei mir
727,i'm at the bank,i am at the bank,estoy en el banco,je suis à la banque,Ich bin bei der Bank
728,i'm at work now,i am at work now,estoy en el trabajo ahora,je suis au travail aujourd'hui,Ich bin jetzt auf der Arbeit
729,i'm begging you,i am begging you,te lo ruego,Je vous en supplie,ich flehe dich an
730,i'm calling tom,i am calling tom,estoy llamando a tom,j'appelle tom,Ich rufe Tom an
731,i'm calling you,i am calling you,te estoy llamando,je t'appelle,ich rufe dich an
732,i'm catching on,i am catching on,me estoy dando cuenta,je me rattrape,ich fasse an
733,i'm celebrating,i am celebrating,estoy celebrando,je fête,ich feiere
734,i'm cleaned out,i am cleaned out,estoy limpio,je suis nettoyé,ich bin ausgeräumt
735,i'm color-blind,i am color blind,soy daltónico,je suis daltonien,ich bin farbenblind
736,i'm comfortable,i am comfortable,Me siento cómodo,Je suis à l'aise,Mir geht's gut
737,i'm coming home,i am coming home,estoy yendo a casa,je rentre à la maison,Ich komme nach Hause
738,i'm cooking now,i am cooking now,estoy cocinando ahora,je suis en train de cuisiner,Ich koche jetzt
739,i'm cooperating,i am cooperating,estoy cooperando,je coopère,ich kooperiere
740,i'm cracking up,i am cracking up,me estoy desmoronando,je craque,ich breche zusammen
741,i'm defenseless,i am defenseless,estoy indefenso,je suis sans défense,ich bin wehrlos
742,i'm eating here,i am eating here,estoy comiendo aquí,je mange ici,Ich esse hier
743,i'm embarrassed,i am embarrassed,estoy avergonzado,Je suis embarrassé,Es ist mir peinlich
744,i'm experienced,i am experienced,tengo experiencia,je suis expérimenté,ich bin erfahren
745,i'm extroverted,i am extroverted,soy extrovertido,je suis extravertie,Ich bin extrovertiert
746,i'm feeling fit,i am feeling fit,me siento en forma,je me sens en forme,ich fühle mich fit
747,i'm feeling low,i am feeling low,me siento bajo,je me sens faible,Ich fühle mich niedergeschlagen
748,i'm frying fish,i am frying fish,estoy friendo pescado,je fais frire du poisson,Ich brate Fisch
749,i'm getting old,i am getting old,estoy envejeciendo,Je deviens vieux,ich werde alt
750,i'm going crazy,i am going crazy,Me estoy volviendo loco,je deviens fou,ich werde verrückt
751,i'm happy today,i am happy today,hoy estoy feliz,je suis heureux aujourd'hui,Ich bin heute glücklich
752,i'm hardworking,i am hardworking,soy trabajador,je travaille dur,ich arbeite hart
753,i'm heartbroken,i am heartbroken,Tengo el corazón partido,J'ai le cœur brisé,mein Herz ist gebrochen
754,i'm here to win,i am here to win,estoy aquí para ganar,je suis ici pour gagner,"Ich bin hier, um zu gewinnen"
755,i'm in no hurry,i am in no hurry,no tengo prisa,je ne suis pas pressé,Ich habe keine Eile
756,i'm in training,i am in training,estoy en entrenamiento,Je suis en formation,ich bin in der ausbildung
757,i'm interfering,i am interfering,estoy interfiriendo,j'interfère,ich mische mich ein
758,i'm introverted,i am introverted,soy introvertido,je suis introverti,Ich bin introvertiert
759,i'm leaving now,i am leaving now,me voy ahora,Je pars maintenant,ich gehe jetzt
760,i'm left-handed,i am left handed,soy zurdo,je suis gaucher,Ich bin Linkshänder
761,i'm lucky today,i am lucky today,tengo suerte hoy,j'ai de la chance aujourd'hui,Ich habe heute Glück
762,i'm married now,i am married now,estoy casado ahora,je suis marié maintenant,Ich bin jetzt verheiratet
763,i'm nearsighted,i am nearsighted,soy miope,je suis myope,ich bin kurzsichtig
764,i'm needed here,i am needed here,soy necesario aqui,on a besoin de moi ici,ich werde hier gebraucht
765,i'm new to this,i am new to this,Soy nuevo en esto,je suis nouveau dans ce domaine,ich bin neu dabei
766,i'm not a child,i am not a child,no soy un niño,je ne suis pas un enfant,Ich bin kein Kind
767,i'm not a crook,i am not a crook,Yo no soy un estafador,Je ne suis pas un escroc,Ich bin kein Gauner
768,i'm not a drunk,i am not a drunk,no soy un borracho,je ne suis pas ivre,ich bin kein betrunkener
769,i'm not a robot,i am not a robot,No soy un robot,Je ne suis pas un robot,Ich bin kein Roboter
770,i'm not a saint,i am not a saint,no soy un santo,je ne suis pas un saint,Ich bin kein Heiliger
771,i'm not a thief,i am not a thief,no soy un ladrón,je ne suis pas un voleur,Ich bin kein Dieb
772,i'm not alarmed,i am not alarmed,no estoy alarmado,je ne suis pas alarmé,ich bin nicht beunruhigt
773,i'm not arguing,i am not arguing,no estoy discutiendo,je ne discute pas,ich streite nicht
774,i'm not ashamed,i am not ashamed,Yo no estoy avergonzado,je n'ai pas honte,ich schäme mich nicht
775,i'm not certain,i am not certain,no estoy seguro,Je ne suis pas certain,Ich bin mir nicht sicher
776,i'm not chicken,i am not chicken,no soy pollo,je ne suis pas un poulet,Ich bin kein Huhn
777,i'm not cooking,i am not cooking,no estoy cocinando,je ne cuisine pas,ich koche nicht
778,i'm not jealous,i am not jealous,no estoy celoso,je ne suis pas jaloux,ich bin nicht eifersüchtig
779,i'm not kidding,i am not kidding,No estoy bromeando,Je ne plaisante pas,ich mache keinen Spaß
780,i'm not leaving,i am not leaving,no me voy,je ne pars pas,Ich gehe nicht
781,i'm not married,i am not married,No estoy casado,je ne suis pas marié,ich bin nicht verheiratet
782,i'm not nervous,i am not nervous,no estoy nervioso,je ne suis pas nerveux,ich bin nicht nervös
783,i'm not on duty,i am not on duty,no estoy de servicio,je ne suis pas de service,Ich bin nicht im Dienst
784,i'm not patient,i am not patient,no soy paciente,je ne suis pas patient,ich bin nicht geduldig
785,i'm not perfect,i am not perfect,no soy perfecto,je ne suis pas parfait,ich bin nicht perfekt
786,i'm not selfish,i am not selfish,no soy egoísta,je ne suis pas égoïste,Ich bin nicht egoistisch
787,i'm not so sure,i am not so sure,No estoy tan seguro,je ne suis pas si sur,ich bin nicht sicher
788,i'm not staying,i am not staying,no me quedo,je ne reste pas,ich bleibe nicht
789,i'm not unhappy,i am not unhappy,no soy infeliz,je ne suis pas mécontent,ich bin nicht unglücklich
790,i'm not wealthy,i am not wealthy,no soy rico,je ne suis pas riche,Ich bin nicht reich
791,i'm not worried,i am not worried,no estoy preocupado,je ne suis pas inquiet,Ich mache mir keine Sorgen
792,i'm now unarmed,i am now unarmed,ahora estoy desarmado,je suis maintenant désarmé,Ich bin jetzt unbewaffnet
793,i'm on the road,i am on the road,estoy en el camino,je suis sur la route,Ich bin auf der Straße
