,English,English_cleaned,Spanish,French,German
464,draw a small circle,draw a small circle,dibuja un pequeño círculo,tracer un petit cercle,einen kleinen Kreis zeichnen
465,eat more vegetables,eat more vegetables,come mas vegetales,mange plus de légumes,Iss mehr Gemüse
466,eat your vegetables,eat your vegetables,come tus vegetales,mange tes légumes,Iss Dein Gemüse
467,enjoy your holidays,enjoy your holidays,Disfruta tus vacaciones,Profitez de vos vacances,genieße deine Ferien
468,enjoy your vacation,enjoy your vacation,disfruta tus vacaciones,Profitez de vos vacances,genieß deinen Urlaub
469,every minute counts,every minute counts,cada minuto cuenta,chaque minute compte,Jede Minute zählt
470,every seat was full,every seat was full,cada asiento estaba lleno,chaque siège était plein,jeder Platz war voll
471,everybody applauded,everybody applauded,todos aplaudieron,tout le monde a applaudi,alle applaudierten
472,everybody does that,everybody does that,todo el mundo hace eso,tout le monde fait ça,jeder tut das
473,everybody hates tom,everybody hates tom,todos odian a tom,tout le monde déteste tom,alle hassen tom
474,everybody hates you,everybody hates you,todo el mundo te odia,tout le monde te déteste,jeder hasst dich
475,everybody liked tom,everybody liked tom,a todos les gustaba tom,tout le monde aimait tom,alle mochten tom
476,everybody liked you,everybody liked you,le gustabas a todo el mundo,tout le monde t'a aimé,alle mochten dich
477,everybody likes tom,everybody likes tom,a todo el mundo le gusta tom,tout le monde aime Tom,Jeder mag Tom
478,everybody likes her,everybody likes her,A todos les gusta ella,tout le monde l'aime,alle mögen sie
479,everybody likes him,everybody likes him,a todo el mundo le gusta,tout le monde l'aime,jeder mag ihn
480,everybody likes you,everybody likes you,todo el mundo te quiere,tout le monde t'aime,jeder mag dich
481,everybody loved tom,everybody loved tom,todos amaban a tom,tout le monde aimait tom,alle liebten tom
482,everybody loves her,everybody loves her,todos la aman,tout le monde l'aime,jeder liebt sie
483,everybody loves him,everybody loves him,todos lo aman,tout le monde l'aime,jeder liebt ihn
484,everybody needs one,everybody needs one,todo el mundo necesita uno,tout le monde en a besoin,jeder braucht einen
485,everybody's so busy,everybody s so busy,todo el mundo está tan ocupado,tout le monde est si occupé,alle sind so beschäftigt
486,everyone has faults,everyone has faults,todo el mundo tiene defectos,tout le monde a des défauts,jeder hat fehler
487,everyone is special,everyone is special,todo el mundo es especial,tout le monde est spécial,jeder ist besonders
488,everyone kept quiet,everyone kept quiet,todos se quedaron callados,tout le monde s'est tu,alle schwiegen
489,everyone knows that,everyone knows that,todos saben eso,tout le monde sait ça,Jeder weiss das
490,everyone likes them,everyone likes them,a todos les gustan,tout le monde les aime,jeder mag sie
491,everyone wants that,everyone wants that,todos quieren eso,tout le monde veut ça,jeder will das
492,everyone was asleep,everyone was asleep,todos estaban dormidos,tout le monde dormait,alle schliefen
493,everyone was hungry,everyone was hungry,todos tenían hambre,tout le monde avait faim,alle waren hungrig
494,everyone was killed,everyone was killed,todos fueron asesinados,tout le monde a été tué,alle wurden getötet
495,everyone's a winner,everyone s a winner,todos son ganadores,tout le monde est gagnant,jeder ist ein Gewinner
496,everyone's laughing,everyone s laughing,todos se ríen,tout le monde rit,jeder lacht
497,everyone's relieved,everyone s relieved,todos están aliviados,tout le monde est soulagé,alle sind erleichtert
498,everyone's standing,everyone s standing,todo el mundo está de pie,tout le monde est debout,alle stehen
499,everyone's watching,everyone s watching,todo el mundo está mirando,tout le monde regarde,alle schauen zu
500,"everyone, follow me",everyone  follow me,todos siganme,tout le monde me suit,Alle folgen mir
501,everything is great,everything is great,todo esta bien,tout est bon,alles ist ganz toll
502,everything is quiet,everything is quiet,Todo está tranquilo,tout est calme,alles ist ruhig
503,everything is ready,everything is ready,todo está listo,tout est prêt,alles ist bereit
504,everything is tough,everything is tough,todo es dificil,tout est dur,alles ist hart
505,everything's ok now,everything s ok now,ahora todo esta bien,tout va bien maintenant,alles ist jetzt ok
506,evil sometimes wins,evil sometimes wins,el mal a veces gana,le mal gagne parfois,Das Böse gewinnt manchmal
507,"excuse me, i'm lost",excuse me  i am lost,disculpe estoy perdido,excusez moi je suis perdu,"Entschuldigung, ich bin verloren"
508,family is important,family is important,La familia es importante,la famille est importante,Familie ist wichtig
509,few people think so,few people think so,poca gente piensa asi,peu de gens le pensent,wenige Leute denken so
510,fish is cheap today,fish is cheap today,el pescado es barato hoy,le poisson est bon marché aujourd'hui,Fisch ist heute billig
511,forget your sorrows,forget your sorrows,olvida tus penas,oublie tes peines,vergiss deine Sorgen
512,freedom is not free,freedom is not free,la libertad no es gratuita,la liberté n'est pas gratuite,Freiheit ist nicht frei
513,gambling is a curse,gambling is a curse,apostar es una maldición,le jeu est une malédiction,Glücksspiel ist ein Fluch
514,gambling is illegal,gambling is illegal,apostar es ilegal,le jeu est illégal,Glücksspiel ist illegal
515,get tom to help you,get tom to help you,pídele a tom que te ayude,demande à tom de t'aider,"Holen Sie sich Tom, um Ihnen zu helfen"
516,get away from there,get away from there,aléjate de ahí,s'éloigner de là,weg von dort
517,get back in the van,get back in the van,volver a la furgoneta,remonter dans le van,wieder in den Van steigen
518,get down from there,get down from there,bajar de allí,descendre de là,runter von dort
519,get dressed quickly,get dressed quickly,vestirse rapido,habille toi vite,schnell anziehen
520,get me the evidence,get me the evidence,dame la evidencia,apportez-moi la preuve,Hol mir die Beweise
521,get out of here now,get out of here now,salir de aquí ahora,sors d'ici maintenant,raus hier jetzt
522,get out of my chair,get out of my chair,sal de mi silla,sors de ma chaise,Raus aus meinem Stuhl
523,get out of my house,get out of my house,sal de mi casa,sors de ma maison,raus aus meinem Haus
524,get out of my sight,get out of my sight,Apártate de mi vista,Hors de ma vue,geh mir aus den Augen
525,get out of this car,get out of this car,sal de este auto,sortir de cette voiture,aus diesem Auto aussteigen
526,get your clothes on,get your clothes on,Ponte tu ropa,mets tes vêtements,Zieh Dich an
527,give tom some water,give tom some water,dale a tom un poco de agua,donne lui de l'eau,Gib Tom etwas Wasser
528,give grandma a kiss,give grandma a kiss,dale un beso a la abuela,donner un bisou à grand-mère,Gib Oma einen Kuss
529,give me a toothpick,give me a toothpick,dame un palillo,donne moi un cure dent,Gib mir einen Zahnstocher
530,give me back my bag,give me back my bag,devuélveme mi bolso,rends-moi mon sac,Gib mir meine Tasche zurück
531,give me back my hat,give me back my hat,devuélveme mi sombrero,rends-moi mon chapeau,Gib mir meinen Hut zurück
532,give me back my pen,give me back my pen,devuélveme mi pluma,rends-moi mon stylo,Gib mir meinen Stift zurück
533,give me my pen back,give me my pen back,devuélveme mi pluma,rends-moi mon stylo,Gib mir meinen Stift zurück
534,give me ten minutes,give me ten minutes,dame diez minutos,donne moi dix minutes,Gib mir zehn Minuten
535,give me that samosa,give me that samosa,dame esa samosa,donne moi ce samoussa,Gib mir die Samosa
536,give me two minutes,give me two minutes,dame dos minutos,donne moi deux minutes,Gib mir zwei Minuten
537,give the keys to me,give the keys to me,dame las llaves,donne moi les clés,Gib mir die Schlüssel
538,give us a few hours,give us a few hours,danos unas horas,donnez-nous quelques heures,gib uns ein paar Stunden
539,give us the details,give us the details,danos los detalles,donne nous les détails,geben Sie uns die Einzelheiten
540,glass breaks easily,glass breaks easily,el vidrio se rompe facilmente,le verre se brise facilement,Glas bricht leicht
541,go and wake mary up,go and wake mary up,ve y despierta a mary,va réveiller marie,Geh und wecke Mary auf
542,go brush your teeth,go brush your teeth,ve a cepillarte los dientes,aller vous brosser les dents,geh deine Zähne putzen
543,go jump in the lake,go jump in the lake,ve a saltar al lago,va sauter dans le lac,geh in den See springen
544,go to your room now,go to your room now,ve a tu cuarto ahora,va dans ta chambre maintenant,Geh jetzt in dein Zimmer
545,good luck with that,good luck with that,buena suerte con eso,bonne chance avec ça,viel Glück damit
546,grief drove her mad,grief drove her mad,el dolor la volvió loca,le chagrin l'a rendue folle,Trauer machte sie wahnsinnig
547,guess what happened,guess what happened,adivina qué pasó,devinez ce qui s'est passé,"Rate, was passiert ist"
548,hand in your papers,hand in your papers,entrega tus papeles,remettez vos papiers,gib deine Papiere ab
549,has tom calmed down,has tom calmed down,se ha calmado tom,est-ce que tom s'est calmé,hat sich Tom beruhigt
550,has tom noticed yet,has tom noticed yet,¿Tom ya lo ha notado?,Tom a-t-il encore remarqué,hat tom noch gemerkt
551,has anyone seen tom,has anyone seen tom,alguien ha visto a tom,est-ce que quelqu'un a vu tom,hat jemand tom gesehen
552,has he failed again,has he failed again,ha vuelto a fallar,a-t-il encore échoué,ist er wieder gescheitert
553,has he gone already,has he gone already,¿Se ha ido ya?,est-il déjà parti,ist er schon weg
554,have i lost my mind,have i lost my mind,He perdido la cabeza,Ai-je perdu mon esprit,habe ich meinen Verstand verloren
555,have a beer with me,have a beer with me,toma una cerveza conmigo,prends une bière avec moi,trink ein bier mit mir
556,have a good weekend,have a good weekend,tener un buen fin de semana,bon week-end,ein schönes Wochenende
557,have a nice holiday,have a nice holiday,tener unas buenas vacaciones,passe de bonnes vacances,hab schöne Ferien
558,have a nice weekend,have a nice weekend,Qué tenga un buen fin de semana,bon week-end,Ein schönes Wochenende wünsche ich ihnen
559,have a piece of pie,have a piece of pie,tener un pedazo de pastel,avoir un morceau de tarte,ein Stück Kuchen haben
560,have a safe journey,have a safe journey,Ten un viaje seguro,Avoir un bon voyage,gute Reise
561,have they responded,have they responded,han respondido,ont-ils répondu,haben sie geantwortet
562,have you gone crazy,have you gone crazy,Te has vuelto loco,es-tu devenu fou,bist du verrückt geworden
563,have you got it yet,have you got it yet,¿Ya lo tienes?,Tu as compris ou pas encore,hast du es schon
564,have you had dinner,have you had dinner,ya cenaste,avez-vous dîné,hattest du Abendessen
565,have you tried this,have you tried this,has probado esto,avez-vous essayé ceci,hast du das probiert
566,he abused our trust,he abused our trust,abusó de nuestra confianza,il a abusé de notre confiance,Er hat unser Vertrauen missbraucht
567,he accepted my idea,he accepted my idea,aceptó mi idea,il a accepté mon idée,Er akzeptierte meine Idee
568,he accepted the job,he accepted the job,aceptó el trabajo,il a accepté le travail,er nahm den Job an
569,he adopted her idea,he adopted her idea,él adoptó su idea,il a adopté son idée,Er übernahm ihre Idee
570,he asked for a beer,he asked for a beer,pidió una cerveza,il a demandé une bière,Er bat um ein Bier
571,he averted his gaze,he averted his gaze,desvió la mirada,il a détourné son regard,er wandte seinen Blick ab
572,he became a pianist,he became a pianist,se hizo pianista,il est devenu pianiste,er wurde Pianist
573,he became irritated,he became irritated,se irritó,il s'est énervé,er wurde irritiert
574,he boarded the ship,he boarded the ship,abordó el barco,il est monté à bord du navire,er ging an Bord des Schiffes
575,he bought a new car,he bought a new car,compró un auto nuevo,il a acheté une nouvelle voiture,er hat sich ein neues Auto gekauft
576,he bought her a dog,he bought her a dog,él le compró un perro,il lui a acheté un chien,Er kaufte ihr einen Hund
577,he bragged about it,he bragged about it,se jactó de eso,il s'en est vanté,er prahlte damit
578,he burst into tears,he burst into tears,se echó a llorar,il a fondu en larmes,er brach in Tränen aus
579,he called me a taxi,he called me a taxi,me llamó un taxi,il m'a appelé un taxi,Er hat mir ein Taxi gerufen
580,he came home at ten,he came home at ten,llegó a casa a las diez,il est rentré à dix heures,Er kam um zehn nach Hause
581,he came to my house,he came to my house,vino a mi casa,il est venu chez moi,er kam zu mir nach hause
582,he can be relied on,he can be relied on,se puede confiar en el,on peut compter sur lui,auf ihn ist Verlass
583,he can hardly speak,he can hardly speak,apenas puede hablar,il peut à peine parler,er kann kaum sprechen
584,he can help you out,he can help you out,el puede ayudarte,il peut t'aider,er kann dir weiterhelfen
585,he can play a flute,he can play a flute,él puede tocar una flauta,il sait jouer de la flûte,er kann Flöte spielen
586,he can't be trusted,he cannot be trusted,no se puede confiar en el,on ne peut pas lui faire confiance,ihm ist nicht zu trauen
587,he cannot sing well,he cannot sing well,no puede cantar bien,il ne sait pas bien chanter,er kann nicht gut singen
588,he caught a big one,he caught a big one,atrapó uno grande,il en a attrapé un gros,er hat einen großen gefangen
589,he changed his mind,he changed his mind,él cambió de opinión,il a changé d'avis,er hat seine Meinung geändert
590,he chased the thief,he chased the thief,persiguió al ladrón,il a chassé le voleur,er jagte den Dieb
591,he cooked me dinner,he cooked me dinner,me cocinó la cena,il m'a préparé le dîner,Er hat mir Abendessen gekocht
592,he cured my illness,he cured my illness,curó mi enfermedad,il a guéri ma maladie,Er hat meine Krankheit geheilt
593,he denied that fact,he denied that fact,él negó ese hecho,il a nié ce fait,er bestritt diese Tatsache
594,he denied the rumor,he denied the rumor,negó el rumor,il a démenti la rumeur,er bestritt das Gerücht
595,he did it willingly,he did it willingly,lo hizo de buena gana,il l'a fait volontairement,er tat es freiwillig
596,he did the opposite,he did the opposite,hizo lo contrario,il a fait le contraire,er tat das gegenteil
597,he didn't know that,he did not know that,el no sabia eso,il ne savait pas que,das wusste er nicht
598,he died a sad death,he died a sad death,murió una muerte triste,il est mort d'une mort triste,er starb einen traurigen Tod
599,he does not like us,he does not like us,no le gustamos,il ne nous aime pas,er mag uns nicht
600,he doesn't know yet,he does not know yet,el no sabe aun,il ne sait pas encore,er weiß es noch nicht
601,he drinks to excess,he drinks to excess,bebe en exceso,il boit à l'excès,er trinkt zu viel
602,he drives a ferrari,he drives a ferrari,el conduce un ferrari,il conduit une ferrari,Er fährt einen Ferrari
603,he drives very fast,he drives very fast,él conduce muy rápido,il roule très vite,er fährt sehr schnell
604,he dropped in on me,he dropped in on me,se dejó caer sobre mí,il est tombé sur moi,er ist bei mir reingefallen
605,he entered his room,he entered his room,entró en su habitación,il est entré dans sa chambre,er betrat sein Zimmer
606,he entered the army,he entered the army,ingresó al ejército,il est entré dans l'armée,er trat in die Armee ein
607,he entered the room,he entered the room,entró en la habitación,il est entré dans la chambre,er betrat das Zimmer
608,he feels very happy,he feels very happy,se siente muy feliz,il se sent très heureux,er fühlt sich sehr glücklich
609,he felt ill at ease,he felt ill at ease,se sentía mal a gusto,il se sentait mal à l'aise,er fühlte sich unwohl
610,he felt very lonely,he felt very lonely,se sentía muy solo,il se sentait très seul,er fühlte sich sehr einsam
611,he flew into a rage,he flew into a rage,se puso furioso,il est devenu fou de rage,er geriet in Wut
612,he found his master,he found his master,encontró a su maestro,il a trouvé son maître,er hat seinen Meister gefunden
613,he found my bicycle,he found my bicycle,encontró mi bicicleta,il a trouvé mon vélo,Er hat mein Fahrrad gefunden
614,he gave a deep sigh,he gave a deep sigh,dio un profundo suspiro,il a poussé un profond soupir,er seufzte tief
615,he gave me an apple,he gave me an apple,me dio una manzana,il m'a donné une pomme,Er hat mir einen Apfel gegeben
616,he gave me his word,he gave me his word,me dio su palabra,il m'a donné sa parole,Er hat mir sein Wort gegeben
617,he got on the train,he got on the train,se subió al tren,il est monté dans le train,er stieg in den Zug
618,he greeted the lady,he greeted the lady,saludó a la señora,il a salué la dame,Er begrüßte die Dame
619,he had already gone,he had already gone,ya se habia ido,il était déjà parti,er war schon weg
620,he had fun with her,he had fun with her,se divirtio con ella,il s'est amusé avec elle,er hatte Spaß mit ihr
621,he had his hair cut,he had his hair cut,se cortó el pelo,il s'est fait couper les cheveux,er hat sich die Haare schneiden lassen
622,he had just arrived,he had just arrived,acababa de llegar,il venait d'arriver,er war gerade angekommen
623,he had no objection,he had no objection,no tuvo objeción,il n'avait pas d'objection,er hatte nichts dagegen
624,he had one daughter,he had one daughter,el tenia una hija,il avait une fille,er hatte eine Tochter
625,he has a funny name,he has a funny name,tiene un nombre gracioso,il a un drôle de nom,er hat einen komischen namen
626,he has a loud voice,he has a loud voice,tiene una voz fuerte,il a une voix forte,er hat eine laute stimme
627,he has a nose bleed,he has a nose bleed,le sangra la nariz,il saigne du nez,er hat nasenbluten
628,he has a round face,he has a round face,el tiene una cara redonda,il a un visage rond,er hat ein rundes gesicht
629,he has a square jaw,he has a square jaw,tiene la mandibula cuadrada,il a une mâchoire carrée,Er hat ein eckiges Kinn
630,he has acted wisely,he has acted wisely,ha actuado sabiamente,il a agi sagement,er hat weise gehandelt
631,he has big problems,he has big problems,el tiene grandes problemas,il a de gros problèmes,er hat große probleme
632,he has enough money,he has enough money,tiene suficiente dinero,il a assez d'argent,er hat genug geld
633,he has gone too far,he has gone too far,ha ido demasiado lejos,il est allé trop loin,er ist zu weit gegangen
634,he has his own room,he has his own room,el tiene su propia habitacion,il a sa propre chambre,er hat sein eigenes zimmer
635,he has left already,he has left already,ya se fue,il est déjà parti,er ist schon weg
636,he has little money,he has little money,tiene poco dinero,il a peu d'argent,er hat wenig geld
637,he has many talents,he has many talents,tiene muchos talentos,il a beaucoup de talent,er hat viele talente
638,he has mutton chops,he has mutton chops,tiene chuletas de cordero,il a des côtelettes de mouton,er hat Hammelkoteletts
639,he hates air travel,he hates air travel,odia viajar en avión,il déteste les voyages en avion,er hasst Flugreisen
640,he held her tightly,he held her tightly,él la abrazó con fuerza,il la tenait fermement,er hielt sie fest
641,he himself tried it,he himself tried it,él mismo lo probó,il l'a essayé lui-même,er selbst hat es versucht
642,he hoped to succeed,he hoped to succeed,esperaba tener éxito,il espérait réussir,er hoffte auf Erfolg
643,he is a born artist,he is a born artist,es un artista nato,c'est un artiste né,er ist ein geborener Künstler
644,he is a fast runner,he is a fast runner,el es un corredor rapido,c'est un coureur rapide,Er ist ein schneller Läufer
645,he is a good doctor,he is a good doctor,Él es un buen doctor,c'est un bon docteur,Er ist ein guter Arzt
646,he is a good singer,he is a good singer,él es un buen cantante,c'est un bon chanteur,Er ist ein guter Sänger
647,he is a good writer,he is a good writer,es un buen escritor,c'est un bon écrivain,er ist ein guter Schriftsteller
648,he is a hard worker,he is a hard worker,el es un gran trabajador,il est un travailleur acharné,er arbeitet hart
649,he is a jealous man,he is a jealous man,el es un hombre celoso,c'est un homme jaloux,er ist ein eifersüchtiger Mann
650,he is a lazy fellow,he is a lazy fellow,es un tipo perezoso,c'est un paresseux,er ist ein fauler Kerl
651,he is a learned man,he is a learned man,el es un hombre erudito,c'est un savant,er ist ein gelehrter Mann
652,he is a nice person,he is a nice person,El es una linda persona,c'est une belle personne,Er ist eine nette Person
653,he is a rude person,he is a rude person,el es una persona grosera,c'est une personne grossière,er ist ein unhöflicher Mensch
654,he is about my size,he is about my size,él es de mi tamaño,il fait à peu près ma taille,er hat ungefähr meine größe
655,he is always joking,he is always joking,el siempre esta bromeando,il plaisante toujours,er scherzt immer
656,he is an honest man,he is an honest man,el es un hombre honesto,c'est un honnête homme,er ist ein ehrlicher Mann
657,he is apt to forget,he is apt to forget,es propenso a olvidar,il est susceptible d'oublier,er ist geneigt zu vergessen
658,he is at his office,he is at his office,el esta en su oficina,il est à son bureau,Er ist in seinem Büro
659,he is at home today,he is at home today,él está en casa hoy,il est chez lui aujourd'hui,er ist heute zu hause
660,he is at the office,he is at the office,el esta en la oficina,il est au bureau,er ist im büro
661,he is clever indeed,he is clever indeed,él es inteligente de hecho,il est vraiment intelligent,er ist wirklich schlau
662,he is far from rich,he is far from rich,está lejos de ser rico,il est loin d'être riche,er ist alles andere als reich
663,he is good at rugby,he is good at rugby,es bueno en el rugby,il est bon au rugby,Er ist gut im Rugby
664,he is my old friend,he is my old friend,el es mi viejo amigo,c'est mon vieil ami,Er ist mein alter Freund
665,he is not available,he is not available,el no esta disponible,il n'est pas disponible,er ist nicht erreichbar
666,he is not religious,he is not religious,el no es religioso,il n'est pas religieux,er ist nicht religiös
667,he is over 80 kilos,he is over 80 kilos,el pesa mas de 80 kilos,il fait plus de 80 kilos,er ist über 80 kilo
668,he is playing music,he is playing music,el esta tocando musica,il joue de la musique,er spielt musik
669,he is playing there,he is playing there,el esta jugando ahi,il joue là,er spielt dort
670,he is probably dead,he is probably dead,probablemente este muerto,il est probablement mort,wahrscheinlich ist er tot
671,he is ready to work,he is ready to work,el esta listo para trabajar,il est prêt à travailler,er ist arbeitsbereit
672,he is taking a walk,he is taking a walk,el esta dando un paseo,il se promène,er geht spazieren
673,he is tall and lean,he is tall and lean,el es alto y delgado,il est grand et maigre,er ist groß und schlank
674,he is telling a lie,he is telling a lie,el esta diciendo una mentira,il dit un mensonge,er erzählt eine Lüge
675,he is too sensitive,he is too sensitive,el es demasiado sensible,il est trop sensible,er ist zu empfindlich
676,he is very handsome,he is very handsome,él es muy guapo,il est très beau,Er sieht sehr gut aus
677,he is very sociable,he is very sociable,el es muy sociable,il est très sociable,er ist sehr gesellig
678,he is very talented,he is very talented,Él es muy talentoso,il est très talentueux,er ist sehr talentiert
679,he is washing a car,he is washing a car,el esta lavando un auto,il lave une voiture,Er wäscht ein Auto
680,he is wearing a hat,he is wearing a hat,el esta usando un sombrero,il porte un chapeau,er trägt einen Hut
681,he jimmied the lock,he jimmied the lock,forzó la cerradura,il a sauté la serrure,er hebelte das Schloss auf
682,he kept his promise,he kept his promise,cumplió su promesa,il a tenu sa promesse,er hat sein Versprechen gehalten
683,he kissed her again,he kissed her again,la besó de nuevo,il l'a encore embrassée,er küsste sie wieder
684,he knows everything,he knows everything,el sabe todo,il sait tout,er weiß alles
685,he knows how to bet,he knows how to bet,el sabe apostar,il sait parier,er kann wetten
686,he knows the secret,he knows the secret,el sabe el secreto,il connaît le secret,er kennt das Geheimnis
687,he knows who we are,he knows who we are,el sabe quienes somos,il sait qui nous sommes,"er weiß, wer wir sind"
688,he lacks confidence,he lacks confidence,le falta confianza,il manque de confiance,ihm fehlt es an Selbstvertrauen
689,he lacks experience,he lacks experience,le falta experiencia,il manque d'expérience,Ihm fehlt die Erfahrung
690,he lacks motivation,he lacks motivation,le falta motivacion,il manque de motivation,Ihm fehlt die Motivation
691,he laid on his back,he laid on his back,se acostó de espaldas,il s'est allongé sur le dos,er legte sich auf den rücken
692,he lays on his back,he lays on his back,se acuesta boca arriba,il est allongé sur le dos,er legt sich auf den rücken
693,he left a while ago,he left a while ago,se fue hace un rato,il est parti il ​​y a peu,er ist vor einiger Zeit gegangen
694,he left immediately,he left immediately,se fue de inmediato,il est parti tout de suite,er ging sofort
