,English,English_cleaned,Spanish,French,German
545,tom is deranged,tom is deranged,Tom está trastornado,Tom est dérangé,Tom ist geistesgestört
546,tom is dreaming,tom is dreaming,tom esta soñando,tom rêve,Tom träumt
547,tom is drowning,tom is drowning,Tom se está ahogando,tom se noie,Tom ertrinkt
548,tom is handsome,tom is handsome,tom es guapo,tom est beau,Tom ist gutaussehend
549,tom is hurt bad,tom is hurt bad,tom está mal herido,Tom est gravement blessé,Tom ist schwer verletzt
550,tom is insecure,tom is insecure,tom es inseguro,tom n'est pas en sécurité,Tom ist unsicher
551,tom is laughing,tom is laughing,Tom se está riendo,Tom rit,Tom lacht
552,tom is likeable,tom is likeable,Tom es simpático,Tom est sympathique,Tom ist sympathisch
553,tom is no angel,tom is no angel,tom no es un ángel,Tom n'est pas un ange,Tom ist kein Engel
554,tom is not dumb,tom is not dumb,tom no es tonto,tom n'est pas idiot,Tom ist nicht dumm
555,tom is not here,tom is not here,tom no esta aqui,Tom n'est pas là,Tom ist nicht hier
556,tom is on leave,tom is on leave,tom está de permiso,Tom est en congé,Tom ist im Urlaub
557,tom is quitting,tom is quitting,tom se va,tom quitte,Tom gibt auf
558,tom is reckless,tom is reckless,tom es imprudente,Tom est imprudent,Tom ist rücksichtslos
559,tom is relieved,tom is relieved,Tom está aliviado,Tom est soulagé,Tom ist erleichtert
560,tom is speaking,tom is speaking,tom esta hablando,tom parle,Tom spricht
561,tom is stubborn,tom is stubborn,tom es terco,Tom est têtu,Tom ist stur
562,tom is studying,tom is studying,tom esta estudiando,Tom étudie,Tom studiert
563,tom is sweating,tom is sweating,Tom está sudando,Tom transpire,Tom schwitzt
564,tom is tireless,tom is tireless,tom es incansable,tom est infatigable,Tom ist unermüdlich
565,tom is tolerant,tom is tolerant,tom es tolerante,Tom est tolérant,Tom ist tolerant
566,tom is upstairs,tom is upstairs,Tom está arriba,Tom est à l'étage,Tom ist oben
567,tom is watching,tom is watching,Tom está mirando,tom regarde,tom schaut zu
568,tom is your age,tom is your age,tom tiene tu edad,Tom a ton âge,Tom ist in deinem Alter
569,tom isn't alone,tom is not alone,Tom no está solo,Tom n'est pas seul,Tom ist nicht allein
570,tom kicked mary,tom kicked mary,tom pateó a mary,Tom a donné un coup de pied à Mary,Tom hat Maria getreten
571,tom killed mary,tom killed mary,Tom mató a María,tom a tué marie,Tom hat Maria getötet
572,tom kissed mary,tom kissed mary,Tom besó a María,tom a embrassé marie,Tom küsste Maria
573,tom learns fast,tom learns fast,Tom aprende rápido,tom apprend vite,Tom lernt schnell
574,tom likes chess,tom likes chess,a tom le gusta el ajedrez,Tom aime les échecs,Tom mag Schach
575,tom likes games,tom likes games,a tom le gustan los juegos,tom aime les jeux,Tom mag Spiele
576,tom looked back,tom looked back,Tom miró hacia atrás,tom regarda en arrière,Tom blickte zurück
577,tom looks dazed,tom looks dazed,Tom parece aturdido,Tom a l'air hébété,Tom sieht benommen aus
578,tom looks great,tom looks great,tom se ve muy bien,tom a l'air super,Tom sieht toll aus
579,tom looks happy,tom looks happy,tom se ve feliz,Tom a l'air heureux,Tom sieht glücklich aus
580,tom looks tired,tom looks tired,tom parece cansado,Tom a l'air fatigué,Tom sieht müde aus
581,tom never comes,tom never comes,tom nunca viene,tom ne vient jamais,Tom kommt nie
582,tom never cooks,tom never cooks,tom nunca cocina,tom ne cuisine jamais,Tom kocht nie
583,tom never falls,tom never falls,tom nunca se cae,tom ne tombe jamais,Tom fällt nie
584,tom paid for it,tom paid for it,Tom lo pagó,Tom l'a payé,Tom hat dafür bezahlt
585,tom quit school,tom quit school,Tom dejó la escuela,Tom a quitté l'école,Tom hat die Schule verlassen
586,tom saw a mouse,tom saw a mouse,tom vio un raton,Tom a vu une souris,Tom hat eine Maus gesehen
587,tom seemed calm,tom seemed calm,tom parecía tranquilo,tom semblait calme,Tom wirkte ruhig
588,tom seems angry,tom seems angry,Tom parece enojado,Tom semble en colère,Tom scheint wütend zu sein
589,tom seems happy,tom seems happy,tom parece feliz,Tom semble heureux,Tom scheint glücklich zu sein
590,tom seems young,tom seems young,Tom parece joven,Tom semble jeune,Tom scheint jung zu sein
591,tom stayed calm,tom stayed calm,tom mantuvo la calma,Tom est resté calme,Tom blieb ruhig
592,tom trusts mary,tom trusts mary,Tom confía en María,tom fait confiance à marie,Tom vertraut Mary
593,tom turned back,tom turned back,tom dio la vuelta,Tom s'est retourné,Tom drehte sich um
594,tom turned pale,tom turned pale,Tom se puso pálido,tom est devenu pâle,Tom wurde blass
595,tom understands,tom understands,tom entiende,Tom comprend,Tom versteht
596,tom volunteered,tom volunteered,Tom se ofreció como voluntario,Tom s'est porté volontaire,Tom hat sich freiwillig gemeldet
597,tom wanted that,tom wanted that,Tom quería eso,tom voulait ça,Tom wollte das
598,tom warned mary,tom warned mary,Tom advirtió a María,tom a prévenu marie,Tom warnte Maria
599,tom was at home,tom was at home,tom estaba en casa,Tom était à la maison,Tom war zu Hause
600,tom was awesome,tom was awesome,tom fue increíble,Tom était génial,Tom war großartig
601,tom was in love,tom was in love,tom estaba enamorado,Tom était amoureux,Tom war verliebt
602,tom was nervous,tom was nervous,tom estaba nervioso,Tom était nerveux,Tom war nervös
603,tom was on time,tom was on time,tom llegó a tiempo,Tom était à l'heure,Tom war pünktlich
604,tom was popular,tom was popular,tom era popular,Tom était populaire,Tom war beliebt
605,tom was sobbing,tom was sobbing,tom estaba sollozando,Tom sanglotait,Tom schluchzte
606,tom wasn't sure,tom was not sure,tom no estaba seguro,Tom n'était pas sûr,Tom war sich nicht sicher
607,tom wears a wig,tom wears a wig,tom usa una peluca,tom porte une perruque,Tom trägt eine Perücke
608,tom went inside,tom went inside,Tom entró,tom est allé à l'intérieur,Tom ging hinein
609,tom will fix it,tom will fix it,Tom lo arreglará,tom va le réparer,Tom wird es reparieren
610,tom will go far,tom will go far,Tom llegará lejos,tom ira loin,Tom wird es weit bringen
611,tom will say no,tom will say no,tom dirá que no,Tom dira non,Tom wird nein sagen
612,tom works a lot,tom works a lot,tom trabaja mucho,tom travaille beaucoup,Tom arbeitet viel
613,tom works there,tom works there,Tom trabaja allí,tom y travaille,Tom arbeitet dort
614,tom would leave,tom would leave,Tom se iría,Tom partirait,Tom würde gehen
615,tom writes well,tom writes well,tom escribe bien,tom écrit bien,Tom schreibt gut
616,tom's delighted,tom s delighted,Tom está encantado,Tom est ravi,Tom ist begeistert
617,tom's different,tom s different,Tom es diferente,Tom est différent,Tom ist anders
618,tom's important,tom s important,Tom es importante,tom est important,Tom ist wichtig
619,tom's my friend,tom s my friend,Tom es mi amigo,tom est mon ami,Tom ist mein Freund
620,"tom, be careful",tom  be careful,ten cuidado,sois prudent,sei vorsichtig
621,trust is earned,trust is earned,la confianza se gana,la confiance se gagne,Vertrauen muss verdient werden
622,try and stop me,try and stop me,tratar de detenerme,essaie de m'arrêter,versuche mich zu stoppen
623,try not to yawn,try not to yawn,trata de no bostezar,essayez de ne pas bâiller,versuche nicht zu gähnen
624,try to have fun,try to have fun,trata de divertirte,essaie de t'amuser,versuche Spaß zu haben
625,try to stay dry,try to stay dry,trata de mantenerte seco,essayez de rester au sec,versuche trocken zu bleiben
626,turn off the tv,turn off the tv,apagar la televisión,éteins la télévision,Schalte den Fernseher aus
627,turn on the fan,turn on the fan,enciende el ventilador,allumer le ventilateur,Mach den Ventilator an
628,unlock the door,unlock the door,quitale el seguro a la puerta,déverrouiller la porte,entriegeln Sie die Tür
629,wait in the car,wait in the car,esperar en el coche,attendre dans la voiture,im Auto warten
630,wait one moment,wait one moment,espere un momento,Attends un moment,warte einen Moment
631,wait one second,wait one second,Espera un segundo,attends une seconde,warte eine Sekunde
632,wait right here,wait right here,espera aquí,attends ici,warte hier
633,walls have ears,walls have ears,las paredes escuchan,les murs ont des oreilles,Wände haben Ohren
634,was that a hint,was that a hint,¿Fue eso una pista?,était-ce un indice,war das ein hinweis
635,wash the dishes,wash the dishes,lavar los platos,lave la vaisselle,wasche das Geschirr
636,wash your hands,wash your hands,lava tus manos,Lavez-vous les mains,wasche deine Hände
637,watch carefully,watch carefully,mira cuidadosamente,Regarde attentivement,sorgfältig beobachten
638,watch the front,watch the front,mira el frente,regarder le devant,vorne beobachten
639,watch your back,watch your back,vigila tu espalda,surveille ton dos,Pass auf
640,watch your step,watch your step,cuida tu paso,attention a la marche,Pass auf wo du hintrittst
641,watch your toes,watch your toes,cuida tus dedos de los pies,attention à vos orteils,achte auf deine Zehen
642,we all did well,we all did well,todos lo hicimos bien,nous avons tous bien fait,wir haben uns alle gut geschlagen
643,we all had hope,we all had hope,todos teníamos esperanza,nous avions tous de l'espoir,wir alle hatten Hoffnung
644,we all hate tom,we all hate tom,todos odiamos a tom,nous détestons tous tom,wir alle hassen tom
645,we all have fun,we all have fun,todos nos divertimos,nous nous amusons tous,wir haben alle Spaß
646,we all know tom,we all know tom,todos conocemos a tom,nous connaissons tous tom,wir alle kennen tom
647,we all like him,we all like him,a todos nos gusta el,nous l'aimons tous,wir alle mögen ihn
648,we all like you,we all like you,a todos nos gustas,nous t'aimons tous,wir alle mögen dich
649,we all suffered,we all suffered,todos sufrimos,nous avons tous souffert,wir haben alle gelitten
650,we are a family,we are a family,somos una familia,nous sommes une famille,Wir sind eine Familie
651,we are brothers,we are brothers,somos hermanos,nous sommes frères,wir sind Brüder
652,we are busy men,we are busy men,somos hombres ocupados,nous sommes des hommes occupés,wir sind vielbeschäftigte Männer
653,we are his sons,we are his sons,somos sus hijos,nous sommes ses fils,wir sind seine Söhne
654,we are students,we are students,somos estudiantes,nous sommes étudiants,wir sind Studenten
655,we are teachers,we are teachers,somos profesores,nous sommes des enseignants,wir sind Lehrer
656,we aren't alone,we are not alone,no estamos solos,Nous ne sommes pas seuls,wir sind nicht alleine
657,we ate together,we ate together,comimos juntos,nous avons mangé ensemble,wir haben zusammen gegessen
658,we both do that,we both do that,los dos hacemos eso,on fait ça tous les deux,das machen wir beide
659,we both want it,we both want it,ambos lo queremos,nous le voulons tous les deux,wir beide wollen es
660,we can fix this,we can fix this,podemos arreglar esto,on peut arranger ça,wir können das beheben
661,we can try that,we can try that,podemos intentar eso,on peut essayer ça,das können wir versuchen
662,we can't attend,we cannot attend,no podemos asistir,nous ne pouvons pas assister,wir können nicht teilnehmen
663,we can't escape,we cannot escape,no podemos escapar,nous ne pouvons pas nous échapper,wir können nicht entkommen
664,we can't see it,we cannot see it,no podemos verlo,nous ne pouvons pas le voir,wir können es nicht sehen
665,we closed early,we closed early,cerramos temprano,nous avons fermé tôt,Wir haben früh geschlossen
666,we count on you,we count on you,contamos contigo,nous comptons sur vous,wir zählen auf dich
667,we declared war,we declared war,declaramos la guerra,nous avons déclaré la guerre,wir haben den Krieg erklärt
668,we don't forget,we do not forget,no nos olvidamos,Nous n'oublions pas,wir vergessen nicht
669,we eat fish raw,we eat fish raw,comemos pescado crudo,on mange du poisson cru,Wir essen Fisch roh
670,we fell in love,we fell in love,nos enamoramos,nous sommes tombés amoureux,wir verliebten uns
671,we felt at home,we felt at home,nos sentimos como en casa,nous nous sommes sentis chez nous,wir haben uns wie zu hause gefühlt
672,we had no money,we had no money,no teníamos dinero,nous n'avions pas d'argent,wir hatten kein geld
673,we have bananas,we have bananas,tenemos plátanos,nous avons des bananes,Wir haben Bananen
674,we have checked,we have checked,hemos chequeado,nous avons vérifié,wir haben gecheckt
675,we have freedom,we have freedom,tenemos libertad,nous avons la liberté,wir haben freiheit
676,we have no room,we have no room,no tenemos espacio,nous n'avons pas de place,wir haben keinen Platz
677,we have no time,we have no time,no tenemos tiempo,nous n'avons pas le temps,wir haben keine zeit
678,we have ponchos,we have ponchos,tenemos ponchos,nous avons des ponchos,Wir haben Ponchos
679,we have to move,we have to move,tenemos que movernos,il faut bouger,wir müssen umziehen
680,we have to stop,we have to stop,tenemos que parar,nous devons arrêter,wir müssen aufhören
681,we lack nothing,we lack nothing,no nos falta nada,nous ne manquons de rien,uns fehlt nichts
682,we like to talk,we like to talk,nos gusta hablar,nous aimons parler,wir reden gerne
683,we love our dog,we love our dog,amamos a nuestro perro,nous aimons notre chien,wir lieben unseren hund
684,we love picnics,we love picnics,nos encantan los picnics,nous aimons les pique-niques,Wir lieben Picknicks
685,we made him cry,we made him cry,lo hicimos llorar,nous l'avons fait pleurer,wir haben ihn zum Weinen gebracht
686,we made waffles,we made waffles,hicimos gofres,nous avons fait des gaufres,Wir haben Waffeln gemacht
687,we must find it,we must find it,debemos encontrarlo,il faut le trouver,wir müssen es finden
688,we must retreat,we must retreat,debemos retirarnos,nous devons reculer,wir müssen uns zurückziehen
689,we must succeed,we must succeed,debemos tener éxito,nous devons réussir,wir müssen Erfolg haben
690,we need a medic,we need a medic,necesitamos un medico,nous avons besoin d'un médecin,Wir brauchen einen Sanitäter
691,we need experts,we need experts,necesitamos expertos,nous avons besoin d'experts,wir brauchen experten
692,we need to stop,we need to stop,necesitamos parar,nous devons arrêter,Wir müssen aufhören
693,we need to talk,we need to talk,necesitamos hablar,il faut qu'on parle,wir müssen reden
694,we never forget,we never forget,nunca olvidamos,nous n'oublions jamais,wir vergessen nie
695,we ought to win,we ought to win,deberíamos ganar,nous devrions gagner,wir sollten gewinnen
696,we played chess,we played chess,jugamos al ajedrez,nous avons joué aux échecs,Wir haben Schach gespielt
697,we realize that,we realize that,nos damos cuenta de que,on s'en rend compte,das erkennen wir
698,we rented a car,we rented a car,alquilamos un coche,nous avons loué une voiture,wir haben ein Auto gemietet
699,we respect them,we respect them,los respetamos,nous les respectons,wir respektieren sie
700,we run together,we run together,corremos juntos,nous courons ensemble,wir laufen zusammen
701,we said nothing,we said nothing,no dijimos nada,nous n'avons rien dit,wir sagten nichts
702,we sang for her,we sang for her,cantamos para ella,nous avons chanté pour elle,wir haben für sie gesungen
703,we shared ideas,we shared ideas,compartimos ideas,nous avons partagé des idées,wir tauschten ideen aus
704,we should study,we should study,deberíamos estudiar,nous devrions étudier,wir sollten studieren
705,we speak french,we speak french,hablamos francés,on parle francais,wir sprechen Französisch
706,we study french,we study french,nosotros estudiamos francés,nous étudions le français,wir lernen französisch
707,we travel light,we travel light,viajamos ligeros,on voyage léger,Wir reisen mit leichtem Gepäck
708,we try our best,we try our best,hacemos nuestro mejor esfuerzo,nous faisons de notre mieux,Wir versuchen unser Bestes
709,we want answers,we want answers,queremos respuestas,nous voulons des réponses,wir wollen antworten
710,we want it back,we want it back,lo queremos de vuelta,nous voulons le récupérer,wir wollen es zurück
711,we want justice,we want justice,queremos justicia,nous voulons la justice,wir wollen gerechtigkeit
712,we want revenge,we want revenge,queremos venganza,on veut se venger,wir wollen Rache
713,we want to help,we want to help,queremos ayudar,nous voulons aider,wir wollen helfen
714,we want to talk,we want to talk,queremos hablar,nous voulons parler,wir wollen reden
715,we went on foot,we went on foot,fuimos a pie,nous sommes allés à pied,wir gingen zu Fuß
716,we went too far,we went too far,fuimos demasiado lejos,nous sommes allés trop loin,wir sind zu weit gegangen
717,we were friends,we were friends,éramos amigos,nous étions amis,wir waren Freunde
718,we were in love,we were in love,estábamos enamorados,nous étions amoureux,wir waren verliebt
719,we were sailing,we were sailing,estábamos navegando,nous naviguions,wir segelten
720,we were shocked,we were shocked,nos quedamos impactados,nous avons été choqués,wir waren schockiert
721,we were winning,we were winning,estábamos ganando,nous gagnions,wir gewannen
722,we were worried,we were worried,estábamos preocupados,nous étions inquiets,wir haben uns Sorgen gemacht
723,we will survive,we will survive,sobreviviremos,nous survivrons,Wir werden überleben
724,we'll camp here,we will camp here,acamparemos aquí,nous camperons ici,wir werden hier campen
725,we'll catch you,we will catch you,te atraparemos,nous vous attraperons,wir werden dich fangen
726,we'll cooperate,we will cooperate,vamos a cooperar,nous allons coopérer,Wir werden zusammenarbeiten
727,we'll get there,we will get there,llegaremos allí,nous allons y arriver,Wir werden dort ankommen
728,we'll stay here,we will stay here,nos quedaremos aquí,nous resterons ici,wir bleiben hier
729,we'll stop them,we will stop them,los detendremos,nous les arrêterons,wir werden sie aufhalten
730,we'll wait here,we will wait here,esperaremos aquí,nous attendrons ici,wir werden hier warten
731,we're canadians,we are canadians,somos canadienses,nous sommes canadiens,Wir sind Kanadier
732,we're adaptable,we are adaptable,somos adaptables,nous sommes adaptables,wir sind anpassungsfähig
733,we're all alone,we are all alone,todos estamos solos,Nous sommes tous seuls,Wir sind alle alleine
734,we're all angry,we are all angry,todos estamos enojados,nous sommes tous en colère,wir sind alle wütend
735,we're all armed,we are all armed,estamos todos armados,nous sommes tous armés,wir sind alle bewaffnet
736,we're all bored,we are all bored,todos estamos aburridos,on s'ennuie tous,wir sind alle gelangweilt
737,we're all crazy,we are all crazy,estamos todos locos,nous sommes tous fous,wir sind alle verrückt
738,we're all dying,we are all dying,todos estamos muriendo,nous mourons tous,wir alle sterben
739,we're all going,we are all going,todos vamos,nous allons tous,wir gehen alle
740,we're ambitious,we are ambitious,somos ambiciosos,nous sommes ambitieux,wir sind ehrgeizig
741,we're available,we are available,estamos disponibles,nous sommes disponible,Wir sind erreichbar
742,we're both fine,we are both fine,los dos estamos bien,nous allons bien tous les deux,uns beiden geht es gut
743,"we're busy, tom",we are busy  tom,estamos ocupados tom,nous sommes occupés tom,wir sind beschäftigt tom
744,we're comedians,we are comedians,somos comediantes,nous sommes des comédiens,Wir sind Comedians
745,we're committed,we are committed,estamos comprometidos,nous sommes déterminés,Wir sind verpflichtet
746,we're confident,we are confident,estamos confiados,nous sommes confiants,wir sind zuversichtlich
747,we're contented,we are contented,estamos contentos,nous sommes satisfaits,wir sind zufrieden
748,we're dedicated,we are dedicated,estamos dedicados,nous sommes dévoués,wir sind engagiert
749,we're depressed,we are depressed,estamos deprimidos,nous sommes déprimés,wir sind deprimiert
750,we're different,we are different,Somos diferentes,nous sommes différents,wir sind anders
751,we're done here,we are done here,hemos terminado aquí,nous avons fini ici,wir sind hier fertig
752,we're exhausted,we are exhausted,estamos agotados,nous sommes épuisés,wir sind erschöpft
753,we're expecting,we are expecting,estamos a la expectativa,nous attendons,wir erwarten
754,we're fixing it,we are fixing it,lo estamos arreglando,nous le réparons,wir reparieren es
755,we're flattered,we are flattered,estamos halagados,nous sommes flattés,wir sind geschmeichelt
756,we're from here,we are from here,somos de aquí,nous sommes d'ici,wir sind von hier
757,we're gardeners,we are gardeners,somos jardineros,nous sommes des jardiniers,Wir sind Gärtner
758,we're gentlemen,we are gentlemen,somos caballeros,nous sommes des messieurs,Wir sind Herren
759,we're giving up,we are giving up,nos estamos rindiendo,nous abandonnons,wir geben auf
760,we're going now,we are going now,nos vamos ahora,nous allons maintenant,wir gehen jetzt
761,we're going out,we are going out,Vamos a salir,nous sortons,wir gehen aus
762,"we're here, too",we are here  too,estamos aquí también,nous sommes ici aussi,wir sind auch hier
763,we're in charge,we are in charge,estamos a cargo,nous sommes en charge,wir sind verantwortlich
764,we're in danger,we are in danger,estamos en peligro,nous sommes en danger,wir sind in Gefahr
765,we're incorrect,we are incorrect,estamos equivocados,nous nous trompons,wir sind falsch
766,we're listening,we are listening,estamos escuchando,nous écoutons,wir hören zu
767,we're losing it,we are losing it,lo estamos perdiendo,nous le perdons,wir verlieren es
768,we're neighbors,we are neighbors,somos vecinos,nous sommes voisins,wir sind Nachbarn
769,we're newcomers,we are newcomers,somos novatos,nous sommes des nouveaux venus,wir sind neulinge
770,we're newlyweds,we are newlyweds,somos recien casados,nous sommes jeunes mariés,wir sind frisch verheiratet
771,we're not alone,we are not alone,no estamos solos,Nous ne sommes pas seuls,wir sind nicht alleine
772,we're not fools,we are not fools,no somos tontos,nous ne sommes pas dupes,wir sind keine Dummköpfe
773,we're not fussy,we are not fussy,no somos quisquillosos,nous ne sommes pas difficiles,wir sind nicht pingelig
774,we're not going,we are not going,no vamos,nous n'allons pas,wir gehen nicht
775,we're not happy,we are not happy,No estamos felices,nous ne sommes pas contents,wir sind nicht glücklich
776,we're not ready,we are not ready,no estamos listos,nous ne sommes pas prêts,wir sind nicht bereit
777,we're not young,we are not young,no somos jóvenes,nous ne sommes pas jeunes,wir sind nicht jung
778,we're past that,we are past that,hemos pasado eso,nous sommes passés par là,das haben wir hinter uns
779,we're plastered,we are plastered,estamos enyesados,nous sommes plâtrés,wir sind verputzt
780,we're powerless,we are powerless,somos impotentes,nous sommes impuissants,wir sind machtlos
781,we're prisoners,we are prisoners,somos prisioneros,nous sommes prisonniers,wir sind gefangene
782,we're ready now,we are ready now,estamos listos ahora,nous sommes prêts maintenant,wir sind jetzt bereit
783,we're realistic,we are realistic,somos realistas,nous sommes réalistes,wir sind realistisch
784,we're resigning,we are resigning,estamos renunciando,nous démissionnons,wir kündigen
785,we're resilient,we are resilient,somos resilientes,nous sommes résilients,wir sind belastbar
786,we're safe here,we are safe here,estamos a salvo aquí,nous sommes en sécurité ici,wir sind hier sicher
787,we're satisfied,we are satisfied,estamos satisfechos,nous sommes satisfaits,wir sind zufrieden
788,we're sensitive,we are sensitive,somos sensibles,nous sommes sensibles,wir sind sensibel
789,we're separated,we are separated,estamos separados,Nous sommes séparés,wir sind getrennt
790,we're soulmates,we are soulmates,somos almas gemelas,nous sommes âmes-sœurs,Wir sind Seelenverwandte
791,we're surprised,we are surprised,estamos sorprendidos,nous sommes surpris,wir sind überrascht
792,we're surviving,we are surviving,estamos sobreviviendo,nous survivons,wir überleben
793,we're survivors,we are survivors,somos sobrevivientes,nous sommes des survivants,Wir sind Überlebende
794,we're too close,we are too close,estamos demasiado cerca,nous sommes trop proches,wir sind zu nah
795,we're uninsured,we are uninsured,no tenemos seguro,nous ne sommes pas assurés,wir sind unversichert
796,we're unrelated,we are unrelated,no estamos relacionados,nous ne sommes pas liés,wir sind nicht verwandt
797,we're very busy,we are very busy,estamos muy ocupados,nous sommes très occupés,wir sind sehr beschäftigt
798,we've been busy,we ve been busy,hemos estado ocupados,nous avons été occupés,wir waren beschäftigt
799,we've no choice,we ve no choice,no tenemos elección,nous n'avons pas le choix,Wir haben keine Wahl
800,what a big cake,what a big cake,que gran pastel,quel gros gâteau,Was für ein großer Kuchen
801,what a blessing,what a blessing,que bendición,quelle bénédiction,was für ein Segen
802,what a disaster,what a disaster,qué desastre,quel désastre,Was für eine Katastrophe
803,what a huge dog,what a huge dog,que perro mas grande,quel énorme chien,Was für ein riesiger Hund
804,what a nice tie,what a nice tie,que bonita corbata,quelle belle cravate,Was für eine schöne Krawatte
805,what a pleasure,what a pleasure,qué placer,quel plaisir,Was für ein Vergnügen
806,what a prospect,what a prospect,que perspectiva,quelle perspective,was für eine aussicht
