,English,English_cleaned,Spanish,French,German
794,i'm on the roof,i am on the roof,estoy en el techo,je suis sur le toit,Ich bin auf dem Dach
795,i'm on vacation,i am on vacation,Estoy de vacaciones,Je suis en vacances,Ich bin im Urlaub
796,i'm only joking,i am only joking,yo sólo estoy bromeando,Je suis seulement en train de plaisanter,ich scherze nur
797,i'm out of ammo,i am out of ammo,estoy sin munición,je n'ai plus de munitions,Ich habe keine Munition mehr
798,i'm persevering,i am persevering,soy perseverante,je persévère,ich bin ausdauernd
799,i'm pretty busy,i am pretty busy,estoy muy ocupado,je suis assez occupé,Ich bin ziemlich beschäftigt
800,i'm quite happy,i am quite happy,estoy bastante feliz,je suis assez content,Ich bin ziemlich glücklich
801,i'm quite tired,i am quite tired,estoy bastante cansado,je suis assez fatigué,Ich bin ziemlich müde
802,i'm rather busy,i am rather busy,estoy bastante ocupado,je suis plutôt occupé,Ich bin ziemlich beschäftigt
803,i'm ready to go,i am ready to go,Estoy listo para irme,je suis prêt à partir,Ich bin bereit
804,i'm really busy,i am really busy,Estoy muy ocupado,je suis vraiment occupé,Ich bin wirklich beschäftigt
805,i'm really cold,i am really cold,tengo mucho frio,j'ai vraiment froid,Mir ist wirklich kalt
806,i'm replaceable,i am replaceable,soy reemplazable,je suis remplaçable,Ich bin ersetzbar
807,i'm resourceful,i am resourceful,soy ingenioso,je suis plein de ressources,Ich bin einfallsreich
808,i'm sick of you,i am sick of you,estoy harto de ti,je suis malade de toi,ich hab genug von dir
809,i'm so confused,i am so confused,Estoy muy confundido,je suis tellement confus,Ich bin so verwirrt
810,i'm spontaneous,i am spontaneous,soy espontáneo,je suis spontané,Ich bin spontan
811,i'm such a fool,i am such a fool,soy tan tonto,je suis un imbécile,Ich bin so ein Narr
812,i'm sympathetic,i am sympathetic,yo soy simpatico,je suis sympathique,Ich bin sympathisch
813,i'm the bad one,i am the bad one,yo soy el malo,je suis le mauvais,Ich bin der Böse
814,i'm the captain,i am the captain,yo soy el capitan,je suis le capitaine,Ich bin der Kapitän
815,i'm the manager,i am the manager,soy el gerente,je suis le gérant,Ich bin der Manager
816,i'm the surgeon,i am the surgeon,soy el cirujano,je suis le chirurgien,Ich bin der Chirurg
817,i'm the teacher,i am the teacher,Yo soy el maestro,je suis le professeur,Ich bin der Lehrer
818,i'm tired of it,i am tired of it,estoy cansado de eso,j'en ai marre,Ich bin es leid
819,i'm truly sorry,i am truly sorry,Lo siento de verdad,Je suis vraiment désolé,es tut mir wirklich leid
820,i'm trustworthy,i am trustworthy,soy digno de confianza,je suis digne de confiance,Ich bin vertrauenswürdig
821,i'm unambitious,i am unambitious,soy poco ambicioso,je ne suis pas ambitieux,ich bin ehrgeizig
822,i'm unconvinced,i am unconvinced,no estoy convencido,je ne suis pas convaincu,ich bin nicht überzeugt
823,i'm very hungry,i am very hungry,estoy muy hambriento,J'ai très faim,Ich bin sehr hungrig
824,i'm very modest,i am very modest,soy muy modesto,je suis très modeste,Ich bin sehr bescheiden
825,i'm very sleepy,i am very sleepy,tengo mucho sueño,j'ai vraiment sommeil,Ich bin sehr müde
826,i'm very strict,i am very strict,soy muy estricto,je suis très strict,ich bin sehr streng
827,i'm watching tv,i am watching tv,estoy mirando la televisión,je regarde la télé,ich schaue fern
828,i'm your doctor,i am your doctor,soy tu medico,je suis votre médecin,Ich bin dein Arzt
829,i'm your friend,i am your friend,yo soy tu amigo,je suis ton ami,ich bin dein Freund
830,i'm your lawyer,i am your lawyer,soy tu abogado,je suis ton avocat,Ich bin Ihr Anwalt
831,i'm your sister,i am your sister,soy tu hermana,je suis ta soeur,Ich bin deine Schwester
832,i've been wrong,i have been wrong,me he equivocado,j'ai eu tort,Ich habe mich geirrt
833,i've got a cold,i have got a cold,tengo un resfriado,j'ai un rhume,Ich habe eine Erkältung
834,i've got a list,i have got a list,tengo una lista,j'ai une liste,Ich habe eine Liste
835,i've got a plan,i have got a plan,tengo un plan,j'ai un plan,Ich habe einen Plan
836,i've got it all,i have got it all,lo tengo todo,j'ai tout,Ich habe alles
837,i've had enough,i have had enough,he tenido suficiente,j'en ai eu assez,ich hatte genug
838,is tom a member,is tom a member,es tom un miembro,est-ce que je suis membre,ist Tom Mitglied
839,is tom an actor,is tom an actor,es tom un actor,est-ce que je suis un acteur,ist tom ein schauspieler
840,is tom doing ok,is tom doing ok,¿Tom está bien?,est-ce que tom va bien,Geht es Tom gut
841,is tom dreaming,is tom dreaming,es tom soñando,est-ce que Tom rêve,träumt Tom
842,is tom swimming,is tom swimming,es tom nadando,est-ce que tom nage,ist tom schwimmen
843,is anybody here,is anybody here,hay alguien aqui,y a-t-il quelqu'un,Ist jemand hier
844,is anybody home,is anybody home,hay alguien en casa,y-a-t'il quelqu'un à la maison,ist jemand zuhause
845,is anybody hurt,is anybody hurt,¿Alguien está herido?,est-ce que quelqu'un est blessé,ist jemand verletzt
846,is anyone there,is anyone there,hay alguien ahí,est-ce que quelqu'un est là,Ist jemand da
847,is everybody ok,is everybody ok,¿Todos están bien?,est-ce que tout le monde va bien,geht es allen gut
848,is he a teacher,is he a teacher,Es él un profesor,Est ce un enseignant,Ist er ein Lehrer
849,is he breathing,is he breathing,¿Está respirando?,est-ce qu'il respire,atmet er
850,is it all there,is it all there,¿Está todo ahí?,est-ce que tout est là,ist alles da
851,is it all wrong,is it all wrong,¿Está todo mal?,est-ce que tout est faux,ist alles falsch
852,is it clear now,is it clear now,¿está claro ahora?,est-ce clair maintenant,ist es jetzt klar
853,is it dangerous,is it dangerous,Es peligroso,Est-il dangereux,Ist es gefährlich
854,is it good news,is it good news,es una buena noticia,est-ce une bonne nouvelle,ist es eine gute Nachricht
855,is it happening,is it happening,esta pasando,est-ce que ça se passe,passiert es
856,is it hazardous,is it hazardous,es peligroso,est-ce dangereux,ist es gefährlich
857,is it important,is it important,es importante,est-ce important,ist es wichtig
858,is it not black,is it not black,¿No es negro?,n'est-il pas noir,ist es nicht schwarz
859,is it poisonous,is it poisonous,es venenoso,est-ce toxique,ist es giftig
860,is it that hard,is it that hard,es tan dificil,est-ce si difficile,ist das so schwer
861,is it too small,is it too small,¿Es demasiado pequeño?,est-ce trop petit,ist es zu klein
862,is it your bike,is it your bike,es tu bicicleta,est-ce votre vélo,ist es dein Fahrrad
863,is it your book,is it your book,es tu libro,est-ce votre livre,ist es dein buch
864,is she japanese,is she japanese,ella es japonesa,est-elle japonaise,ist sie japanerin
865,is she a doctor,is she a doctor,es una doctora,est-elle médecin,Ist sie ein Doktor
866,is she here yet,is she here yet,¿Está ella aquí todavía?,est-elle encore là,ist sie schon da
867,is that a crime,is that a crime,eso es un crimen,est-ce un crime,ist das ein Verbrechen
868,is that allowed,is that allowed,eso está permitido,est-ce permis,ist das erlaubt
869,is that correct,is that correct,Es eso correcto,Est-ce exact,Ist das korrekt
870,is that genuine,is that genuine,es eso genuino,est-ce authentique,ist das echt
871,is that healthy,is that healthy,eso es saludable,est-ce sain,ist das gesund
872,is that illegal,is that illegal,eso es ilegal,est-ce illégal,ist das illegal
873,is that unusual,is that unusual,es tan inusual,est-ce inhabituel,ist das ungewöhnlich
874,is this a dream,is this a dream,es esto un sueño,est-ce un rêve,ist das ein traum
875,is this a river,is this a river,es este un rio,est-ce une rivière,ist das ein fluss
876,is this correct,is this correct,es esto correcto,est-ce correct,ist das richtig
877,is this ethical,is this ethical,es esto ético,est-ce éthique,ist das ethisch
878,is this my life,is this my life,es esta mi vida,est-ce ma vie,ist das mein leben
879,is this my wine,is this my wine,es este mi vino,est-ce mon vin,Ist das mein Wein?
880,is this natural,is this natural,es esto natural,est-ce naturel,ist das selbstverständlich
881,is this serious,is this serious,esto es serio,est ce sérieux,ist das ernst
882,is today monday,is today monday,hoy es lunes,c'est aujourd'hui lundi,ist heute Montag
883,is your car new,is your car new,tu auto es nuevo,ta voiture est elle neuve,ist dein auto neu
884,isn't it enough,is not it enough,¿No es suficiente?,n'est-ce pas assez,ist es nicht genug
885,isn't it lovely,is not it lovely,¿No es encantador?,n'est-ce pas charmant,ist es nicht lieblich
886,isn't that nice,is not that nice,no es tan agradable,n'est pas si gentil,ist nicht so schön
887,isn't that ours,is not that ours,no es eso nuestro,n'est-ce pas le nôtre,ist das nicht unser
888,isn't that true,is not that true,no es eso cierto,n'est-ce pas vrai,ist das nicht wahr
889,isn't this nice,is not this nice,no es tan agradable,n'est-ce pas agréable,ist das nicht schön
890,it blew my mind,it blew my mind,me voló la cabeza,ça m'a époustouflé,es hat mich umgehauen
891,it can be fatal,it can be fatal,puede ser fatal,ça peut être fatal,es kann tödlich sein
892,it could be tom,it could be tom,podría ser tom,ça pourrait être tom,es könnte tom sein
893,it could be fun,it could be fun,podría ser divertido,il pourrait être amusant,koennte Spass machen
894,it doesn't hurt,it does not hurt,No hace daño,ça ne fait pas mal,es tut nicht weh
895,it is an option,it is an option,es una opción,c'est une option,es ist eine Option
896,it isn't enough,it is not enough,no es suficiente,ce n'est pas assez,es ist nicht genug
897,it isn't locked,it is not locked,no esta bloqueado,il n'est pas verrouillé,es ist nicht gesperrt
898,it looked awful,it looked awful,se veía horrible,ça avait l'air horrible,es sah schrecklich aus
899,it looked cheap,it looked cheap,parecía barato,ça avait l'air pas cher,es sah billig aus
900,it looked fresh,it looked fresh,parecía fresco,ça avait l'air frais,es sah frisch aus
901,it looked funny,it looked funny,parecía gracioso,ça avait l'air drôle,es sah komisch aus
902,it may seem odd,it may seem odd,puede parecer raro,ça peut paraître bizarre,es mag seltsam erscheinen
903,it seems likely,it seems likely,parece probable,il semble probable,es scheint wahrscheinlich
904,it smells burnt,it smells burnt,huele a quemado,ça sent le brûlé,es riecht verbrannt
905,it sounded easy,it sounded easy,sonaba fácil,ça parait facile,es klang einfach
906,it sounds crazy,it sounds crazy,suena loco,ça a l'air fou,es klingt verrückt
907,it sounds great,it sounds great,suena grandioso,ça sonne bien,es klingt großartig
908,it tasted sweet,it tasted sweet,sabía dulce,ça avait un goût sucré,es schmeckte süß
909,it took all day,it took all day,tomó todo el día,ça a pris toute la journée,es dauerte den ganzen Tag
910,it was a gamble,it was a gamble,fue una apuesta,c'était un pari,es war ein Glücksspiel
911,it was a relief,it was a relief,fue un alivio,c'était un soulagement,es war eine Erleichterung
912,it was a secret,it was a secret,era un secreto,c'était un secret,es war ein Geheimnis
913,it was ages ago,it was ages ago,fue hace años,c'était il y a longtemps,es war vor Ewigkeiten
914,it was all done,it was all done,todo estaba hecho,tout a été fait,es war alles erledigt
915,it was all gone,it was all gone,todo se había ido,tout était parti,es war alles weg
916,it was all over,it was all over,todo había terminado,tout était fini,es war alles vorbei
917,it was enticing,it was enticing,era tentador,c'était alléchant,es war verlockend
918,it was exciting,it was exciting,fue emocionante,c'était excitant,es war aufregend
919,it was fabulous,it was fabulous,fue fabuloso,c'était fabuleux,es war fabelhaft
920,it was handmade,it was handmade,fue hecho a mano,c'était fait à la main,es war handgemacht
921,it was horrible,it was horrible,Fue horrible,c'était horrible,Es war schrecklich
922,it was my fault,it was my fault,Fue mi culpa,C'était de ma faute,Es war meine Schuld
923,it was personal,it was personal,fue personal,c'était personnel,es war persönlich
924,it was too hard,it was too hard,fue muy dificil,c'était trop dur,es war zu schwer
925,it was too late,it was too late,fue muy tarde,c'était trop tard,es war zu spät
926,it was too long,it was too long,fue demasiado largo,c'était trop long,es war zu lang
927,it was too soft,it was too soft,era demasiado suave,c'était trop mou,es war zu weich
928,it was unlocked,it was unlocked,fue desbloqueado,il a été déverrouillé,es war entsperrt
929,it was very hot,it was very hot,que estaba muy caliente,c'était très chaud,es war sehr heiß
930,it was worth it,it was worth it,valió la pena,ça valait la peine,Das war es wert
931,it wasn't funny,it was not funny,no fue divertido,Ce n'était pas drôle,es war nicht lustig
932,it'll be better,it will be better,será mejor,ce sera mieux,es wird besser sein
933,it'll be tricky,it will be tricky,será complicado,ce sera délicat,es wird knifflig
934,it'll rain soon,it will rain soon,lloverá pronto,il va bientôt pleuvoir,es wird bald regnen
935,it's ok with me,it is ok with me,está bien para mí,ça me va,es ist ok für mich
936,it's a bad time,it is a bad time,es un mal momento,c'est un mauvais moment,Es ist eine schlechte Zeit
937,it's a big city,it is a big city,es una gran ciudad,c'est une grande ville,es ist eine große Stadt
938,it's a dead end,it is a dead end,es un callejón sin salida,c'est une impasse,es ist eine Sackgasse
939,it's a disgrace,it is a disgrace,es una desgracia,c'est une honte,es ist eine Schande
940,it's a fine day,it is a fine day,es un buen dia,c'est une belle journée,Es ist ein schöner Tag
941,it's a mushroom,it is a mushroom,es un hongo,c'est un champignon,es ist ein Pilz
942,it's a new book,it is a new book,es un libro nuevo,c'est un nouveau livre,es ist ein neues Buch
943,it's a nice day,it is a nice day,es un lindo día,C'est une belle journée,Es ist ein schöner Tag
944,it's a shortcut,it is a shortcut,es un atajo,c'est un raccourci,es ist eine Abkürzung
945,it's a surprise,it is a surprise,es una sorpresa,c'est une surprise,es ist eine Überraschung
946,it's a travesty,it is a travesty,es una farsa,c'est une parodie,es ist eine Travestie
947,it's about time,it is about time,ya era hora,c'est bientôt l'heure,es ist an der Zeit
948,it's acceptable,it is acceptable,es aceptable,il est acceptable,es ist akzeptabel
949,it's all i know,it is all i know,es todo lo que se,c'est tout ce que je sais,es ist alles was ich weiß
950,it's all i need,it is all i need,es todo lo que necesito,c'est tout ce dont j'ai besoin,es ist alles was ich brauche
951,it's all i want,it is all i want,es todo lo que quiero,c'est tout ce que je veux,es ist alles was ich will
952,it's almost six,it is almost six,son casi las seis,il est presque six,es ist fast sechs
953,it's already 11,it is already 11,ya son las 11,il est déjà 11,es ist schon 11
954,it's an outrage,it is an outrage,es un ultraje,c'est un outrage,es ist eine Empörung
955,it's artificial,it is artificial,es artificial,c'est artificiel,es ist künstlich
956,it's as you say,it is as you say,es como tu dices,c'est comme tu dis,es ist wie du sagst
957,it's cold today,it is cold today,hoy hace frio,il fait froid aujourd'hui,Es ist kalt heute
958,it's cool today,it is cool today,hace fresco hoy,il fait frais aujourd'hui,heute ist es kühl
959,it's dirt cheap,it is dirt cheap,es muy barato,c'est pas cher,es ist spottbillig
960,it's dirty work,it is dirty work,es trabajo sucio,c'est du sale boulot,es ist Drecksarbeit
961,it's easy money,it is easy money,es dinero facil,c'est de l'argent facile,es ist leichtes geld
962,it's fine today,it is fine today,está bien hoy,il fait beau aujourd'hui,es ist heute in Ordnung
963,it's hard to do,it is hard to do,es dificil de hacer,c'est difficile à faire,es ist schwer zu tun
964,it's impossible,it is impossible,Es imposible,c'est impossible,es ist unmöglich
965,it's improbable,it is improbable,es improbable,c'est improbable,es ist unwahrscheinlich
966,it's inadequate,it is inadequate,es inadecuado,c'est insuffisant,es ist unzureichend
967,it's incredible,it is incredible,es increíble,C'est incroyable,es ist unglaublich
968,it's inevitable,it is inevitable,es inevitable,c'est inévitable,es ist unvermeidlich
969,it's irrelevant,it is irrelevant,es irrelevante,c'est sans importance,es ist irrelevant
970,it's just a fad,it is just a fad,es solo una moda,c'est juste une mode,es ist nur eine Modeerscheinung
971,it's just blood,it is just blood,es solo sangre,ce n'est que du sang,es ist nur Blut
972,it's just money,it is just money,es solo dinero,ce n'est que de l'argent,es ist nur Geld
973,it's just wrong,it is just wrong,simplemente está mal,c'est juste faux,es ist einfach falsch
974,it's lunch time,it is lunch time,es la hora del almuerzo,c'est l'heure du déjeuner,es ist Mittagszeit
975,it's misleading,it is misleading,es engañoso,c'est trompeur,es ist irreführend
976,it's my day off,it is my day off,es mi dia libre,c'est mon jour de repos,Es ist mein freier Tag
977,it's my problem,it is my problem,es mi problema,c'est mon problème,Es ist mein Problem
978,it's news to me,it is news to me,es una novedad para mi,c'est nouveau pour moi,es ist mir neu
979,it's no problem,it is no problem,no hay problema,ce n'est pas un problème,Es ist kein Problem
980,it's not a date,it is not a date,no es una cita,ce n'est pas un rendez-vous,es ist kein Datum
981,it's not a game,it is not a game,No es un juego,Ce n'est pas un jeu,es ist kein Spiel
982,it's not a gift,it is not a gift,no es un regalo,ce n'est pas un cadeau,es ist kein geschenk
983,it's not a joke,it is not a joke,no es una broma,ce n'est pas une blague,es ist kein Witz
984,it's not a loan,it is not a loan,no es un prestamo,ce n'est pas un prêt,es ist kein Darlehen
985,it's not broken,it is not broken,no esta roto,il n'est pas cassé,es ist nicht kaputt
986,it's not enough,it is not enough,no es suficiente,ce n'est pas assez,es ist nicht genug
987,it's not pretty,it is not pretty,no es bonito,ce n'est pas beau,es ist nicht schön
988,it's not secure,it is not secure,no es seguro,ce n'est pas sécurisé,es ist nicht sicher
989,it's not stupid,it is not stupid,no es estúpido,ce n'est pas stupide,es ist nicht dumm
990,it's on its way,it is on its way,esta en camino,c'est en route,es ist unterwegs
991,it's on my desk,it is on my desk,esta en mi escritorio,c'est sur mon bureau,es liegt auf meinem schreibtisch
992,it's only blood,it is only blood,es solo sangre,ce n'est que du sang,es ist nur Blut
993,it's only money,it is only money,es solo dinero,ce n'est que de l'argent,es ist nur Geld
994,it's pretty bad,it is pretty bad,es bastante malo,c'est plutôt mauvais,es ist ziemlich schlimm
995,it's pretty hot,it is pretty hot,hace bastante calor,il fait assez chaud,es ist ziemlich heiß
996,it's pretty new,it is pretty new,es bastante nuevo,c'est assez nouveau,es ist ziemlich neu
997,it's quite good,it is quite good,es bastante bueno,c'est assez bon,es ist ziemlich gut
998,it's quite nice,it is quite nice,es bastante agradable,c'est plutôt sympa,es ist ganz nett
999,it's quite safe,it is quite safe,es bastante seguro,c'est assez sûr,es ist ziemlich sicher
