,English,English_cleaned,Spanish,French,German
482,i have no problem,i have no problem,Yo no tengo ningún problema,Je n'ai pas de problème,Ich habe kein Problem
483,i have no regrets,i have no regrets,no tengo excusas,je n'ai pas de regrets,Ich bereue nichts
484,i have no savings,i have no savings,no tengo ahorros,je n'ai pas d'économies,Ich habe keine Ersparnisse
485,i have no sisters,i have no sisters,no tengo hermanas,je n'ai pas de soeurs,Ich habe keine Schwestern
486,i have no weapons,i have no weapons,no tengo armas,je n'ai pas d'armes,Ich habe keine Waffen
487,i have one sister,i have one sister,tengo una hermana,j'ai une soeur,Ich habe eine Schwester
488,i have some gifts,i have some gifts,tengo algunos regalos,j'ai des cadeaux,Ich habe einige Geschenke
489,i have some money,i have some money,Tengo algo de dinero,J'ai de l'argent,Ich habe etwas Geld
490,i have three cats,i have three cats,tengo tres gatos,j'ai trois chats,Ich habe drei Katzen
491,i have three dogs,i have three dogs,yo tengo tres perros,J'ai trois chiens,ich habe drei Hunde
492,i have to do this,i have to do this,Tengo que hacer esto,je dois faire ça,Ich muss das tun
493,i have to go back,i have to go back,tengo que volver,Je dois retourner,Ich muss zurück gehen
494,i have to go home,i have to go home,Tengo que ir a casa,je dois rentrer à la maison,ich muss nach Hause gehen
495,i have your diary,i have your diary,tengo tu diario,j'ai ton journal,Ich habe dein Tagebuch
496,i haven't decided,i have not decided,no he decidido,je n'ai pas décidé,ich habe mich nicht entschieden
497,i haven't started,i have not started,no he empezado,je n'ai pas commencé,ich habe nicht angefangen
498,i heard screaming,i heard screaming,oí gritar,j'ai entendu crier,Ich hörte Schreie
499,i heard something,i heard something,escuché algo,J'ai entendu quelque chose,Ich habe etwas gehört
500,i held his sleeve,i held his sleeve,sostuve su manga,j'ai tenu sa manche,Ich hielt seinen Ärmel
501,i hit rock bottom,i hit rock bottom,toqué fondo,j'ai touché le fond,Ich bin am Tiefpunkt angekommen
502,i hit the jackpot,i hit the jackpot,gané el premio gordo,j'ai touché le jackpot,Ich habe den Jackpot geknackt
503,i hope he's wrong,i hope he is wrong,espero que este equivocado,j'espère qu'il a tort,ich hoffe er liegt falsch
504,i hope she's safe,i hope she is safe,espero que ella esté a salvo,j'espère qu'elle est en sécurité,"Ich hoffe, sie ist in Sicherheit"
505,i hope that helps,i hope that helps,Espero que eso ayude,j'espère que ça aide,Ich hoffe das hilft
506,i hope this works,i hope this works,espero que esto funcione,j'espère que ça marche,Ich hoffe das funktioniert
507,i hope to see you,i hope to see you,espero verte,J'espère te voir,"ich hoffe, Sie zu sehen"
508,i hope we survive,i hope we survive,Espero que sobrevivamos,j'espère que nous survivrons,"Ich hoffe, wir überleben"
509,i intend to do so,i intend to do so,tengo la intención de hacerlo,j'ai l'intention de le faire,ich beabsichtige dies zu tun
510,i itch everywhere,i itch everywhere,me pica por todas partes,je démange partout,Ich jucke überall
511,i joined the army,i joined the army,me uní al ejército,j'ai rejoint l'armée,Ich bin der Armee beigetreten
512,i joined the navy,i joined the navy,me uní a la marina,j'ai rejoint la marine,Ich bin zur Marine gegangen
513,i just can't wait,i just cannot wait,simplemente no puedo esperar,je ne peux pas attendre,Ich kann nicht warten
514,i just dropped in,i just dropped in,acabo de caer,je viens de tomber,ich bin gerade reingekommen
515,i just feel awful,i just feel awful,me siento horrible,je me sens juste horrible,Ich fühle mich einfach schrecklich
516,i just gave blood,i just gave blood,acabo de dar sangre,je viens de donner du sang,Ich habe gerade Blut gespendet
517,i just got bitten,i just got bitten,me acaban de morder,je viens de me faire mordre,Ich wurde gerade gebissen
518,i just got tenure,i just got tenure,acabo de tener la tenencia,je viens d'être titularisé,Ich habe gerade eine Amtszeit bekommen
519,i just ignore tom,i just ignore tom,simplemente ignoro a tom,j'ignore juste tom,Ich ignoriere Tom einfach
520,i just moved here,i just moved here,Me acabo de mudar aquí,je viens d'emménager ici,Ich bin gerade hergezogen
521,i just need a hug,i just need a hug,solo necesito un abrazo,j'ai juste besoin d'un calin,ich brauche nur eine Umarmung
522,i just remembered,i just remembered,me acabo de acordar,Je viens juste de me souvenir,mir fällt gerade ein
523,i kept it with me,i kept it with me,lo guardé conmigo,je l'ai gardé avec moi,ich habe es bei mir behalten
524,i kept on reading,i kept on reading,seguí leyendo,j'ai continué à lire,ich las weiter
525,i kept on singing,i kept on singing,seguí cantando,j'ai continué à chanter,ich sang weiter
526,i kept on talking,i kept on talking,seguí hablando,j'ai continué à parler,Ich redete weiter
527,i kept on walking,i kept on walking,seguí caminando,j'ai continué à marcher,ich ging weiter
528,i kissed tom back,i kissed tom back,le devolví el beso a tom,j'ai embrassé tom en retour,Ich habe Tom zurück geküsst
529,i knew the answer,i knew the answer,sabía la respuesta,je connaissais la réponse,Ich wusste die Antwort
530,i knew who did it,i knew who did it,sabía quién lo hizo,je savais qui l'avait fait,"Ich wusste, wer es getan hat"
531,i knew who he was,i knew who he was,sabia quien era,je savais qui il était,"Ich wusste, wer er war"
532,i knew you'd come,i knew you would come,sabía que vendrías,je savais que tu viendrais,"Ich wusste, dass du kommen würdest"
533,i know a shortcut,i know a shortcut,conozco un atajo,je connais un raccourci,Ich kenne eine Abkürzung
534,i know about that,i know about that,Yo sé sobre eso,je sais à ce sujet,ich kenne das
535,i know everything,i know everything,lo se todo,je sais tout,ich weiß alles
536,i know he is busy,i know he is busy,sé que está ocupado,je sais qu'il est occupé,"Ich weiß, dass er beschäftigt ist"
537,i know his family,i know his family,conozco a su familia,je connais sa famille,Ich kenne seine Familie
538,i know how to fly,i know how to fly,yo se volar,je sais voler,"Ich weiß, wie man fliegt"
539,i know how to ski,i know how to ski,sé esquiar,je sais skier,Ich kann Skifahren
540,i know how to win,i know how to win,yo se como ganar,je sais comment gagner,"Ich weiß, wie man gewinnt"
541,i know it was you,i know it was you,se que fuiste tu,je sais que c'était toi,"Ich weiß, dass du es warst"
542,i know it's a lie,i know it is a lie,se que es mentira,je sais que c'est un mensonge,"Ich weiß, es ist eine Lüge"
543,i know that story,i know that story,conozco esa historia,je connais cette histoire,Ich kenne diese Geschichte
544,i know the answer,i know the answer,Yo se la respuesta,je connais la réponse,ich weiß die Antwort
545,i know what i did,i know what i did,sé lo que hice,je sais ce que j'ai fait,"Ich weiß, was ich getan habe"
546,i know what to do,i know what to do,Sé lo que tengo que hacer,je sais quoi faire,Ich weiß was zu tun ist
547,i know who did it,i know who did it,yo se quien lo hizo,je sais qui l'a fait,"Ich weiß, wer es getan hat"
548,i know who it was,i know who it was,yo se quien fue,je sais qui c'était,"Ich weiß, wer es war"
549,i know you did it,i know you did it,Sé que lo hiciste,je sais que tu l'as fait,"Ich weiß, dass du es getan hast"
550,i lack confidence,i lack confidence,me falta confianza,je manque de confiance,Mir fehlt das Vertrauen
551,i left in a hurry,i left in a hurry,me fui a toda prisa,je suis parti précipitamment,Ich bin in Eile gegangen
552,i left you a note,i left you a note,te deje una nota,je t'ai laissé un mot,Ich habe dir eine Nachricht hinterlassen
553,i let the dog out,i let the dog out,dejo salir al perro,je laisse sortir le chien,Ich habe den Hund rausgelassen
554,i lied about that,i lied about that,mentí sobre eso,j'ai menti à ce sujet,Ich habe darüber gelogen
555,i like adventures,i like adventures,me gustan las aventuras,j'aime les aventures,Ich mag Abenteuer
556,i like big cities,i like big cities,me gustan las ciudades grandes,j'aime les grandes villes,ich mag große Städte
557,i like challenges,i like challenges,Me gustan los retos,j'aime les défis,ich mag Herausforderungen
558,i like coffee hot,i like coffee hot,me gusta el cafe caliente,j'aime le café chaud,Ich mag Kaffee heiß
559,i like cold pizza,i like cold pizza,me gusta la pizza fria,j'aime la pizza froide,Ich mag kalte Pizza
560,i like doing this,i like doing this,me gusta hacer esto,j'aime faire ça,ich mache das gerne
561,i like folk songs,i like folk songs,me gustan las canciones populares,j'aime les chansons populaires,Ich mag Volkslieder
562,i like hot coffee,i like hot coffee,me gusta el cafe caliente,j'aime le café chaud,Ich mag heißen Kaffee
563,i like it so much,i like it so much,Me gusta mucho,je l'aime tellement,Ich mag es so sehr
564,i like loud music,i like loud music,me gusta la musica fuerte,j'aime la musique forte,Ich mag laute Musik
565,i like my friends,i like my friends,me gustan mis amigos,J'aime mes amis,Ich mag meine Freunde
566,i like rock music,i like rock music,Me gusta la música rock,J'aime la musique rock,ich mag Rockmusik
567,i like sauerkraut,i like sauerkraut,me gusta el chucrut,j'aime la choucroute,Ich mag Sauerkraut
568,i like short hair,i like short hair,me gusta el pelo corto,j'aime les cheveux courts,Ich mag kurze Haare
569,i like that shirt,i like that shirt,me gusta esa camisa,j'aime cette chemise,Ich mag das Hemd
570,i like that skirt,i like that skirt,me gusta esa falda,j'aime cette jupe,Ich mag diesen Rock
571,i like the colors,i like the colors,me gustan los colores,j'aime les couleurs,Ich mag die Farben
572,i like these hats,i like these hats,me gustan estos sombreros,j'aime ces chapeaux,Ich mag diese Mützen
573,i like this chair,i like this chair,me gusta esta silla,j'aime cette chaise,Ich mag diesen Stuhl
574,i like this color,i like this color,me gusta este color,j'aime cette couleur,Ich mag diese Farbe
575,i like this model,i like this model,me gusta este modelo,j'aime ce modèle,Ich mag dieses Modell
576,i like this store,i like this store,me gusta esta tienda,j'aime ce magasin,Ich mag diesen Laden
577,i like those odds,i like those odds,me gustan esas probabilidades,j'aime ces cotes,Ich mag diese Quoten
578,i like to be here,i like to be here,me gusta estar aquí,j'aime être ici,Ich bin gerne hier
579,i like watermelon,i like watermelon,Me gusta el melón,j'aime la pastèque,Ich mag Wassermelone
580,i like what i see,i like what i see,me gusta lo que veo,J'aime ce que je vois,Mir gefällt was ich sehe
581,i like your beard,i like your beard,me gusta tu barba,J'aime ta barbe,ich mag deinen Bart
582,i like your dress,i like your dress,me gusta tu vestido,J'aime bien ta robe,ich mag dein Kleid
583,i like your house,i like your house,me gusta tu casa,J'aime ta maison,Ich mag dein Haus
584,i like your place,i like your place,me gusta tu lugar,j'aime ta place,Ich mag deinen Platz
585,i like your scarf,i like your scarf,me gusta tu bufanda,j'aime ton écharpe,Ich mag deinen Schal
586,i like your shoes,i like your shoes,Me gustan tus zapatos,J'aime tes chaussures,Ich mag deine Schuhe
587,i like your smile,i like your smile,me gusta tu sonrisa,J'aime ton sourire,ich mag dein Lächeln
588,i like your style,i like your style,me gusta tu estilo,J'aime ton style,Ich mag deine Art
589,i liked that book,i liked that book,me gusto ese libro,j'ai aimé ce livre,Ich mochte dieses Buch
590,i liked that song,i liked that song,me gusto esa cancion,j'ai aimé cette chanson,Ich mochte das Lied
591,i liked that wine,i liked that wine,me gusto ese vino,j'ai aimé ce vin,Ich mochte diesen Wein
592,i liked the movie,i liked the movie,me gusto la pelicula,J'ai aimé le film,Ich mochte den Film
593,i liked this book,i liked this book,me gusto este libro,j'ai aimé ce livre,Ich mochte dieses Buch
594,i liked this film,i liked this film,me gusto esta pelicula,j'ai aimé ce film,Ich mochte diesen Film
595,i lit the candles,i lit the candles,encendí las velas,j'ai allumé les bougies,Ich habe die Kerzen angezündet
596,i live here alone,i live here alone,vivo aquí solo,je vis ici seul,Ich lebe hier alleine
597,i live in a hotel,i live in a hotel,vivo en un hotel,je vis dans un hôtel,Ich wohne in einem Hotel
598,i live in comfort,i live in comfort,vivo en la comodidad,je vis dans le confort,ich lebe bequem
599,i live near a dam,i live near a dam,vivo cerca de una represa,j'habite près d'un barrage,Ich wohne in der Nähe eines Staudamms
600,i locked the door,i locked the door,cerré la puerta,j'ai verrouillé la porte,Ich habe die Tür abgeschlossen
601,i lost an earring,i lost an earring,perdí un pendiente,j'ai perdu une boucle d'oreille,Ich habe einen Ohrring verloren
602,i lost everything,i lost everything,Lo perdí todo,j'ai tout perdu,ich habe alles verloren
603,i lost my balance,i lost my balance,perdí el equilibrio,j'ai perdu mon équilibre,Ich verlor mein Gleichgewicht
604,i lost my car key,i lost my car key,perdí la llave de mi auto,j'ai perdu ma clé de voiture,Ich habe meinen Autoschlüssel verloren
605,i lost my glasses,i lost my glasses,Perdí mis gafas,J'ai perdu mes lunettes,Ich habe meine Brille verloren
606,i love all of you,i love all of you,Los amo a todos ustedes,je vous aime tous,ich liebe euch alle
607,i love doing this,i love doing this,me encanta hacer esto,j'adore faire ça,"Ich liebe es, das zu tun"
608,i love hamburgers,i love hamburgers,amo las hamburguesas,j'adore les hamburgers,Ich liebe Hamburger
609,"i love music, too",i love music  too,yo tambien amo la musica,j'aime la musique aussi,ich liebe musik auch
610,i love my country,i love my country,amo mi país,J'aime mon pays,ich liebe mein Land
611,i love my friends,i love my friends,quiero a mis amigos,J'aime mes amis,ich liebe meine Freunde
612,i love my new job,i love my new job,amo mi nuevo trabajo,j'aime mon nouveau travail,Ich liebe meinen neuen Job
613,i love my parents,i love my parents,amo a mis papas,je aime mes parents,ich liebe meine Eltern
614,i love performing,i love performing,me encanta actuar,j'aime jouer,ich liebe es aufzutreten
615,i love that chair,i love that chair,me encanta esa silla,j'adore cette chaise,Ich liebe diesen Stuhl
616,i love that dress,i love that dress,me encanta ese vestido,j'adore cette robe,Ich liebe dieses Kleid
617,i love that movie,i love that movie,me encanta esa película,J'adore ce film,Ich liebe diesen Film
618,i love that place,i love that place,me encanta ese lugar,j'aime cet endroit,Ich liebe diesen Ort
619,i love that scarf,i love that scarf,me encanta esa bufanda,j'adore cette écharpe,Ich liebe diesen Schal
620,i love that shirt,i love that shirt,me encanta esa camisa,j'aime cette chemise,Ich liebe dieses Hemd
621,i love that store,i love that store,me encanta esa tienda,j'adore ce magasin,Ich liebe diesen Laden
622,i love that story,i love that story,me encanta esa historia,j'aime cette histoire,Ich liebe diese Geschichte
623,i love the colors,i love the colors,me encantan los colores,j'aime les couleurs,Ich liebe die Farben
624,i love this album,i love this album,me encanta este album,j'adore cet album,Ich liebe dieses Album
625,i love this chair,i love this chair,me encanta esta silla,j'adore cette chaise,Ich liebe diesen Stuhl
626,i love this group,i love this group,me encanta este grupo,j'adore ce groupe,Ich liebe diese Gruppe
627,i love this photo,i love this photo,me encanta esta foto,J'aime cette photo,Ich liebe dieses Foto
628,i love this place,i love this place,amo este lugar,J'adore cet endroit,Ich liebe diesen Ort
629,i love this store,i love this store,me encanta esta tienda,j'adore ce magasin,Ich liebe diesen Laden
630,i love this story,i love this story,me encanta esta historia,j'aime cette histoire,Ich liebe diese Geschichte
631,i love this video,i love this video,Yo amo este video,J'aime cette vidéo,ich liebe dieses Video
632,i love you anyway,i love you anyway,te amo de todas maneras,je t'aime quand même,Ich liebe dich trotzdem
633,i love you people,i love you people,los amo a ustedes,je vous aime les gens,ich liebe euch Leute
634,i love your dress,i love your dress,Me gusta tu vestido,J'aime ta robe,Ich liebe dein Kleid
635,i love your house,i love your house,amo tu casa,j'aime ta maison,Ich liebe dein Haus
636,i love your place,i love your place,me encanta tu lugar,j'aime ta place,Ich liebe deinen Platz
637,i loved that book,i loved that book,me encantó ese libro,j'ai adoré ce livre,Ich liebte dieses Buch
638,i loved this book,i loved this book,me encantó este libro,j'ai adoré ce livre,Ich habe dieses Buch geliebt
639,i made a decision,i made a decision,Tomé una decisión,j'ai pris une décision,Ich habe eine Entscheidung gemacht
640,i made a proposal,i made a proposal,hice una propuesta,j'ai fait une proposition,Ich habe einen Vorschlag gemacht
641,i made fun of him,i made fun of him,me burle de el,je me suis moqué de lui,ich habe mich über ihn lustig gemacht
642,i made it on time,i made it on time,lo hice a tiempo,je l'ai fait à temps,ich habe es pünktlich geschafft
643,i made this chair,i made this chair,hice esta silla,j'ai fait cette chaise,Ich habe diesen Stuhl gemacht
644,i made you coffee,i made you coffee,te hice café,je t'ai fait du café,Ich habe dir Kaffee gemacht
645,i may outlive you,i may outlive you,puedo sobrevivirte,je peux te survivre,Ich kann dich überleben
646,i mean what i say,i mean what i say,me refiero a lo que digo,je pense ce que je dis,ich meine was ich sage
647,i met your friend,i met your friend,conocí a tu amigo,j'ai rencontré ton ami,Ich habe deinen Freund getroffen
648,i miss it already,i miss it already,Ya lo extraño,ça me manque déjà,ich vermisse es schon
649,i miss my friends,i miss my friends,echo de menos a mis amigos,mes amis me manquent,ich vermisse meine Freunde
650,i miss my parents,i miss my parents,Extraño a mis Padres,Mes parents me manquent,Ich vermisse meine Eltern
651,i miss that place,i miss that place,Echo de menos ese lugar,cet endroit me manque,Ich vermisse diesen Ort
652,i miss this place,i miss this place,extraño este lugar,Cet endroit me manque,Ich vermisse diesen Platz
653,i missed my train,i missed my train,Perdí mi tren,j'ai raté mon train,Ich habe meinen Zug verpasst
654,i missed you kids,i missed you kids,los extrañé niños,vous m'avez manqué les enfants,"Ich habe euch vermisst, Kinder"
655,i must eat slowly,i must eat slowly,debo comer despacio,je dois manger lentement,Ich muss langsam essen
656,i must go to work,i must go to work,debo irme al trabajo,Je dois aller au travail,Ich muss zur Arbeit gehen
657,i need 30 minutes,i need 30 minutes,necesito 30 minutos,j'ai besoin de 30 minutes,Ich brauche 30 Minuten
658,i need tom's help,i need tom s help,necesito la ayuda de tom,j'ai besoin de l'aide de tom,Ich brauche Toms Hilfe
659,i need a breather,i need a breather,necesito un respiro,j'ai besoin d'une pause,Ich brauche eine Verschnaufpause
660,i need a computer,i need a computer,necesito una computadora,j'ai besoin d'un ordinateur,Ich brauche einen Computer
661,i need a keyboard,i need a keyboard,necesito un teclado,j'ai besoin d'un clavier,Ich brauche eine Tastatur
662,i need a long nap,i need a long nap,necesito una siesta larga,j'ai besoin d'une longue sieste,Ich brauche ein langes Nickerchen
663,i need a vacation,i need a vacation,necesito vacaciones,J'ai besoin de vacances,Ich brauche Urlaub
664,i need more light,i need more light,necesito mas luz,j'ai besoin de plus de lumière,Ich brauche mehr Licht
665,i need more money,i need more money,necesito mas dinero,j'ai besoin de plus d'argent,Ich brauche mehr Geld
666,i need more power,i need more power,necesito mas poder,j'ai besoin de plus de puissance,Ich brauche mehr Kraft
667,i need my privacy,i need my privacy,necesito mi privacidad,j'ai besoin de ma vie privée,Ich brauche meine Privatsphäre
668,i need protection,i need protection,necesito protección,j'ai besoin de protection,Ich brauche Schutz
669,i need some light,i need some light,necesito algo de luz,j'ai besoin de lumière,Ich brauche etwas Licht
670,i need some paper,i need some paper,necesito un poco de papel,j'ai besoin de papier,Ich brauche etwas Papier
671,i need some sleep,i need some sleep,necesito dormir,J'ai besoin de dormir,Ich brauche etwas Schlaf
672,i need some sugar,i need some sugar,necesito un poco de azúcar,j'ai besoin de sucre,Ich brauche etwas Zucker
673,i need some water,i need some water,necesito un poco de agua,j'ai besoin d'eau,ich brauche etwas Wasser
674,i need this money,i need this money,necesito este dinero,j'ai besoin de cet argent,Ich brauche dieses Geld
675,i need to do that,i need to do that,necesito hacer eso,je dois faire ça,Ich muss das tun
676,i need to do this,i need to do this,Necesito hacer esto,Je dois le faire,Ich muss das tun
677,i need to go home,i need to go home,necesito ir a casa,J ai besoin de rentrer a la maison,ich muss nach Hause
678,i need to hear it,i need to hear it,necesito escucharlo,J'ai besoin de l'entendre,ich muss es hören
679,i need volunteers,i need volunteers,necesito voluntarios,j'ai besoin de volontaires,Ich brauche Freiwillige
680,i needed a change,i needed a change,necesitaba un cambio,j'avais besoin d'un changement,Ich brauchte eine Veränderung
681,i never knew that,i never knew that,Nunca lo supe,Je n'ai jamais su cela,ich habe das niemals gewusst
682,i never loved you,i never loved you,nunca te amé,je ne t'ai jamais aimé,ich habe dich niemals geliebt
683,i never oversleep,i never oversleep,nunca me quedo dormido,je ne dors jamais trop,ich verschlafe nie
684,i never said that,i never said that,yo nunca dije eso,je n'ai jamais dit cela,ich habe das nie gesagt
685,i never went back,i never went back,nunca volví,je n'y suis jamais retourné,Ich ging nie zurück
686,i nodded silently,i nodded silently,asentí en silencio,j'ai hoché la tête silencieusement,Ich nickte stumm
687,i often drink tea,i often drink tea,a menudo bebo té,je bois souvent du thé,ich trinke oft tee
688,i often go abroad,i often go abroad,a menudo voy al extranjero,je vais souvent à l'étranger,ich fahre oft ins ausland
689,i opened a window,i opened a window,abrí una ventana,j'ai ouvert une fenêtre,Ich habe ein Fenster geöffnet
690,i opened the door,i opened the door,Abrí la puerta,J'ai ouvert la porte,Ich habe die Tür geöffnet
691,i ordered a pizza,i ordered a pizza,pedí una pizza,j'ai commandé une pizza,Ich habe eine Pizza bestellt
692,i overslept again,i overslept again,me quedé dormido otra vez,j'ai encore dormi trop longtemps,Ich habe wieder verschlafen
693,i owe him 100 yen,i owe him 100 yen,le debo 100 yenes,je lui dois 100 yens,Ich schulde ihm 100 Yen
694,i owe him my life,i owe him my life,le debo mi vida,je lui dois la vie,Ich verdanke ihm mein Leben
695,i owe him nothing,i owe him nothing,no le debo nada,je ne lui dois rien,Ich schulde ihm nichts
696,i owe you a favor,i owe you a favor,te debo un favor,je te dois une faveur,Ich schulde dir einen Gefallen
697,i owe you a lunch,i owe you a lunch,te debo un almuerzo,je te dois un déjeuner,Ich schulde dir ein Mittagessen
698,i owe you my life,i owe you my life,te debo mi vida,Je te dois ma vie,Ich schulde dir mein Leben
699,i owe you nothing,i owe you nothing,no te debo nada,Je ne te dois rien,Ich schulde dir gar nichts
700,i owe you so much,i owe you so much,te debo tanto,je vous dois tellement,Ich schulde dir so viel
701,i paid in advance,i paid in advance,pagué por adelantado,j'ai payé d'avance,Ich habe im Voraus bezahlt
702,i picked the lock,i picked the lock,escogí la cerradura,j'ai crocheté la serrure,Ich habe das Schloss geknackt
703,i plan on winning,i plan on winning,planeo ganar,j'ai l'intention de gagner,Ich plane zu gewinnen
704,i play the violin,i play the violin,toco el violín,je joue du violon,ich spiele Violine
705,i played football,i played football,Yo jugué fútbol,j'ai joué au football,ich spielte Fußball
706,i plead ignorance,i plead ignorance,declaro ignorancia,je plaide l'ignorance,ich plädiere auf unwissenheit
707,i pulled a muscle,i pulled a muscle,me desgarré un músculo,j'ai tiré un muscle,Ich habe mir einen Muskel gezerrt
708,i ran into a deer,i ran into a deer,me crucé con un ciervo,je suis tombé sur un cerf,Ich bin einem Reh begegnet
709,i ran into a tree,i ran into a tree,Choqué con un árbol,j'ai couru dans un arbre,Ich bin gegen einen Baum gelaufen
710,i rarely eat meat,i rarely eat meat,rara vez como carne,je mange rarement de la viande,Ich esse selten Fleisch
711,i read some books,i read some books,leí algunos libros,j'ai lu des livres,Ich lese einige Bücher
712,i really am sorry,i really am sorry,realmente lo siento,je suis vraiment désolé,Es tut mir wirklich leid
713,i really did that,i really did that,realmente hice eso,j'ai vraiment fait ça,das habe ich wirklich gemacht
714,i really doubt it,i really doubt it,realmente lo dudo,j'en doute vraiment,ich bezweifle es wirklich
715,i really hope not,i really hope not,Realmente espero que no,j'espère vraiment que non,Ich hoffe wirklich nicht
716,i really like him,i really like him,El realmente me gusta,je l'aime vraiment bien,Ich mag ihn wirklich
717,i really like you,i really like you,realmente me gustas,je t'apprécie vraiment,Ich mag dich wirklich
718,i really love you,i really love you,realmente te quiero,je t'aime vraiment,Ich liebe dich wirklich
719,i really miss tom,i really miss tom,realmente extraño a tom,Tom me manque vraiment,Ich vermisse Tom wirklich
