,English,English_cleaned,Spanish,French,German
236,are you still happy,are you still happy,¿Sigues siendo feliz?,es-tu toujours heureux,bist du immer noch glücklich
237,are you still there,are you still there,estás ahí todavía,Vous êtes toujours là,bist du noch da
238,are you that stupid,are you that stupid,¿Eres tan estúpido?,es-tu si stupide,bist du so dumm
239,are you the manager,are you the manager,¿eres el gerente?,êtes-vous le gestionnaire,bist du der Manager
240,are you the prophet,are you the prophet,eres el profeta,es-tu le prophète,bist du der prophet
241,are you very hungry,are you very hungry,Estas muy hambriento,as-tu très faim,bist du sehr hungrig
242,aren't you a banker,are not you a banker,no eres banquero,n'êtes-vous pas un banquier,Bist du kein Bankier?
243,ask tom to be quiet,ask tom to be quiet,pidele a tom que se calle,demande à tom de se taire,"Bitten Sie Tom, ruhig zu sein"
244,ask tom to help you,ask tom to help you,pídele a tom que te ayude,demande à tom de t'aider,"Bitten Sie Tom, Ihnen zu helfen"
245,baby ducks are cute,baby ducks are cute,los patitos son lindos,les bébés canards sont mignons,Babyenten sind süß
246,bad habits die hard,bad habits die hard,los malos hábitos son difíciles de morir,les mauvaises habitudes ont la vie dure,schlechte Gewohnheiten sterben schwer
247,"be polite, but firm",be polite  but firm,se educado pero firme,être poli mais ferme,"sei höflich, aber bestimmt"
248,be quiet and listen,be quiet and listen,calla y escucha,tais-toi et écoute,sei ruhig und höre zu
249,best of luck to you,best of luck to you,La mejor de las suertes para ti,Bonne chance à vous,Viel Glück für Sie
250,beware of jellyfish,beware of jellyfish,cuidado con las medusas,attention aux méduses,Vorsicht vor Quallen
251,black absorbs light,black absorbs light,el negro absorbe la luz,le noir absorbe la lumière,Schwarz absorbiert Licht
252,breakfast is served,breakfast is served,El desayuno esta servido,le petit déjeuner est servi,Frühstück ist serviert
253,bring me my glasses,bring me my glasses,tráeme mis lentes,apporte moi mes lunettes,Bring mir meine Brille
254,bring me some water,bring me some water,tráeme un poco de agua,apporte moi de l'eau,Bring mir etwas Wasser
255,bunnies are so cute,bunnies are so cute,los conejitos son tan lindos,les lapins sont si mignons,Hasen sind so süß
256,but i wasn't afraid,but i was not afraid,pero no tenia miedo,mais je n'avais pas peur,aber ich hatte keine angst
257,button your coat up,button your coat up,abotona tu abrigo,boutonne ton manteau,knöpfe deinen Mantel zu
258,call if you need me,call if you need me,llama si me necesitas,appelle si tu as besoin de moi,"ruf an, wenn du mich brauchst"
259,can i call you back,can i call you back,puedo llamar de vuelta,puis-je vous rappeler,kann ich dich zurück rufen
260,can i do this later,can i do this later,¿Puedo hacer esto más tarde?,puis-je le faire plus tard,kann ich das später machen
261,"can i drive, please",can i drive  please,puedo conducir por favor,puis-je conduire s'il vous plaît,Kann ich bitte fahren?
262,can i eat this cake,can i eat this cake,¿puedo comer este pastel?,puis-je manger ce gâteau,kann ich diesen kuchen essen
263,can i go to bed now,can i go to bed now,puedo ir a la cama ahora,puis-je aller au lit maintenant,kann ich jetzt ins bett gehen
264,can i have a coffee,can i have a coffee,puedo tener un café,puis-je avoir un café,kann ich einen Kaffee haben
265,can i have a second,can i have a second,puedo tener un segundo,puis-je avoir une seconde,Kann ich eine Sekunde haben?
266,can i have some tea,can i have some tea,¿puedo tomar un poco de té?,puis-je avoir du thé,Kann ich etwas Tee haben
267,can i pay on credit,can i pay on credit,¿Puedo pagar a crédito?,puis-je payer à crédit,kann ich auf kredit bezahlen
268,can i ride with you,can i ride with you,¿Puedo viajar contigo?,puis-je monter avec toi,kann ich mit dir fahren
269,can i see you again,can i see you again,puedo verte de nuevo,est-ce que je peux vous revoir,Kann ich dich noch mal sehen
270,can i take a shower,can i take a shower,Puedo tomar una ducha,puis-je prendre une douche,kann ich duschen
271,can i talk with you,can i talk with you,puedo hablar contigo,Puis-je vous parler,Kann ich mit dir reden
272,can i use this bike,can i use this bike,¿Puedo usar esta bicicleta?,puis-je utiliser ce vélo,Kann ich dieses Fahrrad benutzen?
273,can he speak french,can he speak french,¿Puede hablar francés?,peut-il parler français,kann er französisch sprechen
274,can we believe that,can we believe that,podemos creer que,peut-on croire que,können wir das glauben
275,can we change rooms,can we change rooms,¿Podemos cambiar de habitación?,Pouvons-nous changer de chambre ?,Können wir die Zimmer wechseln?
276,can we do that here,can we do that here,¿Podemos hacer eso aquí?,peut-on faire ça ici,können wir das hier machen
277,can we go back home,can we go back home,podemos volver a casa,pouvons-nous rentrer à la maison,Können wir nach Hause gehen
278,can we just drop it,can we just drop it,¿Podemos dejarlo?,pouvons-nous simplement le laisser tomber,können wir es einfach fallen lassen
279,can we just go home,can we just go home,¿podemos irnos a casa?,Pouvons-nous simplement rentrer à la maison,Können wir einfach nach Hause gehen?
280,can we recycle this,can we recycle this,podemos reciclar esto,peut-on recycler ça,Können wir das recyceln?
281,can we speak french,can we speak french,¿Podemos hablar francés?,peut-on parler français,Können wir Französisch sprechen?
282,can you answer that,can you answer that,puedes responder eso,pouvez-vous répondre à cela,kannst du das beantworten
283,can you answer this,can you answer this,Puedes responder esto,pouvez-vous répondre à cela,kannst du das beantworten
284,can you describe it,can you describe it,puedes describirlo,pouvez vous le décrire,kannst du es beschreiben
285,can you drive a car,can you drive a car,puedes conducir un coche,peux tu conduire une voiture,kannst du ein Auto fahren
286,can you read arabic,can you read arabic,¿Puedes leer árabe?,sais-tu lire l'arabe,kannst du arabisch lesen
287,can you read french,can you read french,puedes leer frances,sais-tu lire le français,kannst du französisch lesen
288,can you really swim,can you really swim,¿realmente puedes nadar?,peux-tu vraiment nager,kannst du wirklich schwimmen
289,can you repair this,can you repair this,puedes reparar esto,pouvez-vous réparer cela,kannst du das reparieren
290,can you tell me how,can you tell me how,puedes decirme como,Pouvez-vous me dire comment,Kannst du mir sagen wie
291,can you verify that,can you verify that,puedes verificar eso,pouvez-vous vérifier que,kannst du das verifizieren
292,catch me if you can,catch me if you can,Atrápame si puedes,attrape-moi si tu peux,"Fang mich, wenn du kannst"
293,change is important,change is important,el cambio es importante,le changement est important,Veränderung ist wichtig
294,change your clothes,change your clothes,cambia tu ropa,changer de vêtements,Wechsle deine Kleidung
295,chew your food well,chew your food well,mastica bien tu comida,bien mâcher sa nourriture,Kauen Sie Ihr Essen gut
296,chivalry isn't dead,chivalry is not dead,la caballería no ha muerto,la chevalerie n'est pas morte,Ritterlichkeit ist nicht tot
297,christmas drew near,christmas drew near,la navidad se acerco,Noël approchait,Weihnachten rückte näher
298,christmas is coming,christmas is coming,se acerca la navidad,Noël approche,Weihnachten steht vor der Tür
299,clear off the table,clear off the table,limpiar la mesa,débarrasser la table,den Tisch abräumen
300,come again tomorrow,come again tomorrow,ven de nuevo mañana,reviens demain,komm morgen wieder
301,come here right now,come here right now,ven aquí ahora mismo,Viens ici tout de suite,Komm jetzt her
302,come meet everybody,come meet everybody,ven a conocer a todos,venez rencontrer tout le monde,"Komm, triff alle"
303,"come on, talk to me",come on  talk to me,ven háblame,viens me parler,Komm rede mit mir
304,contact me tomorrow,contact me tomorrow,contáctame mañana,contactez moi demain,kontaktiere mich morgen
305,continue your story,continue your story,continúa tu historia,continuez votre histoire,setze deine Geschichte fort
306,cookie needs a walk,cookie needs a walk,la galleta necesita un paseo,cookie a besoin d'une promenade,Plätzchen braucht einen Spaziergang
307,could you sign here,could you sign here,podrías firmar aquí,pourriez-vous signer ici,könntest du hier unterschreiben
308,crime is increasing,crime is increasing,el crimen va en aumento,la criminalité augmente,Kriminalität nimmt zu
309,cyprus is an island,cyprus is an island,Chipre es una isla,Chypre est une île,Zypern ist eine Insel
310,day will break soon,day will break soon,el día romperá pronto,le jour se lèvera bientôt,der Tag wird bald anbrechen
311,death is inevitable,death is inevitable,la muerte es inevitable,la mort est inévitable,der Tod ist unvermeidlich
312,did i embarrass you,did i embarrass you,¿Te avergoncé?,est-ce que je t'ai embarrassé,habe ich dich in Verlegenheit gebracht
313,did i forget anyone,did i forget anyone,¿Me olvidé de alguien?,ai-je oublié quelqu'un,habe ich jemanden vergessen
314,did i have a choice,did i have a choice,¿tenía una opción?,avais-je le choix,hatte ich eine wahl
315,did i just say that,did i just say that,acabo de decir eso,viens-je de dire que,hab ich das gerade gesagt
316,did i lock the door,did i lock the door,cerré la puerta,ai-je verrouillé la porte,Habe ich die Tür abgeschlossen
317,did i make the team,did i make the team,hice el equipo,ai-je fait l'équipe,Habe ich das Team gemacht
318,did i mess up again,did i mess up again,¿Me equivoqué de nuevo?,ai-je encore foiré,habe ich mich wieder vertan
319,did i miss anything,did i miss anything,Yo me perdí algo,Est-ce que j'ai manqué quelque chose,Habe ich etwas vergessen
320,did i miss the turn,did i miss the turn,me perdí el turno,ai-je raté le virage,Habe ich die Abzweigung verpasst
321,did i pass the test,did i pass the test,¿Pasé la prueba?,ai-je réussi le test,habe ich die Prüfung bestanden
322,did i show you this,did i show you this,¿Te mostré esto?,est-ce que je t'ai montré ça,habe ich dir das gezeigt
323,did i tell you that,did i tell you that,¿te dije eso?,est-ce que je t'ai dit que,habe ich dir das gesagt
324,did i touch a nerve,did i touch a nerve,toqué un nervio,ai-je touché un nerf,habe ich einen Nerv getroffen
325,did i wake you guys,did i wake you guys,"¿Los desperté, chicos?",est-ce que je vous ai réveillé les gars,habe ich euch geweckt
326,did i win something,did i win something,gane algo,ai-je gagné quelque chose,habe ich was gewonnen
327,did tom like boston,did tom like boston,¿A Tom le gustó Boston?,Est-ce que Tom a aimé Boston,hat tom wie boston
328,did anybody see you,did anybody see you,alguien te vio,est-ce que quelqu'un t'a vu,hat dich jemand gesehen
329,did you ask tom why,did you ask tom why,¿Le preguntaste a Tom por qué?,as-tu demandé à tom pourquoi,hast du Tom gefragt warum
330,did you buy flowers,did you buy flowers,compraste flores,avez-vous acheté des fleurs,hast du blumen gekauft
331,did you do all this,did you do all this,hiciste todo esto,avez-vous fait tout cela,hast du das alles gemacht
332,did you drink a lot,did you drink a lot,bebiste mucho,avez-vous beaucoup bu,hast du viel getrunken
333,did you get my gift,did you get my gift,¿Recibiste mi regalo?,as-tu reçu mon cadeau,Hast du mein Geschenk bekommen?
334,did you give him up,did you give him up,lo entregaste?,tu l'as abandonné,hast du ihn aufgegeben
335,did you hear it too,did you hear it too,¿tú también lo escuchaste?,tu l'as entendu aussi,hast du es auch gehört
336,did you hug anybody,did you hug anybody,abrazaste a alguien,as-tu embrassé quelqu'un,hast du jemanden umarmt
337,did you leave a tip,did you leave a tip,¿Dejaste una propina?,avez-vous laissé un pourboire,hast du einen Tipp hinterlassen
338,did you like boston,did you like boston,¿Te gustó Boston?,as-tu aimé boston,Hast du Boston gemocht?
339,did you lose weight,did you lose weight,Perdiste peso,As-tu perdu du poids,hast du abgenommen
340,did you read it all,did you read it all,¿Lo leíste todo?,tu as tout lu,hast du alles gelesen
341,did you see anybody,did you see anybody,viste a alguien,avez-vous vu quelqu'un,hast du jemanden gesehen
342,did you take a bath,did you take a bath,Tomaste un baño,avez-vous pris un bain,hast du gebadet
343,disconnect the plug,disconnect the plug,desconecte el enchufe,débrancher la prise,Stecker abziehen
344,do i curse too much,do i curse too much,maldigo demasiado,Est-ce que je maudis trop,fluche ich zu sehr
345,do i detect sarcasm,do i detect sarcasm,¿Detecto sarcasmo?,est-ce que je détecte le sarcasme,erkenne ich Sarkasmus
346,do i have to go now,do i have to go now,¿tengo que irme ahora?,dois-je partir maintenant,muss ich jetzt gehen
347,do exactly as i say,do exactly as i say,haz exactamente lo que digo,fais exactement ce que je dis,mach genau das was ich sage
348,do we have a choice,do we have a choice,Tenemos alguna opción,Avons-nous le choix,Haben wir eine Wahl
349,do we need a plan b,do we need a plan b,necesitamos un plan b,avons-nous besoin d'un plan b,Brauchen wir einen Plan b
350,do you drink coffee,do you drink coffee,bebes café,Bois-tu du café,trinkst du Kaffee
351,do you enjoy losing,do you enjoy losing,disfrutas perder,aimez-vous perdre,macht es dir Spaß zu verlieren
352,"do you feel it, too",do you feel it  too,Lo sientes también,le sens-tu aussi,fühlst du es auch
353,do you go out a lot,do you go out a lot,sales mucho,sortez-vous beaucoup,Gehst du oft aus
354,do you go to church,do you go to church,Vas a la iglesia,Allez-vous à l'église,Gehen Sie in die Kirche
355,do you have a fever,do you have a fever,Tienes fiebre,As-tu de la fièvre,hast du Fieber
356,do you have a hobby,do you have a hobby,tienes un hobby,est ce que tu as un hobby,Hast du ein Hobby
357,do you have a house,do you have a house,Tienes una casa,As-tu une maison,hast du ein Haus
358,do you have a knife,do you have a knife,tienes un cuchillo,as-tu un couteau,hast du ein messer
359,do you have a match,do you have a match,¿tienes un partido?,avez-vous une correspondance,Hast du ein Streichholz?
360,do you have a phone,do you have a phone,tienes un telefono,avez-vous un téléphone,hast du ein Handy
361,do you have any cds,do you have any cds,tienes algun cd,avez-vous des CD,hast du cds
362,do you have my book,do you have my book,tienes mi libro,avez-vous mon livre,hast du mein buch
363,do you have the key,do you have the key,tienes la llave,avez-vous la clé,hast du den schlüssel
364,do you have to stay,do you have to stay,tienes que quedarte,dois-tu rester,musst du bleiben
365,do you know my name,do you know my name,Sabes mi nombre,Connais-tu mon nom,kennst du meinen Namen
366,do you know my wife,do you know my wife,conoces a mi esposa,connaissez-vous ma femme,kennst du meine frau
367,do you know the way,do you know the way,sabes el camino,connaissez vous le chemin,Weißt du den Weg
368,do you like english,do you like english,Te gusta el inglés,aimes-tu l'anglais,magst du Englisch
369,do you like bananas,do you like bananas,te gustan las bananas,aimez-vous les bananes,magst du Bananen
370,do you like bowling,do you like bowling,te gusta jugar a los bolos,aimes-tu le bowling,magst du bowlen
371,do you like cooking,do you like cooking,Te gusta cocinar,Est-ce que tu aimes cuisiner,magst du Kochen
372,do you like dancing,do you like dancing,Te gusta bailar,aimes-tu danser,Tanzt du gerne
373,do you like fishing,do you like fishing,Te gusta pescar,aimes-tu pêcher,magst du Angeln
374,do you like it then,do you like it then,te gusta entonces,tu aimes alors,gefällt es dir dann
375,"do you like me, too",do you like me  too,te gusto también,m'aime-tu aussi,magst du mich auch
376,do you like oysters,do you like oysters,te gustan las ostras,aimes-tu les huîtres,Magst du Austern?
377,do you like singing,do you like singing,Te gusta cantar,Tu aimes chanter,magst du singen
378,do you like to sing,do you like to sing,te gusta cantar,Aimez-vous chanter,magst du es zu singen
379,do you like waffles,do you like waffles,te gustan los waffles,Aimes-tu les gauffres,magst du Waffeln
380,do you like writing,do you like writing,te gusta escribir,aimez-vous écrire,schreibst du gerne
381,do you love him too,do you love him too,¿tú también lo amas?,est-ce que tu l'aimes aussi,liebst du ihn auch
382,do you mind if i go,do you mind if i go,¿te importa si me voy?,ça te dérange si je pars,"stört es dich, wenn ich gehe"
383,do you need a spoon,do you need a spoon,¿Necesitas una cuchara?,avez-vous besoin d'une cuillère,brauchst du einen löffel
384,do you need the key,do you need the key,¿Necesitas la llave?,avez-vous besoin de la clé,brauchst du den schlüssel
385,do you own research,do you own research,¿Eres dueño de la investigación?,faites-vous de la recherche,Recherchieren Sie selbst
386,do you realize that,do you realize that,te das cuenta de eso,est-ce que tu te rends compte que,verstehst du das
387,do you see anything,do you see anything,Ves algo,vois-tu quelque chose,Siehst du etwas
388,do you sell jewelry,do you sell jewelry,vendes joyas?,vendez-vous des bijoux,Verkaufen Sie Schmuck?
389,do you share a room,do you share a room,¿Compartes una habitación?,partagez-vous une chambre,teilt ihr euch ein zimmer
390,do you smoke cigars,do you smoke cigars,¿Fumas puros?,fumes-tu des cigares,rauchst du zigarren
391,do you speak french,do you speak french,Habla usted francés,Est-ce que tu parles français,Sprechen Sie Französisch
392,do you study french,do you study french,¿Estudias francés?,étudiez-vous le français,studierst du Französisch
393,do you take plastic,do you take plastic,¿tomas plástico?,prends-tu du plastique,nimmst du plastik
394,do you travel a lot,do you travel a lot,viajas mucho,voyages-tu beaucoup,reist du viel
395,do you travel often,do you travel often,Viaja a menudo,voyagez-vous souvent,reist du oft
396,do you trust anyone,do you trust anyone,¿Confías en alguien?,fais-tu confiance à quelqu'un,vertraust du jemandem
397,do you want a salad,do you want a salad,quieres una ensalada,veux-tu une salade,willst du einen salat
398,do you want dessert,do you want dessert,quieres postre,Voulez vous un dessert,willst du Nachtisch
399,do you want popcorn,do you want popcorn,¿quieres palomitas de maíz?,veux-tu du pop-corn,willst du popcorn
400,do you want to know,do you want to know,Quieres saber,voulez-vous savoir,willst du wissen
401,do you want to pray,do you want to pray,quieres rezar,veux-tu prier,willst du beten
402,do you want to stay,do you want to stay,quieres quedarte,veux-tu rester,willst du bleiben
403,do you want to stop,do you want to stop,quieres parar,veux-tu arrêter,willst du aufhören
404,do you want to talk,do you want to talk,Quieres hablar,voulez-vous parler,Möchtest du reden
405,do you wear glasses,do you wear glasses,Usas lentes,portez-vous des lunettes,Trägst du eine Brille
406,does tom have a job,does tom have a job,Tom tiene trabajo,est-ce que tom a un travail,Hat Tom einen Job?
407,does it even matter,does it even matter,importa,est-ce même important,spielt es überhaupt eine Rolle
408,does she play piano,does she play piano,ella toca el piano,joue-t-elle du piano,spielt sie klavier
409,does that amuse you,does that amuse you,eso te divierte,ça t'amuse,amüsiert dich das
410,does that scare you,does that scare you,eso te asusta,ça te fait peur,macht dir das Angst
411,does that seem wise,does that seem wise,¿Eso parece sabio?,cela semble-t-il sage,scheint das weise
412,does your head hurt,does your head hurt,te duele la cabeza,Est-ce que votre tête vous fait mal,tut dein Kopf weh
413,does your wife know,does your wife know,tu esposa sabe,est-ce que ta femme sait,weiß deine frau
414,doesn't anyone care,does not anyone care,a nadie le importa,personne ne s'en soucie,kümmert es niemanden
415,don't act like that,do not act like that,no actúes así,n'agis pas comme ça,TU nicht so
416,don't act surprised,do not act surprised,no actúes sorprendido,ne sois pas surpris,tun Sie nicht überrascht
417,don't ask for money,do not ask for money,no pidas dinero,ne demande pas d'argent,verlange kein Geld
418,don't be a stranger,do not be a stranger,No seas un extraño,ne soyez pas un étranger,Sei kein Fremder
419,don't be disgusting,do not be disgusting,no seas repugnante,ne soyez pas dégoûtant,sei nicht ekelhaft
420,don't be ridiculous,do not be ridiculous,no seas ridículo,Ne soyez pas ridicule,Mach dich nicht lächerlich
421,don't burn yourself,do not burn yourself,no te quemes,ne te brûle pas,verbrenn dich nicht
422,don't climb on this,do not climb on this,no te subas a esto,ne monte pas dessus,nicht darauf klettern
423,don't count on them,do not count on them,No cuentes con ellos,Ne compte pas sur eux,zähle nicht auf sie
424,don't cut that wire,do not cut that wire,no cortes ese cable,ne coupe pas ce fil,schneiden Sie diesen Draht nicht
425,don't do that to me,do not do that to me,No me hagas eso,ne me fais pas ça,TU mir das nicht an
426,don't drop that cup,do not drop that cup,no dejes caer esa copa,ne laisse pas tomber cette tasse,Lass die Tasse nicht fallen
427,don't drop the soap,do not drop the soap,no tires el jabon,ne fait pas tomber le savon,lass die Seife nicht fallen
428,don't get any ideas,do not get any ideas,no te hagas ninguna idea,ne te fais pas d'idées,komme nicht auf ideen
429,don't get too cocky,do not get too cocky,no te pongas demasiado arrogante,ne sois pas trop arrogant,werde nicht zu übermütig
430,don't go in my room,do not go in my room,no entres en mi cuarto,n'entre pas dans ma chambre,geh nicht in mein Zimmer
431,don't leave it open,do not leave it open,no lo dejes abierto,ne le laisse pas ouvert,lass es nicht offen
432,don't leave me here,do not leave me here,no me dejes aqui,ne me laisse pas ici,Verlass mich hier nicht
433,don't listen to tom,do not listen to tom,no escuches a tom,n'écoute pas tom,Hör nicht auf Tom
434,don't listen to her,do not listen to her,no la escuches,ne l'écoute pas,Hör nicht auf sie
435,don't make it worse,do not make it worse,no lo empeores,n'empire pas les choses,mach es nicht schlimmer
436,don't make me angry,do not make me angry,no me hagas enojar,ne m'énerve pas,mach mich nicht wütend
437,don't make me blush,do not make me blush,no me hagas sonrojar,Ne me fais pas rougir,Mach mich nicht verlegen
438,don't make me do it,do not make me do it,no me hagas hacerlo,ne m'oblige pas à le faire,zwing mich nicht dazu
439,don't make me laugh,do not make me laugh,no me hagas reír,ne me fais pas rire,Bring mich nicht zum Lachen
440,don't make me leave,do not make me leave,no me hagas salir,ne me fais pas partir,lass mich nicht gehen
441,don't obey that man,do not obey that man,no obedezcas a ese hombre,n'obéis pas à cet homme,gehorche diesem Mann nicht
442,don't open the door,do not open the door,No abras la puerta,N'ouvres pas la porte,Öffne nicht die Tür
443,don't open this box,do not open this box,no abras esta caja,ne pas ouvrir cette boite,Öffnen Sie diese Box nicht
444,don't phone her now,do not phone her now,no la llames ahora,ne lui téléphone pas maintenant,Ruf sie jetzt nicht an
445,don't read my diary,do not read my diary,no leas mi diario,ne lis pas mon journal,Lies nicht mein Tagebuch
446,don't rock the boat,do not rock the boat,No muevas el bote,ne secoue pas le bateau,das Boot nicht schaukeln
447,don't say that word,do not say that word,no digas esa palabra,ne dis pas ce mot,sag dieses Wort nicht
448,don't scribble here,do not scribble here,no escribas aqui,ne griffonne pas ici,hier nicht kritzeln
449,don't slam the door,do not slam the door,no azotes la puerta,ne claque pas la porte,schlagen Sie die Tür nicht zu
450,don't speak so fast,do not speak so fast,no hables tan rapido,ne parle pas si vite,sprich nicht so schnell
451,don't stand near me,do not stand near me,no te quedes cerca de mi,ne reste pas près de moi,steh nicht neben mir
452,don't take the bait,do not take the bait,no muerdas el anzuelo,ne pas prendre l'appât,nimm den Köder nicht
453,don't talk about me,do not talk about me,no hables de mí,ne parlez pas de moi,Rede nicht über mich
454,don't talk nonsense,do not talk nonsense,no hables tonterías,ne dis pas de bêtises,rede keinen Unsinn
455,don't tell your dad,do not tell your dad,no le digas a tu papa,ne dis rien à ton père,Sag es deinem Vater nicht
456,don't trust anybody,do not trust anybody,no confíes en nadie,ne fais confiance à personne,Vertraue niemandem
457,don't use that word,do not use that word,no uses esa palabra,n'utilise pas ce mot,Verwenden Sie dieses Wort nicht
458,don't wait too long,do not wait too long,no esperes demasiado,n'attendez pas trop longtemps,warte nicht zu lange
459,don't work too hard,do not work too hard,no trabajes demasiado duro,ne travaille pas trop,arbeite nicht zu hart
460,don't you all agree,do not you all agree,no estais todos de acuerdo,n'êtes-vous pas tous d'accord,stimmen Sie nicht alle überein
461,don't you feel cold,do not you feel cold,no sientes frio,tu n'as pas froid,fühlst du dich nicht kalt
462,don't you like fish,do not you like fish,no te gusta el pescado,tu n'aimes pas le poisson,Magst du keinen Fisch?
463,don't you like that,do not you like that,no te gusta eso,tu n'aimes pas ça,magst du das nicht
