,English,English_cleaned,Spanish,French,German
720,i really miss you,i really miss you,Realmente te extraño,tu me manques vraiment,"ich vermisse dich, wirklich"
721,i really need you,i really need you,Realmente te necesito,j'ai vraiment besoin de toi,Ich brauche dich wirklich
722,i remember it now,i remember it now,lo recuerdo ahora,je m'en souviens maintenant,ich erinnere mich jetzt
723,i rescued the cat,i rescued the cat,rescaté al gato,j'ai sauvé le chat,Ich habe die Katze gerettet
724,i reserved a seat,i reserved a seat,reservé un asiento,j'ai réservé une place,Ich habe einen Platz reserviert
725,i retired in 2013,i retired in 2013,me jubilé en 2013,j'ai pris ma retraite en 2013,2013 bin ich in Rente gegangen
726,i ripped my pants,i ripped my pants,me rompí los pantalones,j'ai déchiré mon pantalon,Ich habe meine Hose zerrissen
727,i said i liked it,i said i liked it,dije que me gustaba,j'ai dit que j'aimais ça,"Ich sagte, ich mochte es"
728,i said i was busy,i said i was busy,dije que estaba ocupado,j'ai dit que j'étais occupé,"Ich sagte, ich sei beschäftigt"
729,i said come alone,i said come alone,Dije que vengas solo,j'ai dit viens seul,"Ich sagte, komm allein"
730,i said it in jest,i said it in jest,lo dije en broma,je l'ai dit en plaisantant,Ich sagte es im Scherz
731,i sat by his side,i sat by his side,me senté a su lado,je me suis assis à ses côtés,Ich saß an seiner Seite
732,i sat next to tom,i sat next to tom,me senté al lado de tom,je me suis assis à côté de tom,Ich saß neben Tom
733,i sat on the sofa,i sat on the sofa,me senté en el sofá,je me suis assis sur le canapé,Ich saß auf dem Sofa
734,i saved your life,i saved your life,salvé tu vida,je t'ai sauvé la vie,ich habe dein Leben gerettet
735,i saw tom earlier,i saw tom earlier,vi a tom antes,j'ai vu tom plus tôt,Ich habe Tom vorhin gesehen
736,i saw tom tonight,i saw tom tonight,vi a tom esta noche,j'ai vu tom ce soir,Ich habe Tom heute Abend gesehen
737,i saw an airplane,i saw an airplane,vi un avión,j'ai vu un avion,Ich habe ein Flugzeug gesehen
738,i saw him running,i saw him running,lo vi correr,je l'ai vu courir,Ich sah ihn rennen
739,i saw the message,i saw the message,vi el mensaje,j'ai vu le message,Ich habe die Nachricht gesehen
740,i saw the sunrise,i saw the sunrise,vi el amanecer,j'ai vu le lever du soleil,Ich sah den Sonnenaufgang
741,i saw you cooking,i saw you cooking,te vi cocinando,je t'ai vu cuisiner,Ich habe dich beim Kochen gesehen
742,i saw you looking,i saw you looking,te vi mirando,je t'ai vu regarder,Ich sah dich suchen
743,i saw you outside,i saw you outside,te vi afuera,je t'ai vu dehors,Ich habe dich draußen gesehen
744,i saw your father,i saw your father,vi a tu padre,j'ai vu ton père,Ich habe deinen Vater gesehen
745,i see the problem,i see the problem,veo el problema,je vois le problème,Ich sehe das Problem
746,i seem to be lost,i seem to be lost,parece que estoy perdido,j'ai l'impression d'être perdu,ich scheine verloren zu sein
747,i should be happy,i should be happy,debería ser feliz,je devrais être heureux,Ich sollte glücklich sein
748,i should be there,i should be there,debería estar allí,je devrais être là,Ich sollte dort sein
749,i should go there,i should go there,debería ir allí,je devrais y aller,Ich sollte dorthin gehen
750,i should head out,i should head out,debería salir,je devrais partir,Ich sollte los
751,i should've asked,i should have asked,debería haber preguntado,j'aurais dû demander,Ich hätte fragen sollen
752,i should've known,i should have known,Yo debería haber sabido,J'aurais dû savoir,Ich hätte wissen sollen
753,i shouldn't drink,i should not drink,no debo beber,je ne devrais pas boire,ich sollte nicht trinken
754,i shouldn't worry,i should not worry,no debo preocuparme,je ne devrais pas m'inquiéter,Ich sollte mir keine Sorgen machen
755,i shut the drawer,i shut the drawer,cierro el cajón,je ferme le tiroir,Ich schließe die Schublade
756,i shut the window,i shut the window,cierro la ventana,je ferme la fenêtre,Ich schließe das Fenster
757,i signed the form,i signed the form,firmé el formulario,j'ai signé le formulaire,Ich habe das Formular unterschrieben
758,i slept very well,i slept very well,Dormí muy bien,J'ai très bien dormi,Ich habe sehr gut geschlafen
759,i sometimes skate,i sometimes skate,a veces patino,je patine parfois,ich skate manchmal
760,i started the car,i started the car,encendí el auto,j'ai démarré la voiture,Ich habe das Auto gestartet
761,i still have mine,i still have mine,todavía tengo el mío,j'ai encore le mien,ich habe meine noch
762,i stopped smoking,i stopped smoking,dejé de fumar,j'ai arrêté de fumer,ich habe aufgehört zu rauchen
763,i stopped the car,i stopped the car,detuve el auto,j'ai arrêté la voiture,Ich habe das Auto angehalten
764,i study at school,i study at school,yo estudio en la escuela,j'étudie à l'école,Ich lerne in der Schule
765,i sure do hope so,i sure do hope so,seguro que eso espero,je l'espère bien,ich hoffe es sehr
766,i swallowed a bug,i swallowed a bug,me tragué un insecto,j'ai avalé un insecte,Ich habe einen Fehler geschluckt
767,i swept the floor,i swept the floor,yo barro el piso,j'ai balayé le sol,Ich habe den Boden gefegt
768,i teach geography,i teach geography,enseño geografía,j'enseigne la géographie,Ich unterrichte Erdkunde
769,i think i'm drunk,i think i am drunk,creo que estoy borracho,je pense que je suis ivre,"Ich glaube, ich bin betrunken"
770,i think i'm ready,i think i am ready,creo que estoy listo,je pense que je suis prêt,"Ich denke, ich bin bereit"
771,i think i'm right,i think i am right,creo que tengo razón,je pense que j'ai raison,ich denke ich habe recht
772,i think he did it,i think he did it,creo que lo hizo,je pense qu'il l'a fait,"Ich denke, er hat es getan"
773,i think it's fine,i think it is fine,creo que está bien,Je pense que c'est bien,"Ich denke, es ist in Ordnung"
774,i think it's good,i think it is good,yo creo que es bueno,Je pense que c'est bon,"Ich denke, es ist gut"
775,i think it's over,i think it is over,creo que se acabó,je pense que c'est fini,ich denke es ist vorbei
776,i think it's true,i think it is true,yo pienso que es verdad,je pense que c'est vrai,"Ich denke, es ist wahr"
777,i think otherwise,i think otherwise,pienso lo contrario,je pense autrement,ich denke anders
778,i think we did ok,i think we did ok,creo que lo hicimos bien,je pense que nous avons bien fait,"Ich denke, wir haben es gut gemacht"
779,i took highway 58,i took highway 58,tomé la carretera 58,j'ai pris l'autoroute 58,Ich nahm den Highway 58
780,i took a shortcut,i took a shortcut,tomé un atajo,j'ai pris un raccourci,Ich habe eine Abkürzung genommen
781,i took a week off,i took a week off,me tomé una semana libre,j'ai pris une semaine de repos,ich habe mir eine woche frei genommen
782,i took care of it,i took care of it,me encargué de eso,J'en ai pris soin,ich habe mich darum gekümmert
783,i tried to escape,i tried to escape,traté de escapar,j'ai essayé de m'échapper,Ich habe versucht zu fliehen
784,i truly apologize,i truly apologize,realmente me disculpo,je m'excuse vraiment,Ich entschuldige mich aufrichtig
785,i truly loved her,i truly loved her,realmente la amaba,je l'aimais vraiment,Ich habe sie wirklich geliebt
786,i turned the page,i turned the page,pasé la página,j'ai tourné la page,Ich habe die Seite umgeblättert
787,i understand this,i understand this,entiendo esto,je comprends ça,ich verstehe das
788,i understood that,i understood that,lo entendí,J'ai compris ça,Ich habe das verstanden
789,i used this plate,i used this plate,usé este plato,j'ai utilisé cette plaque,Ich habe diese Platte verwendet
790,i usually do vote,i usually do vote,normalmente voto,je vote d'habitude,Ich wähle normalerweise
791,i usually eat out,i usually eat out,normalmente como fuera,je mange habituellement à l'extérieur,Ich esse normalerweise auswärts
792,i want a lot more,i want a lot more,quiero mucho más,je veux beaucoup plus,ich will noch viel mehr
793,i want a new oven,i want a new oven,quiero un horno nuevo,je veux un nouveau four,Ich möchte einen neuen Ofen
794,i want a notebook,i want a notebook,quiero un cuaderno,je veux un cahier,Ich möchte ein Notizbuch
795,i want an apology,i want an apology,quiero una disculpa,je veux des excuses,Ich möchte eine Entschuldigung
796,i want everything,i want everything,quiero todo,je veux tout,ich will alles
797,i want more money,i want more money,Quiero mas dinero,je veux plus d'argent,Ich will mehr Geld
798,i want my freedom,i want my freedom,quiero mi libertad,je veux ma liberté,Ich will meine Freiheit
799,i want some paper,i want some paper,quiero un poco de papel,je veux du papier,Ich möchte etwas Papier
800,i want some water,i want some water,Quiero un poco de agua,Je veux de l'eau,Ich möchte etwas Wasser
801,i want ten plates,i want ten plates,quiero diez platos,je veux dix assiettes,Ich möchte zehn Teller
802,i want them alive,i want them alive,los quiero vivos,je les veux vivants,Ich will sie am Leben
803,i want to be safe,i want to be safe,quiero estar seguro,je veux être en sécurité,Ich möchte sicher sein
804,i want to confess,i want to confess,quiero confesarte,je veux avouer,Ich möchte gestehen
805,i want to do this,i want to do this,quiero hacer esto,Je veux faire ça,ich möchte das machen
806,i want to do well,i want to do well,quiero hacerlo bien,je veux bien faire,ich will es gut machen
807,i want to see him,i want to see him,quiero verlo,Je veux le voir,ich möchte ihn sehen
808,i want to see you,i want to see you,Quiero verte,je veux te voir,Ich möchte dich sehen
809,i want to workout,i want to workout,quiero hacer ejercicio,je veux m'entraîner,Ich möchte trainieren
810,i want you to die,i want you to die,Quiero que te mueras,Je veux que tu meurs,Ich will dass du stirbst
811,i want you to win,i want you to win,quiero que ganes,je veux que tu gagnes,"Ich möchte, dass du gewinnst"
812,i wanted sympathy,i wanted sympathy,quería simpatía,je voulais de la sympathie,Ich wollte Sympathie
813,i wanted the best,i wanted the best,quería lo mejor,je voulais le meilleur,Ich wollte das Beste
814,i wanted to do it,i wanted to do it,Yo quería hacerlo,je voulais le faire,Ich wollte es tun
815,i wanted to fight,i wanted to fight,quería pelear,je voulais me battre,ich wollte kämpfen
816,i wanted to laugh,i wanted to laugh,quería reír,je voulais rire,ich wollte lachen
817,i warned you once,i warned you once,te lo advertí una vez,je t'ai prévenu une fois,Ich habe dich einmal gewarnt
818,i was a bit tense,i was a bit tense,estaba un poco tenso,j'étais un peu tendu,ich war etwas angespannt
819,i was a passenger,i was a passenger,yo era un pasajero,j'étais un passager,Ich war ein Passagier
820,i was a shy child,i was a shy child,yo era un niño tímido,j'étais un enfant timide,Ich war ein schüchternes Kind
821,i was celebrating,i was celebrating,yo estaba celebrando,je fêtais,ich habe gefeiert
822,i was daydreaming,i was daydreaming,estaba soñando despierto,je rêvais,Ich war am Tagträumen
823,i was defenseless,i was defenseless,estaba indefenso,j'étais sans défense,ich war wehrlos
824,i was discouraged,i was discouraged,estaba desanimado,j'étais découragé,Ich war entmutigt
825,i was discredited,i was discredited,estaba desacreditado,j'ai été discrédité,Ich wurde diskreditiert
826,i was dumbfounded,i was dumbfounded,estaba estupefacto,j'étais abasourdi,Ich war sprachlos
827,i was embarrassed,i was embarrassed,Estaba avergonzado,J'étais embarrassé,Es war mir peinlich
828,i was going to go,i was going to go,Yo iba a ir,j'allais aller,ich wollte gerade gehen
829,i was happy there,i was happy there,yo era feliz alli,j'étais heureux là-bas,Ich war dort glücklich
830,i was heartbroken,i was heartbroken,Estaba destrozado,J'avais le cœur brisé,Mein Herz wurde gebrochen
831,i was in no hurry,i was in no hurry,no tenía prisa,je n'étais pas pressé,ich hatte es nicht eilig
832,i was in the room,i was in the room,yo estaba en la habitación,j'étais dans la chambre,Ich war im Zimmer
833,i was just joking,i was just joking,sólo bromeaba,je plaisantais,ich hab nur Spass gemacht
834,i was just mugged,i was just mugged,me acaban de asaltar,je viens d'être agressé,Ich wurde gerade überfallen
835,i was left behind,i was left behind,me quedé atrás,j'ai été laissé pour compte,Ich wurde zurückgelassen
836,i was lucky today,i was lucky today,tuve suerte hoy,j'ai eu de la chance aujourd'hui,Ich hatte heute Glück
837,i was misinformed,i was misinformed,estaba mal informado,j'ai été mal renseigné,ich wurde falsch informiert
838,i was not pleased,i was not pleased,no estaba contento,je n'étais pas content,Ich war nicht erfreut
839,i was on my knees,i was on my knees,yo estaba de rodillas,j'étais à genoux,Ich war auf meinen Knien
840,i was on vacation,i was on vacation,estaba de vacaciones,j'étais en vacances,ich war in Urlaub
841,i was only joking,i was only joking,Sólo estaba bromeando,J'étais juste en train de blaguer,Ich habe nur Spaß gemacht
842,i was out all day,i was out all day,estuve fuera todo el dia,j'étais dehors toute la journée,Ich war den ganzen Tag unterwegs
843,i was outnumbered,i was outnumbered,me superaban en número,j'étais en infériorité numérique,Ich war in der Unterzahl
844,i was overwhelmed,i was overwhelmed,yo estaba abrumado,J'étais dépassé,ich war überwältigt
845,i was quite lucky,i was quite lucky,tuve bastante suerte,j'ai eu beaucoup de chance,Ich hatte ziemliches Glück
846,i was ready today,i was ready today,estaba listo hoy,j'étais prêt aujourd'hui,Ich war heute fertig
847,i was sympathetic,i was sympathetic,yo era comprensivo,j'étais sympathique,Ich war mitfühlend
848,i was tired today,i was tired today,estaba cansado hoy,j'étais fatigué aujourd'hui,ich war heute müde
849,i was trespassing,i was trespassing,yo estaba traspasando,j'étais en infraction,Ich war Hausfriedensbruch
850,i was unconscious,i was unconscious,yo estaba inconsciente,j'étais inconscient,ich war bewusstlos
851,i was very hungry,i was very hungry,tenía mucha hambre,J'avais très faim,Ich war sehr hungrig
852,i wasn't finished,i was not finished,no estaba terminado,je n'avais pas fini,ich war noch nicht fertig
853,i wasn't flirting,i was not flirting,no estaba coqueteando,je ne flirtais pas,Ich habe nicht geflirtet
854,i wasn't informed,i was not informed,no me informaron,je n'ai pas été informé,ich wurde nicht informiert
855,i wasn't involved,i was not involved,yo no estaba involucrado,je n'étais pas impliqué,ich war nicht beteiligt
856,i wasn't punished,i was not punished,no fui castigado,je n'ai pas été puni,ich wurde nicht bestraft
857,i wasn't sleeping,i was not sleeping,no estaba durmiendo,je ne dormais pas,Ich habe nicht geschlafen
858,i watched a movie,i watched a movie,ví una película,j'ai regardé un film,ich habe einen Film angesehen
859,i went home alone,i went home alone,me fui a casa solo,je suis rentré seul à la maison,Ich bin alleine nach Hause gegangen
860,i went on reading,i went on reading,seguí leyendo,j'ai continué à lire,Ich las weiter
861,i went to harvard,i went to harvard,fui a harvard,je suis allé à harvard,Ich ging nach Harvard
862,i went to the gym,i went to the gym,fui al gimnasio,je suis allé à la gym,Ich ging ins Fitnessstudio
863,i went to the zoo,i went to the zoo,Fui al zoológico,je suis allé au zoo,Ich bin in den Zoo gegangen
864,i will choose one,i will choose one,elegiré uno,je vais en choisir un,Ich werde einen auswählen
865,i will do my best,i will do my best,Haré mi mejor esfuerzo,je ferai de mon mieux,Ich werde mein Bestes geben
866,i will go on foot,i will go on foot,iré a pie,j'irai à pied,Ich werde zu Fuß gehen
867,i will stay there,i will stay there,me quedaré allí,je vais y rester,Ich werde dort bleiben
868,i wish i was dead,i wish i was dead,Desearía estar muerto,Je souhaiterais être mort,ich wünschte ich wäre tot
869,i woke up at 6:30,i woke up at 6 30,me desperté a las 6 30,je me suis réveillé à 6h30,Ich bin um 6 30 aufgewacht
870,i won first prize,i won first prize,gané el primer premio,j'ai gagné le premier prix,Ich habe den ersten Preis gewonnen
871,i won't back down,i will not back down,No voy a dar marcha atrás,je ne vais pas me dérober,ich werde nicht nachgeben
872,i won't deny that,i will not deny that,no voy a negar eso,je ne le nierai pas,ich werde das nicht leugnen
873,i won't fight you,i will not fight you,no pelearé contigo,je ne te combattrai pas,Ich werde nicht gegen dich kämpfen
874,i won't need luck,i will not need luck,no necesitare suerte,je n'aurai pas besoin de chance,Ich werde kein Glück brauchen
875,i won't negotiate,i will not negotiate,no voy a negociar,je ne négocierai pas,Ich werde nicht verhandeln
876,i won't sign this,i will not sign this,no voy a firmar esto,je ne signerai pas ça,Ich werde das nicht unterschreiben
877,i worked with tom,i worked with tom,trabajé con tom,j'ai travaillé avec tom,Ich habe mit Tom gearbeitet
878,i worry about him,i worry about him,me preocupo por el,je m'inquiète pour lui,ich mache mir sorgen um ihn
879,i would've waited,i would have waited,hubiera esperado,j'aurais attendu,ich hätte gewartet
880,i wrote that book,i wrote that book,yo escribi ese libro,j'ai écrit ce livre,Ich habe dieses Buch geschrieben
881,i wrote this book,i wrote this book,Escribí este libro,j'ai écrit ce livre,Ich habe dieses Buch geschrieben
882,i yelled for help,i yelled for help,grité pidiendo ayuda,j'ai crié à l'aide,Ich schrie um Hilfe
883,i'd appreciate it,i would appreciate it,lo apreciaría,je l'apprécierais,ich würde es schätzen
884,"i'd be angry, too",i would be angry  too,yo también estaría enojado,je serais en colère aussi,ich wäre auch sauer
885,i'd be devastated,i would be devastated,estaría devastado,je serais dévasté,ich wäre am Boden zerstört
886,i'd better go now,i would better go now,mejor me voy ahora,je ferais mieux d'y aller maintenant,Ich würde jetzt besser gehen
887,i'd like a coffee,i would like a coffee,Me gustaría un café,je voudrais un café,ich hätte gerne einen Kaffee
888,i'd like to dance,i would like to dance,Me gustaría bailar,je voudrais danser,Ich möchte tanzen
889,i'd like to stand,i would like to stand,me gustaría estar de pie,je voudrais me tenir debout,ich möchte stehen
890,i'd love to do it,i would love to do it,Me encantaría hacerlo,J'aimerais le faire,Ich würde es gerne tun
891,i'll arrange that,i will arrange that,arreglaré eso,je vais arranger ça,ich werde das arrangieren
892,i'll be back soon,i will be back soon,volveré pronto,je serai bientôt de retour,ich werde bald wiederkommen
893,i'll be in my car,i will be in my car,estaré en mi coche,je serai dans ma voiture,Ich werde in meinem Auto sein
894,i'll eat anything,i will eat anything,comeré cualquier cosa,je mangerai n'importe quoi,Ich werde alles essen
895,i'll feed the dog,i will feed the dog,daré de comer al perro,je vais nourrir le chien,Ich werde den Hund füttern
896,i'll get off here,i will get off here,me bajare aqui,je descendrai ici,ich steige hier aus
897,i'll give it back,i will give it back,lo devolveré,je vais le rendre,Ich werde es zurückgeben
898,i'll have another,i will have another,tendré otro,j'en aurai un autre,Ich werde eine andere haben
899,i'll keep it warm,i will keep it warm,lo mantendré caliente,je vais le garder au chaud,Ich werde es warm halten
900,i'll let you know,i will let you know,Te lo haré saber,je vous ferai savoir,Ich werde Ihnen Bescheid geben
901,i'll miss you all,i will miss you all,los extrañaré a todos,vous me manquerez tous,ich werde euch alle vermissen
902,i'll never change,i will never change,nunca cambiare,je ne changerais jamais,Ich werde mich nie ändern
903,i'll never forget,i will never forget,Nunca olvidaré,je n'oublierai jamais,Ich werde nie vergessen
904,i'll pay anything,i will pay anything,pagaré cualquier cosa,je paierai n'importe quoi,Ich werde alles bezahlen
905,i'll pay the bill,i will pay the bill,Yo pagaré la cuenta,Je paierai l'addition,Ich werde die Rechnung bezahlen
906,i'll pray for you,i will pray for you,rezaré por tí,je prierai pour toi,ich werde für dich beten
907,i'll recommend it,i will recommend it,lo recomendaré,je le recommanderai,Ich werde es empfehlen
908,i'll ride shotgun,i will ride shotgun,voy a montar escopeta,je monterai un fusil de chasse,Ich werde Schrotflinte reiten
909,i'll send flowers,i will send flowers,enviaré flores,j'enverrai des fleurs,Ich werde Blumen schicken
910,i'll set you free,i will set you free,Te dejare libre,je vais te libérer,Ich werde dich befreien
911,i'll sit with tom,i will sit with tom,me sentare con tom,je vais m'asseoir avec tom,Ich werde bei Tom sitzen
912,i'll step outside,i will step outside,voy a salir,je vais sortir,Ich werde nach draußen gehen
913,i'll stick around,i will stick around,me quedaré,je vais rester,Ich bleibe dabei
914,i'll take the bus,i will take the bus,tomaré el autobús,je prendrai le bus,Ich werde den Bus nehmen
915,i'll tell my wife,i will tell my wife,le diré a mi esposa,je dirai à ma femme,Ich werde es meiner Frau sagen
916,i'll tell someone,i will tell someone,le diré a alguien,je dirai à quelqu'un,Ich werde es jemandem sagen
917,i'll tell you why,i will tell you why,Te diré por qué,Je vais vous dire pourquoi,Ich werde dir sagen warum
918,i'll vote for tom,i will vote for tom,voy a votar por tom,je voterai pour tom,Ich werde für Tom stimmen
919,i'll vote for you,i will vote for you,voy a votar por ti,je voterai pour toi,Ich werde für dich stimmen
920,i'll wait for you,i will wait for you,Te esperaré,je vais vous attendre,ich werde auf dich warten
921,i'll wait outside,i will wait outside,esperaré afuera,je vais attendre dehors,Ich werde draußen warten
922,"i'm canadian, too",i am canadian  too,yo tambien soy canadiense,je suis canadien aussi,Ich bin auch Kanadier
923,i'm a big boy now,i am a big boy now,ahora soy un chico grande,je suis un grand garçon maintenant,Ich bin jetzt ein großer Junge
924,i'm a busy person,i am a busy person,soy una persona ocupada,je suis une personne occupée,Ich bin eine vielbeschäftigte Person
925,i'm a careful man,i am a careful man,soy un hombre cuidadoso,je suis un homme prudent,Ich bin ein vorsichtiger Mann
926,i'm a changed man,i am a changed man,soy un hombre cambiado,je suis un homme changé,Ich bin ein veränderter Mann
927,i'm a dog trainer,i am a dog trainer,soy un entrenador de perros,je suis éducateur canin,Ich bin Hundetrainer
928,i'm a good person,i am a good person,Soy una buena persona,je suis une bonne personne,ich bin ein guter Mensch
929,i'm a hard worker,i am a hard worker,Soy muy trabajador,je suis un travailleur acharné,Ich bin ein harter Arbeiter
930,i'm a law student,i am a law student,soy estudiante de derecho,je suis étudiant en droit,Ich bin Jurastudent
931,i'm a little busy,i am a little busy,estoy un poco ocupado,je suis un peu occupé,Ich bin ein bisschen beschäftigt
932,i'm a little hurt,i am a little hurt,estoy un poco herido,je suis un peu blessé,Ich bin ein bisschen verletzt
933,i'm a little sick,i am a little sick,estoy un poco enfermo,je suis un peu malade,Ich bin ein bisschen krank
934,i'm a new student,i am a new student,soy un nuevo estudiante,je suis un nouveau Etudiant,Ich bin ein neuer Schüler
935,i'm a normal girl,i am a normal girl,soy una chica normal,je suis une fille normale,Ich bin ein normales Mädchen
936,i'm a salesperson,i am a salesperson,Soy un vendedor,Je suis un vendeur,Ich bin ein Verkäufer
937,i'm a total wreck,i am a total wreck,soy un desastre total,je suis une épave totale,Ich bin ein totales Wrack
938,i'm able to speak,i am able to speak,soy capaz de hablar,je suis capable de parler,ich kann sprechen
939,i'm afraid to die,i am afraid to die,tengo miedo de morir,j'ai peur de mourir,Ich habe Angst zu sterben
940,i'm all by myself,i am all by myself,estoy solo,je suis tout seul,ich bin ganz bei mir
941,i'm already bored,i am already bored,ya estoy aburrido,je m'ennuie déjà,mir ist schon langweilig
942,i'm already ready,i am already ready,ya estoy listo,je suis déjà prêt,ich bin schon bereit
943,i'm always hungry,i am always hungry,siempre estoy hambriento,j'ai toujours faim,ich bin immer hungrig
944,i'm an accountant,i am an accountant,Yo soy un contador,Je suis comptable,Ich bin ein Buchhalter
945,i'm as old as you,i am as old as you,soy tan viejo como tu,je suis aussi vieux que toi,Ich bin so alt wie du
946,i'm at school now,i am at school now,estoy en la escuela ahora,Je suis à l'école en ce moment,ich bin jetzt in der Schule
947,i'm at the prison,i am at the prison,estoy en la prision,je suis à la prison,Ich bin im Gefängnis
948,i'm at your mercy,i am at your mercy,estoy a tu merced,je suis à ta merci,Ich bin dir ausgeliefert
949,i'm available now,i am available now,estoy disponible ahora,je suis disponible maintenant,Ich bin jetzt verfügbar
950,i'm aware of that,i am aware of that,Soy consciente de eso,Je suis au courant de ça,das ist mir bewusst
951,i'm awfully tired,i am awfully tired,estoy terriblemente cansado,je suis terriblement fatigué,Ich bin schrecklich müde
952,i'm bad at sports,i am bad at sports,soy malo en los deportes,je suis mauvais en sport,Ich bin schlecht im Sport
953,i'm being careful,i am being careful,estoy teniendo cuidado,je fais attention,Ich bin vorsichtig
954,i'm being patient,i am being patient,estoy siendo paciente,je suis patient,ich bin geduldig
