,English,English_cleaned,Spanish,French,German
268,i don't want it,i do not want it,no lo quiero,je ne le veux pas,ich will es nicht
269,i downloaded it,i downloaded it,lo descargué,je l'ai téléchargé,ich habe es heruntergeladen
270,i dried my face,i dried my face,me sequé la cara,j'ai séché mon visage,Ich habe mein Gesicht getrocknet
271,i drive to work,i drive to work,Conduzco al trabajo,je conduis pour aller au travail,Ich fahre zur Arbeit
272,i drove to work,i drove to work,conduje al trabajo,j'ai conduit au travail,Ich bin zur Arbeit gefahren
273,i enjoy reading,i enjoy reading,disfruto leer,J'aime lire,ich lese gerne
274,i enjoy working,i enjoy working,Yo disfruto trabajar,j'aime travailler,ich arbeite gern
275,i escaped death,i escaped death,escapé de la muerte,j'ai échappé à la mort,Ich bin dem Tod entronnen
276,i expected more,i expected more,esperaba mas,je m'attendais à plus,Ich habe mehr erwartet
277,i expected this,i expected this,esperaba esto,je m'y attendais,Ich habe dies erwartet
278,i fed the horse,i fed the horse,le di de comer al caballo,j'ai nourri le cheval,Ich habe das Pferd gefüttert
279,i feel betrayed,i feel betrayed,me siento traicionado,je me sens trahis,ich fühle mich betrogen
280,i feel feverish,i feel feverish,me siento febril,je me sens fiévreux,ich fühle mich fieberhaft
281,i feel fine now,i feel fine now,me siento bien ahora,je me sens bien maintenant,Ich fühle mich jetzt gut
282,i feel helpless,i feel helpless,Me siento impotente,Je me sens impuissant,Ich fühle mich hilflos
283,i feel his pain,i feel his pain,siento su dolor,je ressens sa douleur,Ich fühle seinen Schmerz
284,i feel homesick,i feel homesick,me siento nostalgico,j'ai le mal du pays,ich habe Heimweh
285,i feel horrible,i feel horrible,me siento horrible,je me sens horrible,Ich fühle mich schrecklich
286,i feel nauseous,i feel nauseous,Siento náuseas,Je me sens nauséeux,Mir ist übel
287,i feel relieved,i feel relieved,me siento aliviado,je me sens soulagé,Ich fühle mich erleichtert
288,i feel terrible,i feel terrible,Me siento terrible,je me sens mal,ich fühle mich schrecklich
289,i feel terrific,i feel terrific,me siento genial,je me sens super bien,Ich fühle mich großartig
290,i feel the same,i feel the same,siento lo mismo,je ressens la même chose,Ich fühle mich gleich
291,i felt betrayed,i felt betrayed,me sentí traicionado,je me suis senti trahi,ich fühlte mich betrogen
292,i felt isolated,i felt isolated,me sentí aislado,je me sentais isolé,Ich fühlte mich isoliert
293,i felt left out,i felt left out,me sentí excluido,je me suis senti exclu,ich fühlte mich ausgeschlossen
294,i felt relieved,i felt relieved,me sentí aliviado,je me suis senti soulagé,Ich fühlte mich erleichtert
295,i felt the same,i felt the same,sentí lo mismo,j'ai ressenti la même chose,mir ging es genauso
296,i finished last,i finished last,terminé último,j'ai fini dernier,Ich bin zuletzt fertig geworden
297,i fired the gun,i fired the gun,disparé el arma,j'ai tiré avec le pistolet,Ich habe die Waffe abgefeuert
298,i follow orders,i follow orders,sigo ordenes,je suis les commandes,Ich befolge Befehle
299,i forgot my bag,i forgot my bag,olvidé mi bolso,j'ai oublié mon sac,Ich habe meine Tasche vergessen
300,i forgot my key,i forgot my key,olvidé mi clave,j'ai oublié ma clé,Ich habe meinen Schlüssel vergessen
301,i forgot my pen,i forgot my pen,olvidé mi pluma,j'ai oublié mon stylo,Ich habe meinen Stift vergessen
302,i gave tom that,i gave tom that,le di a tom eso,je lui ai donné ça,das habe ich tom gegeben
303,i get up at six,i get up at six,me levanto a las seis,Je me lève à six heures,ich stehe um sechs auf
304,i go every year,i go every year,voy todos los años,je vais chaque année,Ich gehe jedes Jahr
305,i got a bargain,i got a bargain,tengo una ganga,j'ai fait une bonne affaire,Ich habe ein Schnäppchen gemacht
306,i got no answer,i got no answer,no obtuve respuesta,je n'ai pas de réponse,Ich habe keine Antwort bekommen
307,i got over that,i got over that,superé eso,j'ai surmonté ça,Ich habe das überwunden
308,i got remarried,i got remarried,me volví a casar,je me suis remarié,Ich habe wieder geheiratet
309,i got rid of it,i got rid of it,me deshice de eso,Je m'en suis débarrassé,ich bin es losgeworden
310,i got sunburned,i got sunburned,me queme el sol,j'ai eu un coup de soleil,Ich habe einen Sonnenbrand
311,i grow tomatoes,i grow tomatoes,cultivo tomates,je fais pousser des tomates,Ich baue Tomaten an
312,i guess it's ok,i guess it is ok,supongo que está bien,je suppose que c'est bon,"Ich denke, es ist in Ordnung"
313,i guessed right,i guessed right,adiviné bien,j'ai bien deviné,Ich habe richtig geraten
314,i had a bad day,i had a bad day,Tuve un mal día,J'ai eu une mauvaise journée,Ich hatte einen schlechten Tag
315,i had a seizure,i had a seizure,tuve una convulsión,j'ai eu une crise,Ich hatte einen Anfall
316,i had my doubts,i had my doubts,yo tenia mis dudas,j'avais des doutes,ich hatte meine zweifel
317,i had no choice,i had no choice,no tuve elección,Je n'avais pas de choix,Ich hatte keine Wahl
318,i had no doubts,i had no doubts,no tenía dudas,je n'avais aucun doute,Ich hatte keine Zweifel
319,i had some help,i had some help,tuve algo de ayuda,j'ai eu de l'aide,Ich hatte etwas Hilfe
320,i had to resign,i had to resign,tuve que renunciar,j'ai dû démissionner,ich musste kündigen
321,i hate children,i hate children,odio a los niños,je déteste les enfants,Ich hasse Kinder
322,i hate everyone,i hate everyone,Odio a todo el mundo,je hais tout le monde,ich hasse jeden
323,i hate fanatics,i hate fanatics,odio a los fanáticos,je déteste les fanatiques,Ich hasse Fanatiker
324,i hate fighting,i hate fighting,odio pelear,je déteste me battre,ich hasse kämpfen
325,i hate funerals,i hate funerals,odio los funerales,je déteste les enterrements,Ich hasse Beerdigungen
326,i hate my voice,i hate my voice,odio mi voz,je déteste ma voix,Ich hasse meine Stimme
327,i hate politics,i hate politics,Odio la política,je déteste la politique,Ich hasse Politik
328,i hate reptiles,i hate reptiles,odio los reptiles,je déteste les reptiles,Ich hasse Reptilien
329,i hate shopping,i hate shopping,odio ir de compras,je déteste faire du shopping,ich hasse Einkaufen
330,i hate studying,i hate studying,odio estudiar,je déteste étudier,Ich hasse lernen
331,i hate that guy,i hate that guy,odio a ese tipo,je déteste ce gars,Ich hasse diesen Typ
332,i hate them all,i hate them all,los odio a todos,je les hais tous,ich hasse sie alle
333,i hate this car,i hate this car,odio este auto,je déteste cette voiture,Ich hasse dieses Auto
334,i hate this job,i hate this job,odio este trabajo,je déteste ce travail,ich hasse diesen Job
335,i hate this rug,i hate this rug,odio esta alfombra,je déteste ce tapis,Ich hasse diesen Teppich
336,i hate violence,i hate violence,odio la violencia,je déteste la violence,Ich hasse Gewalt
337,i hate weddings,i hate weddings,odio las bodas,je déteste les mariages,Ich hasse Hochzeiten
338,i hate you both,i hate you both,los odio a los dos,je vous déteste tous les deux,Ich hasse euch beide
339,i have a bruise,i have a bruise,Tengo un moretón,J'ai un bleu,Ich habe eine Prellung
340,i have a laptop,i have a laptop,tengo una computadora portátil,j'ai un ordinateur portable,Ich habe einen Laptop
341,i have a lawyer,i have a lawyer,tengo un abogado,j'ai un avocat,Ich habe einen Anwalt
342,i have a minute,i have a minute,tengo un minuto,j'ai une minute,Ich habe eine Minute
343,i have a pencil,i have a pencil,yo tengo un lapiz,J'ai un crayon,Ich habe einen Stift
344,i have a secret,i have a secret,tengo un secreto,j'ai un secret,ich habe ein Geheimnis
345,i have a sister,i have a sister,tengo una hermana,j'ai une soeur,ich habe eine Schwester
346,i have an alibi,i have an alibi,tengo una coartada,j'ai un alibi,Ich habe ein Alibi
347,i have children,i have children,tengo hijos,j'ai des enfants,Ich habe Kinder
348,i have dandruff,i have dandruff,tengo caspa,j'ai des pellicules,Ich habe Schuppen
349,i have diabetes,i have diabetes,tengo diabetes,j'ai du diabète,Ich habe Diabetes
350,i have evidence,i have evidence,tengo evidencia,j'ai des preuves,Ich habe Beweise
351,i have finished,i have finished,he terminado,j'ai fini,ich bin fertig
352,i have homework,i have homework,tengo tarea,j'ai des devoirs,Ich habe Hausaufgaben
353,i have immunity,i have immunity,tengo inmunidad,j'ai l'immunité,Ich habe Immunität
354,i have no fever,i have no fever,no tengo fiebre,je n'ai pas de fièvre,Ich habe kein Fieber
355,i have no horse,i have no horse,no tengo caballo,je n'ai pas de cheval,Ich habe kein Pferd
356,i have no proof,i have no proof,no tengo pruebas,je n'ai aucune preuve,Ich habe keinen Beweis
357,i have returned,i have returned,he regresado,Je suis revenu,Ich bin zurück gekehrt
358,i have the keys,i have the keys,tengo las llaves,j'ai les clés,Ich habe die Schlüssel
359,i have to do it,i have to do it,tengo que hacerlo,je dois le faire,ich muss es tun
360,i have to fight,i have to fight,tengo que pelear,je dois me battre,ich muss kämpfen
361,i have to hurry,i have to hurry,Tengo prisa,je dois me dépêcher,Ich muss mich beeilen
362,i have to sleep,i have to sleep,Tengo que dormir,je dois dormir,ich muss schlafen
363,i have to study,i have to study,tengo que estudiar,je dois étudier,ich muss lernen
364,i have to think,i have to think,Tengo que pensar,je dois penser,Ich muss nachdenken
365,i have two cars,i have two cars,tengo dos autos,j'ai deux voitures,Ich habe zwei Autos
366,i have two cats,i have two cats,Tengo dos gatos,j'ai deux chats,Ich habe zwei Katzen
367,i have two jobs,i have two jobs,tengo dos trabajos,j'ai deux emplois,Ich habe zwei Jobs
368,i have two sons,i have two sons,Tengo dos hijos,j'ai deux fils,Ich habe zwei Söhne
369,i haven't eaten,i have not eaten,no he comido,je n'ai pas mangé,Ich habe nicht gegessen
370,i haven't slept,i have not slept,no he dormido,je n'ai pas dormi,ich habe nicht geschlafen
371,i haven't tried,i have not tried,no lo he probado,je n'ai pas essayé,Ich habe es nicht versucht
372,i hear laughing,i hear laughing,oigo reír,j'entends rire,ich höre lachen
373,i hear only you,i hear only you,solo te escucho a ti,je n'entends que toi,Ich höre nur dich
374,i heard a crash,i heard a crash,escuché un choque,j'ai entendu un crash,Ich habe einen Absturz gehört
375,i heard a noise,i heard a noise,escuché un ruido,j'ai entendu un bruit,ich hörte ein Geräusch
376,i heard screams,i heard screams,escuché gritos,j'ai entendu des cris,Ich hörte Schreie
377,i heard yelling,i heard yelling,escuché gritar,j'ai entendu crier,ich hörte schreien
378,i hired a guide,i hired a guide,contraté un guía,j'ai embauché un guide,Ich habe einen Führer engagiert
379,i hope tom wins,i hope tom wins,espero que tom gane,j'espère que Tom gagnera,"Ich hoffe, Tom gewinnt"
380,i hope it helps,i hope it helps,Espero que ayude,j'espère que ça aide,"Ich hoffe, es hilft"
381,i hope it rains,i hope it rains,espero que llueva,j'espère qu'il pleut,ich hoffe es regnet
382,i imagined that,i imagined that,me imaginé que,j'ai imaginé que,das hab ich mir vorgestellt
383,i just finished,i just finished,Acabo de terminar,Je viens de terminer,Ich bin fertig
384,i just found it,i just found it,lo acabo de encontrar,je viens de le trouver,ich habe es gerade gefunden
385,i just got here,i just got here,Acabo de llegar,je viens juste d'arriver,Ich bin gerade erst angekommen
386,i just got that,i just got that,acabo de recibir eso,je viens de recevoir ça,Ich habe das gerade bekommen
387,i just panicked,i just panicked,solo entré en pánico,je viens de paniquer,ich hatte einfach panik
388,i just showered,i just showered,acabo de ducharme,je viens de me doucher,ich habe gerade geduscht
389,i just told tom,i just told tom,acabo de decirle a tom,je viens de dire à tom,Ich habe Tom gerade gesagt
390,i just told him,i just told him,le acabo de decir,je viens de lui dire,Ich habe es ihm gerade gesagt
391,i knew the risk,i knew the risk,conocía el riesgo,je connaissais le risque,Ich kannte das Risiko
392,i knew too much,i knew too much,sabía demasiado,j'en savais trop,Ich wusste zu viel
393,i knew we'd win,i knew we would win,sabía que ganaríamos,je savais que nous gagnerions,"Ich wusste, dass wir gewinnen würden"
394,i know tom lied,i know tom lied,sé que tom mintió,je sais que tom a menti,"Ich weiß, dass Tom gelogen hat"
395,i know tom well,i know tom well,conozco bien a tom,je connais bien tom,Ich kenne Tom gut
396,i know all that,i know all that,yo se todo eso,je sais tout ça,ich weiß das alles
397,i know all this,i know all this,yo se todo esto,je sais tout ça,ich weiß das alles
398,i know her well,i know her well,la conozco bien,je la connais bien,ich kenne sie gut
399,i know it hurts,i know it hurts,Sé que duele,je sais que ça fait mal,"Ich weiß, es tut weh"
400,i know the girl,i know the girl,conozco a la chica,je connais la fille,Ich kenne das Mädchen
401,i know the song,i know the song,yo se la cancion,je connais la chanson,ich kenne das lied
402,i know them all,i know them all,los conozco a todos,je les connais tous,ich kenne sie alle
403,i know your son,i know your son,conozco a tu hijo,je connais ton fils,Ich kenne deinen Sohn
404,i laughed a lot,i laughed a lot,me reí mucho,j'ai beaucoup ri,ich lachte viel
405,i lay on my bed,i lay on my bed,me acuesto en mi cama,je suis allongé sur mon lit,Ich liege auf meinem Bett
406,i learned a lot,i learned a lot,Aprendí mucho,J'ai beaucoup appris,ich habe viel gelernt
407,i left the room,i left the room,salí de la habitación,j'ai quitté la chambre,Ich verließ das Zimmer
408,i lent him a cd,i lent him a cd,le presté un cd,je lui ai prêté un cd,Ich habe ihm eine CD geliehen
409,i lied about it,i lied about it,mentí sobre eso,j'ai menti à ce sujet,Ich habe darüber gelogen
410,i like baseball,i like baseball,me gusta el béisbol,J'aime le baseball,ich mag Baseball
411,i like cartoons,i like cartoons,me gustan los dibujos animados,j'aime les dessins animés,Ich mag Zeichentrickfilme
412,i like children,i like children,Me gustan los niños,j'aime les enfants,Ich mag Kinder
413,i like football,i like football,me gusta el fútbol,J'aime le football,Ich mag Fußball
414,i like it a lot,i like it a lot,me gusta mucho,je l'aime beaucoup,ich mag es sehr
415,i like old cars,i like old cars,me gustan los autos viejos,j'aime les vieilles voitures,Ich mag alte Autos
416,i like red wine,i like red wine,me gusta el vino tinto,j'aime le vin rouge,Ich mag Rotwein
417,i like sleeping,i like sleeping,me gusta dormir,J'aime dormir,Ich mag es zu schlafen
418,i like swimming,i like swimming,Me gusta nadar,J'aime nager,Ich gehe gerne Schwimmen
419,i like teaching,i like teaching,me gusta enseñar,j'aime enseigner,Ich mag es zu unterrichten
420,i like that job,i like that job,me gusta ese trabajo,j'aime ce travail,Ich mag diese Arbeit
421,i like that one,i like that one,me gusta ese,J'aime celui-là,ich mag das
422,i like the cold,i like the cold,Me gusta el frío,j'aime le froid,ich mag die Kälte
423,i like them all,i like them all,me gustan todos,Je les aime tous,ich mag sie alle
424,i like this job,i like this job,Me gusta este trabajo,j'aime ce travail,Ich mag diesen Job
425,i like this one,i like this one,me gusta este,J'aime celui la,Ich mag dieses
426,i like to dance,i like to dance,me gusta bailar,J'aime danser,Ich mag tanzen
427,i like to dream,i like to dream,me gusta soñar,j'aime rêver,ich träume gerne
428,i like to drink,i like to drink,Me gusta beber,J'aime boire,ich trinke gern
429,i like to laugh,i like to laugh,me gusta reír,J'aime rigoler,Ich lache gerne
430,i like to party,i like to party,me gusta salir de fiesta,J'aime faire la fête,"ich mag es, zu feiern"
431,i like westerns,i like westerns,Me gustan los Westerns,J'aime les Westerns,Ich mag Western
432,i like your car,i like your car,me gusta tu carro,J'aime ta voiture,Ich mag dein Auto
433,i like your dog,i like your dog,me gusta tu perro,J'aime ton chien,ich mag deinen Hund
434,i like your hat,i like your hat,Me gusta tu sombrero,J'aime ton chapeau,ich mag deinen Hut
435,i like your tie,i like your tie,me gusta tu corbata,j'aime ta cravate,Ich mag deine Krawatte
436,i lit the match,i lit the match,encendí el fósforo,j'ai allumé l'allumette,Ich habe das Streichholz angezündet
437,i live here now,i live here now,Vivo aquí ahora,j'habite ici maintenant,ich lebe jetzt hier
438,i live in japan,i live in japan,yo vivo en Japon,Je vis au Japon,Ich lebe in Japan
439,i lost interest,i lost interest,perdí interés,j'ai perdu tout intérêt,Ich habe das Interesse verloren
440,i lost my phone,i lost my phone,perdí mi teléfono,j'ai perdu mon téléphone,ich habe mein Telefon verloren
441,i lost my watch,i lost my watch,Perdí mi reloj,j'ai perdu ma montre,Ich habe meine Uhr verloren
442,i lost the game,i lost the game,Perdí el juego,j'ai perdu le jeu,Ich habe das Spiel verloren
443,i love barbecue,i love barbecue,me encanta la barbacoa,j'aime le barbecue,ich liebe grillen
444,i love children,i love children,amo a los niños,j'aime les enfants,ich liebe Kinder
445,i love comedies,i love comedies,amo las comedias,j'aime les comédies,Ich liebe Komödien
446,i love eggplant,i love eggplant,me encanta la berenjena,j'aime l'aubergine,Ich liebe Auberginen
447,i love learning,i love learning,me encanta aprender,j'aime apprendre,ich liebe es zu lernen
448,i love my house,i love my house,yo amo mi casa,J'aime ma maison,Ich liebe mein Haus
449,i love swimming,i love swimming,amo nadar,J'adore nager,Ich liebe Schwimmen
450,i love teaching,i love teaching,me encanta enseñar,j'aime enseigner,ich liebe es zu unterrichten
451,i love the rain,i love the rain,amo la lluvia,J'adore la pluie,Ich liebe den Regen
452,i love this car,i love this car,yo amo este carro,j'aime cette voiture,Ich liebe dieses Auto
453,i love this job,i love this job,amo este trabajo,j'aime ce travail,Ich liebe diesen Job
454,i love this one,i love this one,amo esto,J'aime celui la,Ich liebe dieses
455,i love to party,i love to party,me encanta la fiesta,j'aime faire la fête,Ich liebe es zu feiern
456,i love to sleep,i love to sleep,Amo dormir,J'aime dormir,ich liebe es zu schlafen
457,i love to teach,i love to teach,me encanta enseñar,j'aime enseigner,ich liebe es zu unterrichten
458,i love to write,i love to write,Me encanta escribir,j'aime écrire,"Ich liebe es, zuschreiben"
459,i love weddings,i love weddings,me encantan las bodas,j'aime les mariages,Ich liebe Hochzeiten
460,i love you both,i love you both,los amo a ambos,je vous aime tous les deux,ich liebe euch beide
461,i love you guys,i love you guys,los amo chicos,Je vous aime,Ich liebe euch
462,"i love you, tom",i love you  tom,te amo tom,je t'aime tom,ich liebe dich tom
463,"i love you, too",i love you  too,yo también te amo,je t'aime aussi,Ich liebe dich auch
464,i love your car,i love your car,me encanta tu coche,j'aime ta voiture,Ich liebe dein Auto
465,i love your son,i love your son,Amo a tu hijo,j'aime ton fils,Ich liebe deinen Sohn
466,i made brownies,i made brownies,hice brownies,j'ai fait des brownies,Ich habe Brownies gemacht
467,i made that one,i made that one,yo hice ese,j'ai fait celui-là,das habe ich gemacht
468,i made the deal,i made the deal,hice el trato,j'ai fait l'affaire,Ich habe den Deal gemacht
469,i made us lunch,i made us lunch,nos hice el almuerzo,je nous ai préparé le déjeuner,Ich habe uns Mittagessen gemacht
470,i meant no harm,i meant no harm,no quise hacer daño,je ne voulais pas de mal,Ich wollte nichts Böses
471,i met tom there,i met tom there,conocí a tom allí,j'ai rencontré Tom là-bas,Ich habe Tom dort getroffen
472,i might say yes,i might say yes,podría decir que sí,je pourrais dire oui,Ich könnte ja sagen
473,i miss all this,i miss all this,extraño todo esto,tout ça me manque,Ich vermisse das alles
474,i miss the army,i miss the army,extraño el ejercito,l'armée me manque,Ich vermisse die Armee
475,i missed supper,i missed supper,me perdí la cena,j'ai raté le souper,Ich habe das Abendessen verpasst
476,i misunderstood,i misunderstood,entendí mal,j'ai mal compris,ich habe es falsch verstanden
477,i motivated you,i motivated you,te motivé,je t'ai motivé,Ich habe dich motiviert
478,i must be blind,i must be blind,debo estar ciego,je dois être aveugle,Ich muss blind sein
479,i must be there,i must be there,debo estar allí,je dois être là,Ich muss da sein
480,i must continue,i must continue,debo continuar,je dois continuer,ich muss weitermachen
481,i must go alone,i must go alone,debo ir solo,je dois y aller seul,Ich muss alleine gehen
482,i must help you,i must help you,debo ayudarte,je dois t'aider,ich muss dir helfen
483,i need internet,i need internet,necesito internet,j'ai besoin d'internet,Ich brauche Internet
484,i need a change,i need a change,necesito un cambio,j'ai besoin d'un changement,ich brauche eine Veränderung
485,i need a doctor,i need a doctor,Necesito un médico,j'ai besoin d'un docteur,Ich brauche einen Arzt
486,i need a hammer,i need a hammer,Yo necesito un martillo,j'ai besoin d'un marteau,Ich brauche einen Hammer
487,i need a helmet,i need a helmet,necesito un casco,j'ai besoin d'un casque,Ich brauche einen Helm
488,i need a laptop,i need a laptop,necesito una computadora portátil,j'ai besoin d'un ordinateur portable,Ich brauche einen Laptop
489,i need a lawyer,i need a lawyer,necesito un abogado,j'ai besoin d'un avocat,Ich brauche einen Anwalt
490,i need a minute,i need a minute,necesito un minuto,j'ai besoin d'une minute,Ich brauche eine Minute
491,i need a pencil,i need a pencil,Necesito un Lapiz,j'ai besoin d'un stylo,Ich brauche einen Stift
492,i need a shower,i need a shower,necesito darme una ducha,J'ai besoin d'une douche,ich brauche eine Dusche
493,i need a tissue,i need a tissue,necesito un pañuelo,j'ai besoin d'un mouchoir,Ich brauche ein Taschentuch
494,i need a weapon,i need a weapon,necesito un arma,j'ai besoin d'une arme,Ich brauche eine Waffe
495,i need caffeine,i need caffeine,necesito cafeina,j'ai besoin de caféine,Ich brauche Koffein
496,i need evidence,i need evidence,necesito evidencia,j'ai besoin de preuves,Ich brauche Beweise
497,i need guidance,i need guidance,necesito orientación,j'ai besoin de conseils,Ich brauche Anleitung
498,i need help now,i need help now,necesito ayuda ahora,j'ai besoin d'aide maintenant,ich brauche jetzt hilfe
499,i need his help,i need his help,necesito su ayuda,j'ai besoin de son aide,Ich brauche seine Hilfe
500,i need his name,i need his name,necesito su nombre,j'ai besoin de son nom,Ich brauche seinen Namen
501,i need it today,i need it today,lo necesito hoy,j'en ai besoin aujourd'hui,ich brauche es heute
502,i need my sword,i need my sword,necesito mi espada,j'ai besoin de mon épée,Ich brauche mein Schwert
503,i need the keys,i need the keys,necesito las llaves,j'ai besoin des clés,Ich brauche die Schlüssel
504,i need the tape,i need the tape,necesito la cinta,j'ai besoin de la bande,Ich brauche das Band
505,i need this job,i need this job,necesito este trabajo,j'ai besoin de ce travail,Ich brauche diesen Job
506,i need this one,i need this one,necesito este,j'ai besoin de celui-ci,ich brauche diese
507,i need to shave,i need to shave,necesito afeitarme,j'ai besoin de me raser,ich muss mich rasieren
508,i need to sleep,i need to sleep,Necesito dormir,j'ai besoin de dormir,ich muss schlafen
509,i need to study,i need to study,necesito estudiar,J'ai besoin d'étudier,ich muss lernen
510,i need you here,i need you here,te necesito aquí,j'ai besoin de toi ici,ich brauche dich hier
511,i never noticed,i never noticed,nunca me di cuenta,je n'ai jamais remarqué,ist mir nie aufgefallen
512,i never said no,i never said no,nunca dije que no,je n'ai jamais dit non,Ich habe nie nein gesagt
513,i never saw you,i never saw you,nunca te vi,Je ne vous ai vu,Ich habe dich noch nie gesehen
514,i often do this,i often do this,a menudo hago esto,je fais souvent ça,ich mache das oft
515,i often see him,i often see him,a menudo lo veo,je le vois souvent,ich sehe ihn oft
516,i only need one,i only need one,solo necesito uno,je n'en ai besoin que d'un,Ich brauche nur einen
517,i ordered pizza,i ordered pizza,pedí pizza,j'ai commandé des pizzas,Ich habe Pizza bestellt
518,i outwitted him,i outwitted him,lo burlé,je l'ai déjoué,ich habe ihn überlistet
519,i owe you a lot,i owe you a lot,Te debo mucho,Je vous dois beaucoup,ich schulde dir eine Menge
520,i paid for them,i paid for them,pagué por ellos,je les ai payé,ich habe sie bezahlt
521,i paid my bills,i paid my bills,pagué mis cuentas,j'ai payé mes factures,Ich habe meine Rechnungen bezahlt
522,i paid my taxes,i paid my taxes,pagué mis impuestos,j'ai payé mes impôts,Ich habe meine Steuern bezahlt
523,i paid the bill,i paid the bill,Yo pagué la cuenta,j'ai payé la facture,Ich bezahlte die Rechnung
524,i play baseball,i play baseball,juego Baseball,je joue au baseball,Ich spiele Baseball
525,i played tennis,i played tennis,juego Tennis,J'ai joué au tennis,ich spielte Tennis
526,i prefer biking,i prefer biking,prefiero andar en bicicleta,je préfère le vélo,ich bevorzuge radfahren
527,i prefer coffee,i prefer coffee,prefiero el cafe,je préfère le café,ich bevorzuge kaffee
528,i put my hat on,i put my hat on,me puse el sombrero,je mets mon chapeau,Ich setze meinen Hut auf
529,i raise orchids,i raise orchids,planteo orquideas,j'élève des orchidées,Ich züchte Orchideen
