,English,English_cleaned,Spanish,French,German
0,you can study here,you can study here,puedes estudiar aqui,tu peux étudier ici,hier kannst du studieren
1,you can talk later,you can talk later,puedes hablar más tarde,tu peux parler plus tard,du kannst später reden
2,you can trust them,you can trust them,puedes confiar en ellos,vous pouvez leur faire confiance,du kannst ihnen vertrauen
3,you can't back out,you cannot back out,no puedes retroceder,tu ne peux pas reculer,du kannst nicht zurücktreten
4,you can't blame me,you cannot blame me,no me puedes culpar,tu ne peux pas me blâmer,du kannst mir keinen Vorwurf machen
5,you can't complain,you cannot complain,no puedes quejarte,tu ne peux pas te plaindre,du kannst dich nicht beschweren
6,you can't eat here,you cannot eat here,no puedes comer aqui,vous ne pouvez pas manger ici,Sie können hier nicht essen
7,you can't get both,you cannot get both,no puedes conseguir ambos,vous ne pouvez pas obtenir les deux,du kannst nicht beides bekommen
8,you can't go alone,you cannot go alone,no puedes ir solo,tu ne peux pas y aller seul,du kannst nicht alleine gehen
9,you can't go there,you cannot go there,no puedes ir allí,tu ne peux pas y aller,Sie können nicht dorthin gehen
10,you can't leave me,you cannot leave me,usted no me puede dejar,tu ne peux pas me quitter,Du kannst mich nicht verlassen
11,you can't quit now,you cannot quit now,no puedes renunciar ahora,tu ne peux pas arrêter maintenant,Du kannst jetzt nicht aufhören
12,you can't say that,you cannot say that,No puedes decir eso,tu ne peux pas dire ça,das kannst du nicht sagen
13,you can't use this,you cannot use this,no puedes usar esto,vous ne pouvez pas utiliser ceci,Sie können dies nicht verwenden
14,you cannot do this,you cannot do this,no puedes hacer esto,tu ne peux pas faire ça,du kannst das nicht machen
15,you didn't warn me,you did not warn me,no me avisaste,tu ne m'as pas prévenu,du hast mich nicht gewarnt
16,you don't scare me,you do not scare me,usted no me asusta,tu ne me fais pas peur,Du machst mir keine Angst
17,you freaked me out,you freaked me out,me asustaste,tu m'as fait flipper,du hast mich erschreckt
18,you get used to it,you get used to it,te acostumbras,tu t'y habitues,man gewöhnt sich daran
19,you guys are weird,you guys are weird,"chicos, ustedes son raros",vous êtes bizarre,ihr seid komisch
20,you guys look lost,you guys look lost,pareceis perdidos,vous avez l'air perdu,ihr seht verloren aus
21,you guys wait here,you guys wait here,ustedes esperen aquí,vous les gars attendez ici,ihr wartet hier
22,you had a long day,you had a long day,tuviste un día largo,tu as eu une longue journée,Du hattest einen langen Tag
23,you have a message,you have a message,tienes un mensaje,vous avez un message,Sie haben eine Nachricht
24,you have been busy,you have been busy,has estado ocupado,vous avez été occupé,du warst beschäftigt
25,you have cute eyes,you have cute eyes,tienes ojos lindos,tu as de jolis yeux,du hast süße augen
26,you have no choice,you have no choice,no tienes elección,tu n'as pas le choix,du hast keine Wahl
27,you have to get up,you have to get up,tienes que levantarte,tu dois te lever,du musst aufstehen
28,you have to resign,you have to resign,tienes que renunciar,tu dois démissionner,du musst kündigen
29,you have to see it,you have to see it,Tienes que verlo,Tu dois voir ça,das musst du sehen
30,you have two balls,you have two balls,tienes dos bolas,tu as deux balles,Du hast zwei Eier
31,you intimidate tom,you intimidate tom,intimidas a tom,tu intimides tom,Du schüchterst Tom ein
32,you just need help,you just need help,solo necesitas ayuda,tu as juste besoin d'aide,du brauchst nur hilfe
33,you know i'm wrong,you know i am wrong,sabes que estoy equivocado,tu sais que j'ai tort,"Du weißt, dass ich falsch liege"
34,you know how it is,you know how it is,tú sabes cómo es,tu sais comment c'est,du weisst wie das ist
35,you know the drill,you know the drill,ya sabes que hacer,Vous connaissez le refrain,Du kennst die Übung
36,you know the rules,you know the rules,sabes las reglas,tu connais les règles,du kennst die Regeln
37,you like elephants,you like elephants,te gustan los elefantes,tu aimes les éléphants,Du magst Elefanten
38,you look contented,you look contented,te ves contento,tu as l'air content,du siehst zufrieden aus
39,you look just fine,you look just fine,te ves muy bien,tu as l'air très bien,du siehst einfach gut aus
40,you look sad today,you look sad today,te ves triste hoy,tu as l'air triste aujourd'hui,Du siehst heute traurig aus
41,you look satisfied,you look satisfied,te ves satisfecho,tu as l'air satisfait,du siehst zufrieden aus
42,you look surprised,you look surprised,te ves sorprendido,tu as l'air surpris,du siehst überrascht aus
43,you look very good,you look very good,Te ves muy bien,tu sembles être en forme,du siehst sehr gut aus
44,you look very pale,you look very pale,te ves muy pálida,tu es très pâle,du siehst sehr blass aus
45,you made a promise,you made a promise,hiciste una promesa,tu as fait une promesse,du hast es versprochen
46,you may be correct,you may be correct,puede que tengas razón,tu as peut etre raison,Sie können Recht haben
47,you may use my car,you may use my car,puedes usar mi auto,vous pouvez utiliser ma voiture,Sie können mein Auto benutzen
48,you might be right,you might be right,puede que tengas razón,il se peut que vous ayez raison,Du hast vielleicht recht
49,you might get hurt,you might get hurt,podrías lastimarte,tu pourrais te blesser,Sie könnten verletzt werden
50,you might meet him,you might meet him,podrías conocerlo,tu pourrais le rencontrer,vielleicht triffst du ihn
51,you might try that,you might try that,podrías intentar eso,tu pourrais essayer ça,das könntest du versuchen
52,you must all leave,you must all leave,todos ustedes deben irse,vous devez tous partir,Sie müssen alle gehen
53,you must be joking,you must be joking,usted debe estar bromeando,Tu blagues,du machst Witze
54,you must be sleepy,you must be sleepy,debes tener sueño,tu dois avoir sommeil,Sie müssen müde sein
55,you must be strong,you must be strong,debes ser fuerte,Vous devez être fort,Du musst stark sein
56,you must find work,you must find work,debes encontrar trabajo,tu dois trouver du travail,Sie müssen Arbeit finden
57,you must get going,you must get going,debes irte,tu dois y aller,du musst los
58,you need a holiday,you need a holiday,necesitas unas vacaciones,tu as besoin de vacances,Sie brauchen Urlaub
59,you need a new car,you need a new car,necesitas un auto nuevo,tu as besoin d'une nouvelle voiture,Sie brauchen ein neues Auto
60,you need to fix it,you need to fix it,necesitas arreglarlo,vous devez le réparer,Sie müssen es reparieren
61,you need to let go,you need to let go,tienes que dejar ir,tu dois lâcher prise,du musst loslassen
62,you only live once,you only live once,sólo se vive una vez,on ne vit qu'une fois,man lebt schließlich nur einmal
63,you owe me a favor,you owe me a favor,me debes un favor,tu me dois une faveur,Du schuldest mir einen Gefallen
64,you party too much,you party too much,festejas demasiado,tu fais trop la fête,Du feierst zu viel
65,you people are mad,you people are mad,ustedes estan locos,vous êtes fous,ihr seid verrückt
66,you ruined my life,you ruined my life,usted arruino mi vida,Tu as ruiné ma vie,Du hast mein Leben ruiniert
67,you seem confident,you seem confident,pareces confiado,tu as l'air confiant,du wirkst zuversichtlich
68,you seem depressed,you seem depressed,pareces deprimido,tu as l'air déprimé,du wirkst deprimiert
69,you seem different,you seem different,pareces diferente,tu sembles différent,du wirkst anders
70,you seem very busy,you seem very busy,pareces muy ocupado,tu as l'air très occupé,du scheinst sehr beschäftigt zu sein
71,you should do that,you should do that,debes hacer eso,tu devrais faire ça,Du solltest das tun
72,you should go home,you should go home,deberías ir a casa,vous devriez aller à la maison,du solltest nach Hause gehen
73,you should know it,you should know it,deberías saberlo,tu devrais le savoir,Du solltest es wissen
74,you should turn in,you should turn in,deberías entregar,tu devrais te rendre,du solltest dich einklinken
75,you smell terrible,you smell terrible,hueles terrible,tu sens mauvais,du stinkst fürchterlich
76,you speak too much,you speak too much,hablas demasiado,tu parles trop,du sprichst zu viel
77,you take the money,you take the money,tu tomas el dinero,tu prends l'argent,Du nimmst das Geld
78,you taught me that,you taught me that,tu me enseñaste eso,tu m'as appris ça,das hast du mir beigebracht
79,you taught us that,you taught us that,tu nos enseñaste eso,tu nous l'as appris,das hast du uns beigebracht
80,you were bad at it,you were bad at it,lo hiciste mal,tu étais mauvais à ça,du warst schlecht darin
81,you were fantastic,you were fantastic,estuviste fantástico,tu étais fantastique,Du warst fantastisch
82,you were in a coma,you were in a coma,estabas en coma,tu étais dans le coma,Du lagst im Koma
83,you were in danger,you were in danger,estabas en peligro,tu étais en danger,du warst in Gefahr
84,you were my friend,you were my friend,eras mi amigo,tu étais mon ami,du warst mein Freund
85,you were so strong,you were so strong,eras tan fuerte,tu étais si fort,Du warst so stark
86,you won everything,you won everything,ganaste todo,tu as tout gagné,du hast alles gewonnen
87,you won't be fired,you will not be fired,no serás despedido,tu ne seras pas licencié,Sie werden nicht entlassen
88,you'd better hurry,you would better hurry,será mejor que te des prisa,tu ferais mieux de te dépêcher,du solltest dich besser beeilen
89,you'll bounce back,you will bounce back,te recuperarás,tu rebondiras,du wirst zurückschlagen
90,you'll feel better,you will feel better,te sentirás mejor,vous vous sentirez mieux,du wirst dich besser fühlen
91,you'll get over it,you will get over it,Lo superarás,tu vas t'en remettre,Du wirst darüber hinwegkommen
92,you're a big softy,you are a big softy,eres un gran blandengue,tu es un gros doudou,Du bist ein großer Weichling
93,you're a funny gal,you are a funny gal,eres una chica divertida,tu es une drôle de fille,Du bist ein lustiges Mädchen
94,you're a funny guy,you are a funny guy,Eres un chico divertido,tu es un drôle de gars,Du bist ein lustiger Typ
95,you're a funny man,you are a funny man,eres un hombre divertido,tu es un drôle d'homme,Du bist ein lustiger Mann
96,you're a good liar,you are a good liar,eres un buen mentiroso,tu es un bon menteur,Du bist ein guter Lügner
97,you're a great guy,you are a great guy,eres un gran tipo,tu es un gars formidable,Du bist ein toller Kerl
98,you're a real pain,you are a real pain,eres un verdadero dolor,tu es une vraie douleur,Du bist ein echter Schmerz
99,you're a smart boy,you are a smart boy,eres un chico inteligente,tu es un garçon intelligent,Du bist ein kluger Junge
100,you're a weird kid,you are a weird kid,eres un niño raro,tu es un enfant bizarre,Du bist ein komisches Kind
101,you're a woman now,you are a woman now,eres una mujer ahora,tu es une femme maintenant,du bist jetzt eine frau
102,you're about right,you are about right,tienes razón,tu as à peu près raison,du hast ungefähr recht
103,you're all cowards,you are all cowards,todos ustedes son cobardes,vous êtes tous des lâches,Sie sind alle Feiglinge
104,you're all invited,you are all invited,están todos invitados,vous êtes tous invités,ihr seid alle eingeladen
105,you're all racists,you are all racists,todos ustedes son racistas,vous êtes tous racistes,Sie sind alle Rassisten
106,you're annoying me,you are annoying me,me estas molestando,tu m'agaces,du regst mich auf
107,you're avoiding me,you are avoiding me,me estas evitando,tu m'évites,du meidest mich
108,you're being silly,you are being silly,estás siendo tonto,tu es stupide,du bist albern
109,you're being weird,you are being weird,estas siendo raro,tu es bizarre,du bist komisch
110,you're both pretty,you are both pretty,ambos son bonitos,vous êtes jolies toutes les deux,ihr seid beide hübsch
111,you're considerate,you are considerate,eres considerado,tu es prévenant,du bist rücksichtsvoll
112,you're cooperating,you are cooperating,tu estas cooperando,vous coopérez,Sie kooperieren
113,you're extroverted,you are extroverted,eres extrovertido,tu es extravertie,du bist extrovertiert
114,you're fascinating,you are fascinating,eres fascinante,tu es fascinant,du bist faszinierend
115,you're fashionable,you are fashionable,estas de moda,tu es à la mode,du bist in Mode
116,you're hurting him,you are hurting him,lo estas lastimando,tu lui fais mal,du tust ihm weh
117,you're influential,you are influential,eres influyente,tu es influent,du bist einflussreich
118,you're lying again,you are lying again,estás mintiendo otra vez,tu mens encore,du lügst schon wieder
119,you're lying to me,you are lying to me,estás mintiéndome,vous me mentez,du lügst mich an
120,you're my daughter,you are my daughter,tu eres mi hija,tu es ma fille,du bist meine Tochter
121,you're my princess,you are my princess,tú eres mi princesa,vous êtes ma princesse,Du bist meine Prinzessin
122,you're not a loser,you are not a loser,No eres un perdedor,tu n'es pas un perdant,du bist kein Verlierer
123,you're not bruised,you are not bruised,no estas magullado,tu n'es pas meurtri,du bist nicht verletzt
124,you're not dressed,you are not dressed,no estas vestido,tu n'es pas habillé,du bist nicht angezogen
125,you're not helping,you are not helping,no estas ayudando,tu n'aides pas,du hilfst nicht
126,you're not like me,you are not like me,tu no eres como yo,tu n'es pas comme moi,Du bist nicht wie ich
127,you're not my type,you are not my type,no eres mi tipo,Tu n'es pas mon genre,Du bist nicht mein Typ
128,you're not special,you are not special,no eres especial,tu n'es pas spécial,du bist nicht besonders
129,you're on the list,you are on the list,estas en la lista,tu es sur la liste,du bist auf der liste
130,you're out of luck,you are out of luck,no tienes suerte,tu n'as pas de chance,Du hast kein Glück
131,you're out of time,you are out of time,estas fuera de tiempo,vous manquez de temps,du hast keine zeit mehr
132,you're pretty good,you are pretty good,eres bastante bueno,Tu es plutôt bien,du bist ziemlich gut
133,you're quite smart,you are quite smart,eres bastante inteligente,tu es assez intelligent,du bist ziemlich schlau
134,you're replaceable,you are replaceable,eres reemplazable,tu es remplaçable,du bist ersetzbar
135,you're resourceful,you are resourceful,eres ingenioso,tu es débrouillard,du bist einfallsreich
136,you're so paranoid,you are so paranoid,eres tan paranoico,tu es tellement paranoïaque,Du bist so paranoid
137,you're so pathetic,you are so pathetic,eres muy patético,tu es tellement pathétique,du bist so erbärmlich
138,you're so romantic,you are so romantic,eres tan romántico,Vous êtes tellement romantique,Du bist so romantisch
139,you're so talented,you are so talented,eres muy talentoso,Tu es si talentueux,du bist so talentiert
140,you're still alive,you are still alive,todavía estás vivo,vous êtes toujours en vie,du bist noch am Leben
141,you're still green,you are still green,todavía estás verde,tu es encore vert,du bist immer noch grün
142,you're still young,you are still young,continúas siendo joven,tu es encore jeune,du bist noch jung
143,you're such a jerk,you are such a jerk,Eres un idiota,tu est vraiment un imbécile,Du bist so ein Idiot
144,you're such a liar,you are such a liar,Eres un mentiroso,tu es un menteur,du bist so ein Lügner
145,you're such a wimp,you are such a wimp,eres un cobarde,tu es une telle mauviette,du bist so ein Weichei
146,you're the experts,you are the experts,ustedes son los expertos,vous êtes les experts,Sie sind die Experten
147,you're the teacher,you are the teacher,tu eres el maestro,vous êtes l'enseignant,du bist der Lehrer
148,you're touching me,you are touching me,me estas tocando,tu me touches,du berührst mich
149,you're trustworthy,you are trustworthy,eres digno de confianza,tu es digne de confiance,du bist vertrauenswürdig
150,you're turning red,you are turning red,te estas poniendo rojo,tu deviens rouge,du wirst rot
151,you're unambitious,you are unambitious,eres poco ambicioso,tu n'es pas ambitieux,du bist ehrgeizig
152,you're very astute,you are very astute,eres muy astuto,tu es très astucieux,du bist sehr schlau
153,you're very clever,you are very clever,eres muy listo,vous êtes très intelligent,du bist sehr klug
154,you're very direct,you are very direct,eres muy directo,tu es très directe,du bist sehr direkt
155,you're very lonely,you are very lonely,estas muy solo,tu es très seul,du bist sehr einsam
156,you're very pretty,you are very pretty,eres muy guapa,tu es très jolie,du bist sehr schön
157,you're very strong,you are very strong,eres muy fuerte,tu es très fort,du bist sehr stark
158,you're wrong again,you are wrong again,te equivocas de nuevo,tu as encore tort,du liegst wieder falsch
159,you've been warned,you have been warned,usted ha sido advertido,Tu étais prévenu,du wurdest gewarnt
160,you've betrayed us,you have betrayed us,nos has traicionado,tu nous as trahi,du hast uns verraten
161,you've done enough,you have done enough,has hecho suficiente,tu en as assez fait,du hast genug getan
162,you've got a fever,you have got a fever,tienes fiebre,tu as de la fièvre,du hast Fieber
163,you've got nothing,you have got nothing,no tienes nada,tu n'as rien,du hast nichts
164,you've got to hide,you have got to hide,tienes que esconderte,tu dois te cacher,du musst dich verstecken
165,you've got to move,you have got to move,tienes que moverte,tu dois bouger,du musst dich bewegen
166,you've got to wait,you have got to wait,tienes que esperar,tu dois attendre,du musst warten
167,you've said enough,you have said enough,has dicho suficiente,tu en as assez dit,du hast genug gesagt
168,you've seen enough,you have seen enough,has visto suficiente,tu en as assez vu,du hast genug gesehen
169,you've worked hard,you have worked hard,has trabajado duro,Tu as travaillé dur,Du hast hart gearbeitet
170,your bath is ready,your bath is ready,tu baño esta listo,votre bain est prêt,Ihr Bad ist fertig
171,your car's on fire,your car s on fire,tu coche está en llamas,ta voiture est en feu,Dein Auto brennt
172,your face is dirty,your face is dirty,tu cara esta sucia,ton visage est sale,dein Gesicht ist schmutzig
173,your lips are blue,your lips are blue,tus labios son azules,tes lèvres sont bleues,Deine Lippen sind blau
174,your place or mine,your place or mine,Tu lugar o el mio,chez toi ou chez moi,Dein Platz oder meiner
175,your room is ready,your room is ready,tu habitación está lista,ta chambre est prête,Ihr Zimmer ist fertig
176,"trust me, he said",trust me  he said,créeme dijo,crois moi il a dit,"vertrau mir, sagte er"
177,a dog has four legs,a dog has four legs,un perro tiene cuatro patas,un chien a quatre pattes,ein hund hat vier beine
178,a nap would be good,a nap would be good,una siesta estaría bien,une sieste serait bien,ein Nickerchen wäre gut
179,a noise woke her up,a noise woke her up,un ruido la despertó,un bruit la réveilla,ein Geräusch weckte sie
180,a nurse wears white,a nurse wears white,una enfermera viste de blanco,une infirmière porte du blanc,Eine Krankenschwester trägt Weiß
181,a rose smells sweet,a rose smells sweet,una rosa huele dulce,une rose sent bon,eine Rose riecht süß
182,a storm is imminent,a storm is imminent,una tormenta es inminente,une tempête est imminente,ein Sturm steht bevor
183,a truck hit the dog,a truck hit the dog,un camión atropelló al perro,un camion a heurté le chien,Ein LKW hat den Hund angefahren
184,a whale is a mammal,a whale is a mammal,una ballena es un mamifero,une baleine est un mammifère,ein Wal ist ein Säugetier
185,acid acts on metals,acid acts on metals,el ácido actúa sobre los metales,l'acide agit sur les métaux,Säure wirkt auf Metalle
186,action is necessary,action is necessary,la acción es necesaria,une action est nécessaire,Handeln ist notwendig
187,advice is like salt,advice is like salt,el consejo es como la sal,un conseil c'est comme du sel,Ratschläge sind wie Salz
188,all i have is books,all i have is books,todo lo que tengo son libros,"tout ce que j'ai, ce sont des livres","Alles, was ich habe, sind Bücher"
189,all i want is money,all i want is money,todo lo que quiero es dinero,tout ce que je veux c'est de l'argent,alles was ich will ist geld
190,all is well with me,all is well with me,todo está bien conmigo,tout va bien pour moi,bei mir ist alles gut
191,all of us are happy,all of us are happy,todos somos felices,nous sommes tous heureux,wir alle sind glücklich
192,all sales are final,all sales are final,todas las ventas son finales,toutes les ventes sont finales,Alle Verkäufe sind endgültig
193,all share the blame,all share the blame,todos comparten la culpa,partagent tous le blâme,alle teilen die schuld
194,all you do is party,all you do is party,todo lo que haces es fiesta,tout ce que tu fais c'est faire la fête,"alles, was Sie tun, ist Party"
195,allow me to explain,allow me to explain,permítanme explicar,permettez-moi d'expliquer,lassen Sie mich erklären
196,am i disturbing you,am i disturbing you,Te estoy molestando,Je vous dérange,Störe ich
197,am i going too fast,am i going too fast,¿Estoy yendo demasiado rápido?,est-ce que je vais trop vite,bin ich zu schnell
198,america is very big,america is very big,América es muy grande,l'amérique est très grande,Amerika ist sehr groß
199,answer me right now,answer me right now,respondeme ahora mismo,réponds moi tout de suite,antworte mir gleich
200,answer the question,answer the question,responde la pregunta,répondre à la question,beantworte die Frage
201,anybody can do that,anybody can do that,cualquiera puede hacer eso,n'importe qui peut faire ça,das kann jeder
202,anybody can do this,anybody can do this,cualquiera puede hacer esto,n'importe qui peut faire ça,das kann jeder
203,anybody can read it,anybody can read it,cualquiera puede leerlo,n'importe qui peut le lire,jeder kann es lesen
204,anybody want a beer,anybody want a beer,alguien quiere una cerveza,quelqu'un veut une bière,will jemand ein bier
205,anybody want a lift,anybody want a lift,alguien quiere un ascensor,quelqu'un veut un ascenseur,jemand will eine Mitfahrgelegenheit
206,"anyhow, let's begin",anyhow  let us begin,de todos modos comencemos,de toute façon commençons,lasst uns trotzdem beginnen
207,anything can happen,anything can happen,cualquier cosa puede suceder,tout peut arriver,Alles kann passieren
208,anything's possible,anything s possible,todo es posible,tout est possible,alles ist möglich
209,are seats available,are seats available,hay asientos disponibles,sont des places disponibles,sind Sitzplätze vorhanden
210,are there any risks,are there any risks,hay algun riesgo,y a-t-il des risques,gibt es risiken
211,are there survivors,are there survivors,¿Hay sobrevivientes?,y a-t-il des survivants,gibt es Überlebende
212,are they all strong,are they all strong,¿Son todos fuertes?,sont-ils tous forts,sind sie alle stark
213,are we just friends,are we just friends,somos solo amigos,sommes-nous juste amis,sind wir nur Freunde
214,are we leaving soon,are we leaving soon,¿nos vamos pronto?,partons-nous bientôt,reisen wir bald ab
215,are you a policeman,are you a policeman,eres policia,êtes-vous un policier,Bist du ein Polizist
216,are you almost here,are you almost here,¿Ya casi estás aquí?,es-tu presque là,bist du fast hier
217,are you avoiding me,are you avoiding me,me estas evadiendo,est-ce que tu m'évites,Gehst du mir aus dem Weg
218,are you by yourself,are you by yourself,estás solo,es-tu tout seul,Bist du alleine
219,are you comfortable,are you comfortable,Estás cómodo,es-tu installé confortablement,bist du bequem
220,are you coming down,are you coming down,estas bajando,tu descends,kommst du runter
221,are you enjoying it,are you enjoying it,lo estás disfrutando,Est-ce que tu aimes ça,macht es dir Spass
222,are you even trying,are you even trying,Estás Si quiera intentándolo,es-tu même en train d'essayer,Versuchst du es überhaupt
223,"are you hungry, too",are you hungry  too,¿Tienes hambre también?,as-tu faim aussi,hast du auch hunger
224,are you kids hungry,are you kids hungry,"¿Están hambrientos, niños?",est-ce que vos enfants ont faim,seid ihr kinder hungrig
225,are you leaving now,are you leaving now,Ya te vas,pars-tu maintenant,Gehst du jetzt
226,are you lying to me,are you lying to me,me estas mintiendo,est-ce que tu me mens,lügst du mich an
227,are you on facebook,are you on facebook,Tienes Facebook,Êtes-vous sur Facebook,bist du auf facebook
228,are you on the list,are you on the list,Estás en la lista,êtes-vous sur la liste,stehst Du auf der Liste
229,are you people lost,are you people lost,¿Estáis perdidos?,êtes-vous des gens perdus,seid ihr verloren
230,are you proud of me,are you proud of me,Estás orgulloso de mí,es-tu fier de moi,bist du stolz auf mich
231,are you ready to go,are you ready to go,estas listo para ir,êtes-vous prêt à aller,bist du bereit zu gehen
232,are you really sick,are you really sick,¿Estás realmente enfermo?,es-tu vraiment malade,bist du wirklich krank
233,are you resourceful,are you resourceful,eres ingenioso,êtes-vous ingénieux,bist du einfallsreich
234,are you settling in,are you settling in,¿Te estás instalando?,est-ce que tu t'installes,lebst du dich ein
235,are you still awake,are you still awake,sigues despierto,es-tu toujours réveillé,bist du noch wach
